类别,电影详情页url,电影名,年份,标签,导演,编剧,演员,评分,简介,海报url
热门,https://movie.douban.com/subject/34888057/,甘草披萨 Licorice Pizza,2021,剧情/喜剧,保罗·托马斯·安德森,保罗·托马斯·安德森,阿拉娜·哈伊姆/库珀·霍夫曼/斯凯勒·吉桑多/玛丽·伊丽莎白·埃利斯/约翰·迈克尔·辛吉斯/克斯汀·埃伯索尔/哈里特·桑塞姆·哈里斯/西恩·潘/汤姆·威兹/布莱德利·库珀/瑞恩·赫芬顿/内特·曼/本·萨弗迪/约瑟夫·克罗斯/丹妮尔·哈伊姆/埃斯特·哈伊姆/莫迪·哈伊姆/唐娜·哈伊姆/玛娅·鲁道夫/约翰·C·赖利/艾玛·杜蒙特/萨沙·斯皮尔伯格/德莱纳·米切尔/利兹·卡科斯基/泰勒·杨/Josh Monkarsh/马克斯·米切尔/Tim Conway Jr./伊亚娜·哈雷/艾米莉·奥尔索斯/克雷格·斯塔克/雷·蔡斯/可可·索伦/伊莎贝尔·库斯曼/雷·尼科尔森/贾亮/Harrison Bray/Will Angarola/Dexter Demme/River Cornwell/James Kelley/Dorie Samovitz/Savannah Ioakimedes/Adam Somner/Joshua Carl Allen/Karissa Reynafarje/Anna Cordell/Griff Giacchino,6.8,这部影片以20世纪70年代为背景，故事围绕一位高中生，讲述了阿拉娜·凯恩和加里·瓦伦丁在1973年在圣费尔南多谷成长、四处奔波和坠入爱河的故事。,https://img2.doubanio.com/view/photo/s_ratio_poster/public/p2867240673.jpg
热门,https://movie.douban.com/subject/34953744/,孵化 Pahanhautoja,2022,恐怖,汉娜·伯格霍尔姆,伊利亚·劳齐,西里·索拉林纳/索菲娅·黑基莱/亚尼·沃拉宁/雷诺·诺丁/Oiva Ollila/Ida Määttänen/萨伊亚·伦托宁/Stella Leppikorpi/Hertta Nieminen/Aada Punakivi/Hertta Karen/Jonna Aaltonen/Miroslava Agejeva,6.3,本片讲述一个12岁的完美主义女孩发现了一个奇怪的蛋，她把蛋藏起来不让苛刻的母亲看到。而当蛋孵化时，一个像鸟一样的生物出现了。,https://img9.doubanio.com/view/photo/s_ratio_poster/public/p2633032885.jpg
热门,https://movie.douban.com/subject/35871767/,东北告别天团,2022,喜剧,崔志佳,崔志佳/王子扬,崔志佳/宋晓峰/张琪/老四/刁彪/李昆鹰/于洋/孙越/梁龙/赵海燕/张子栋/韩彦博/衣云鹤/美娜/李会长,5.9,范大明白（崔志佳 饰）在东北从事着白事行业，与众不同的是，范大明白愿意接纳刑满释放的人，为他们提供工作机会。这一天，一名叫做牛硬朗（宋晓峰 饰）的男人来到店里，抛出了豪华大单——三百万的葬礼，范大明白及团队惊讶不已……在办葬礼的过程中，范大明白和牛硬朗才发现，原来二人之间的渊源不止如此……,https://img2.doubanio.com/view/photo/s_ratio_poster/public/p2872048832.jpg
热门,https://movie.douban.com/subject/34970181/,亚当计划 The Adam Project,2022,喜剧/动作/科幻,肖恩·利维,乔纳森·崔普尔/T·S·诺林/珍妮佛·弗莱基特/马克·莱温,瑞安·雷诺兹/沃克·斯科贝尔/马克·鲁弗洛/詹妮弗·加纳/佐伊·索尔达娜/凯瑟琳·基纳/小亚历克斯·马里亚里/布拉克斯顿·比肯/卡斯拉·王/露西·格斯特/唐纳德·沙利斯/埃斯特·李/本·威尔金森/以赛亚·海格特/米洛·山德尔,6.3,一名飞行员穿越时空，与年轻的自己和已故的父亲一起面对过去，拯救未来。,https://img2.doubanio.com/view/photo/s_ratio_poster/public/p2869545761.jpg
热门,https://movie.douban.com/subject/35498086/,留在身旁 Don't Make Me Go,2022,剧情,汉娜·马克斯,薇拉·赫伯特,约翰·赵/米娅·伊萨克/卡雅·斯考达里奥/乔希·汤姆森/奥蒂斯·丹吉/斯蒂芬妮娅·欧文/米切尔·霍普/Jen Van Epps/杰梅奈·克莱门特/Quentin Warren/伊丽莎白·霍桑/Graham Vincent/乔丹·穆尼/Timothy MacDonald/Madeleine McCarthy/Jade Harlow/西蒙·米德/Arlo Gibson/Claire Chitham/莫嘉娜·奥莱利/汉娜·马克斯,6.6,"When a single father to a teenage daughter learns that he has a fatal brain tumor, he takes her on a road trip to find the mother who abandoned her years before and to try to teach her everything she might need over the rest of her life.",https://img2.doubanio.com/view/photo/s_ratio_poster/public/p2874257442.jpg
热门,https://movie.douban.com/subject/35712836/,奇巧计程车 剧场版 オッドタクシー イン・ザ・ウッズ,2022,动画,木下麦,此元和津也,花江夏树/饭田里穗/木村良平/山口胜平/三森铃子/小泉萌香/村上真夏/昴生/亚生/福田佑亮/津田篤宏/たかし/村上知子/浜田賢二/酒井广大/齐藤壮马,6.1,性格乖僻、沉默寡言的出租车司机小户川，卷入女子高中生失踪事件。,https://img2.doubanio.com/view/photo/s_ratio_poster/public/p2867213913.jpg
热门,https://movie.douban.com/subject/30344474/,暗处的女儿 The Lost Daughter,2021,剧情,玛吉·吉伦哈尔,玛吉·吉伦哈尔/埃莱娜·费兰特,奥利维娅·科尔曼/达科塔·约翰逊/彼得·萨斯加德/杰西·巴克利/保罗·麦斯卡/阿尔芭·罗尔瓦赫尔/奥利弗·杰森-科恩/达格玛拉·多敏齐克/杰克·法辛/艾德·哈里斯/帕诺斯·科罗尼斯/瓦西利斯·科卡拉尼/尼克斯·普尔索尼迪斯/Ellie James/Yiannis Cheliotis/Abe Cohen/Ellie Mae Blake,7.5,莱达（奥利维娅·科尔曼饰）一个人前往海滩度假，在海滩上，她注意到一对年轻母女，并难以移开视线。她们之间引人注目的关系，以及她们吵闹、绝非善茬的家庭成员都让莱达感到不安，她想起自己刚做母亲时的恐惧、困惑和种种劳苦。一个无心之举，更是将莱达抛入了连她自己都感到陌生和不祥的内心世界，在那里，她看到了自己的过去：在她还是一名年轻妈妈时，她做出了非同寻常的选择，并迎来一系列后果。该片是玛吉·吉伦哈尔的导演处女作，她将埃琳娜·费兰特的小说改编为该片的剧本。《暗处的女儿》主演阵容还包括达科塔·约翰逊、杰西·巴克利、艾德·哈里斯、彼得·萨斯加德、保罗·麦斯卡和达格玛拉·多敏齐克。,https://img9.doubanio.com/view/photo/s_ratio_poster/public/p2689478834.jpg
热门,https://movie.douban.com/subject/26140265/,新生化危机 Resident Evil: Welcome to Raccoon City,2021,动作/科幻/恐怖,约翰内斯·罗伯茨,约翰内斯·罗伯茨,汉娜·乔恩-卡门/卡雅·斯考达里奥/尼尔·麦克唐纳/汤姆·霍珀/罗比·阿梅尔/阿万·乔贾/唐纳尔·罗格/高莉莉/内森·达莱斯/斯蒂芬妮·霍金斯/乔什·克鲁达斯/查德·洛克/珍妮特·波特/帕梅拉·麦克唐纳/霍莉·德·巴罗斯/萨米·阿泽罗/帕特·桑顿/达伦·W·马吕努克/卡森`曼宁,4.6,浣熊市曾是蓬勃发展的制药巨头——伞公司(Umbrella Corporation)的总部所在地，现在却是一个死气沉沉的中西部小镇。,https://img3.doubanio.com/view/photo/s_ratio_poster/public/p2692391480.jpg
热门,https://movie.douban.com/subject/34981939/,偷窥者 The Voyeurs,2021,惊悚,迈克尔·莫汉,迈克尔·莫汉,西德妮·斯威尼/贾斯蒂斯·史密斯/本·哈迪/刘承羽/Katharine King So/Cait Alexander/Caitlyn Sponheimer/Daniel Grogan/Madelline Harvey/Sarah Donna/Noah Parker/Emily Shelton/Blessing Adedijo/Jillian Harris/Jimmy Caspeur,6.8,皮帕和托马斯搬进了他们梦寐以求的公寓，他们注意到他们的窗户正对着对面的公寓——邀请他们亲眼目睹街对面这对迷人夫妇的不稳定关系。但当他们试图以匿名方式介入他们的生活时，他们不知不觉地引发了一系列将导致灾难的事件。,https://img2.doubanio.com/view/photo/s_ratio_poster/public/p2681328483.jpg
热门,https://movie.douban.com/subject/35732705/,暂无出口 No Exit,2022,剧情/惊悚,达米恩·鲍尔,安德鲁·贝伦/加百利·法拉利,哈瓦娜·罗丝·刘/丹尼·拉米雷斯/大卫·里达尔/米拉·哈里斯/丹尼斯·海斯伯特/戴尔·迪奇/本尼迪克特·沃尔/诺米·科恩/詹姆斯·盖林/丽莎·张/尼克·戴维斯/欧慧灵/珍·范·埃普斯/柯丝蒂·汉密尔顿,6.5,该影片改编自同名小说，讲述暴风雪后一名女大学生，不得不与一群陌生人困在山区一个的高速公路休息区，与世隔绝。雪上加霜的是，她发现了有人的车里藏了一个被绑架的孩子，她不得不通过一场生死决斗来找出隐藏其中的绑架者。,https://img9.doubanio.com/view/photo/s_ratio_poster/public/p2867486005.jpg
热门,https://movie.douban.com/subject/33957717/,奇奇与蒂蒂：救援突击队 Chip 'n' Dale: Rescue Rangers,2022,喜剧/动画/悬疑,阿吉瓦·沙弗尔,丹·格雷戈尔/道格·曼德,安迪·萨姆伯格/约翰·木兰尼/琪琪·莱恩/威尔·阿奈特/艾瑞克·巴纳/弗卢拉·博格/丹尼斯·海斯伯特/科甘-迈克尔·凯/特蕾丝·麦克尼尔/蒂姆·罗宾逊/塞斯·罗根/J·K·西蒙斯/达旺·麦克唐纳/阿吉瓦·沙弗尔/蕾切尔·布鲁姆/科里·伯顿/吉姆·卡明斯/克里斯·帕内尔/杰夫·贝内特/斯蒂夫·科蒂斯·查普曼/乔玛·塔科内/艾伦·欧朋海默/查尔斯·弗莱舍/格雷格·秦/塔德·斯通斯/吉恩·吉尔平/维克托·特平/肯佐·李/大卫·田纳特/宝拉·阿巴杜/保罗·路德/罗森·马歇尔·瑟伯/马特·诺兰/汤姆安东内利斯/朱利安·格雷厄姆/瑞安·阿罗索/埃姆利·贝赫什蒂/马克·卡西米尔·戴妮奇斯/约翰尼·曼斯巴赫/安东尼·莫利纳利,7.1,在《奇奇与蒂蒂：救援突击队》电视动画结束30年后，奇奇成为了一个过着枯燥生活的保险业务员，蒂蒂则动了CGI手术让自己变成时下的3D动画造型，到处参加影迷活动回味着往日的辉煌；就在此时，针对动画人物的绑架事件接二连三的发生，当受害者中出现昔日同伴的名字时，奇奇与蒂蒂阔别多年的联手，试图找出真相与挽回破裂多年的友情。,https://img9.doubanio.com/view/photo/s_ratio_poster/public/p2873435044.jpg
热门,https://movie.douban.com/subject/34927916/,不速来客,2021,喜剧/悬疑,刘翔,刘翔/龙也,范伟/窦骁/张颂文/朱珠/梁超/胡明/高尚/蔡鹭,6.6,这一晚，窃贼老李（范伟 饰）进入一处破旧的居民楼内行窃，不料却目击了一场命案：神秘女子（朱珠 饰）离奇被杀，就在老李拼命制伏凶手阎正（张颂文 饰）之际，外卖员马明亮（窦骁 饰）突然也莫名其妙地出现在这个房间之内。,https://img9.doubanio.com/view/photo/s_ratio_poster/public/p2687924214.jpg
热门,https://movie.douban.com/subject/35015968/,昨日的美食 电影版 きのう何食べた？劇場版,2021,剧情/同性,中江和仁,安达奈绪子,西岛秀俊/内野圣阳/山本耕史/矶村勇斗/槙田雄司/松村北斗/田中美佐子/田山凉成/梶芽衣子,7.9,电影版故事中，加入了关键新角色「田渕刚」，是贤二在美容工作室的小鲜肉同事，这号人物的出现是否让史朗和贤二的关系产生变化？此外，史朗为了庆祝贤二的生日决定规划一趟「京都旅行」，两人在旅途中又将如何向对方敞开心扉？,https://img9.doubanio.com/view/photo/s_ratio_poster/public/p2675169624.jpg
热门,https://movie.douban.com/subject/34881718/,不可饶恕 The Unforgivable,2021,剧情,诺拉·芬沙伊德,彼得·克莱格/希拉里·塞茨/柯特妮·迈尔斯/萨利·温莱特,桑德拉·布洛克/乔·博恩瑟/文森特·多诺费奥/维奥拉·戴维斯/理查德·托马斯/艾斯琳·弗兰乔茜/W·厄尔·布朗/杰西卡·麦丽奥德/汤姆·盖里/琳达·伊蒙/罗布·摩根/艾伦·坡尔/帕蒂·基姆/艾玛·尼尔森/托比·哈格雷夫/威尔·普伦/威廉·贝勒/西蒙·钱/Tom MacNeill,7.9,露丝·斯雷特（布洛克饰）因暴力犯罪被判入狱，出狱后的她重新踏入社会，但自己的过去却不被原谅。面对来自她曾经称之为“家”的地方的无情评判，她获得救赎的唯一希望，就是找到当初被自己无奈丢下而疏远了的妹妹。,https://img1.doubanio.com/view/photo/s_ratio_poster/public/p2707727239.jpg
热门,https://movie.douban.com/subject/35123985/,平行母亲 Madres paralelas,2021,剧情,佩德罗·阿莫多瓦,佩德罗·阿莫多瓦,佩内洛普·克鲁兹/米莱娜·斯米特/依斯拉尔·埃雷贾德/艾塔娜·桑切斯-希洪/萝西·德·帕尔马/胡丽叶塔·塞拉诺/Daniela Santiago/爱诺亚·萨娜塔玛蕊/佩德罗·卡萨布兰科/阿德尔法·卡尔沃/Julio Manrique/Chema Adeva/Inma Ochoa/Arantxa Aranguren/Carmen Flores,7.2,简尼斯（佩内洛普·克鲁兹 Penélope Cruz 饰）人到中年，意外的得知自己怀孕了，虽然这个孩子来得有些突然，在简尼斯的人生计划之外，但她还是欣喜若狂的接受了这个稚嫩的新生命的到来。和简尼斯境遇相似的还有名叫安娜（米莱娜·斯米特 Milena Smit 饰）的女子，但和简尼斯不同，安娜并不能够坦然的接受这一场人生的变调，这个孩子除了带给她身体上的变坏外，还带来了焦虑和恐惧。,https://img1.doubanio.com/view/photo/s_ratio_poster/public/p2874073857.jpg
热门,https://movie.douban.com/subject/35052204/,谁可以这样爱我 Redeeming Love,2022,剧情/爱情/历史,D·J·卡卢索,法兰辛·里弗斯/D·J·卡卢索,阿比盖尔·F·考恩/汤姆·李维斯/法米克·詹森/罗根·马歇尔-格林/妮娜·杜波夫/埃里克·迪恩/布兰登·奥雷/杰米-李·奥唐纳/艾米·路易斯·威尔逊/坦娅·范·格拉恩/吴可熙/克莱德·伯宁/丹尼·戴·维利尔斯/史蒂芬·詹宁斯/康拉德·坎普/劳伦·麦格雷/尼古拉斯·鲍林/布雷特·威廉姆斯/密尔顿·施尔,7.1,电影以1850年代加州淘金热为背景，讲述了一对年轻夫妇的爱情与残酷的现实之间的冲突。本片改编自法兰辛·里弗斯的同名小说。,https://img2.doubanio.com/view/photo/s_ratio_poster/public/p2870280023.jpg
热门,https://movie.douban.com/subject/35708412/,永结同心 Badhaai Do,2022,喜剧/同性,Harshavardhan Kulkarni,Suman Adhikary/阿克沙特·吉尔戴尔/Harshavardhan Kulkarni,布米·佩德卡尔/拉吉·库玛/Apeksha Porwal/Chum Darang/古山·德瓦亚/谢巴·查达/西玛·帕瓦/Loveleen Mishra/Mushtaq Khan/Shah Emtiaj/Prashant Kumar/Hani Yadav/Nitish Pandey/Priyanka Charan/Nidhi Bhati,7.9,沙杜·塔库尔和苏曼·辛格缔结了一段互惠互利的婚姻，但当苏曼的女友来和他们一起居住时，混乱随之而来，因为这里面有着很多男男女女的故事……,https://img9.doubanio.com/view/photo/s_ratio_poster/public/p2870686494.jpg
热门,https://movie.douban.com/subject/34816897/,绞肉行动 Operation Mincemeat,2021,剧情/战争,约翰·马登,米歇尔·阿什福德/Ben Macintyre,科林·费尔斯/马修·麦克费登/凯莉·麦克唐纳/佩内洛普·威尔顿/强尼·弗林/詹森·艾萨克/马克·加蒂斯/哈蒂·莫拉汉/马克·博纳尔/保罗·里特/阿历克斯·杰宁斯/西蒙·罗斯/詹姆斯·弗雷特/尼古拉斯·罗尔/威尔·基恩/夏洛特·汉布林/洛恩·麦克菲登/鲁弗斯·赖特/琼乔·奥雷尔/鲁比·本特尔/埃莉·哈丁顿/西蒙·拉塞尔·比尔/迈克尔·博特/Amy Marston/加布瑞拉·克里维/亚历山大·拜尔/马库斯·冯·林根/哈维尔·戈迪诺/佩德罗·卡萨布兰科/Laura Morgan/佩普·托萨/格拉姆·柯里/Caspar Jennings/Dolly Gadsdon,6.2,影片聚焦第二次世界大战盟军策划的“绞肉行动”，歼灭德军数十万，为二战胜利奠定基础。1943年，盟军决定打破希特勒对被占领的欧洲地区的统治，情报官员埃文（科林·费尔斯 饰）和查尔斯（马修·麦克费登 饰）想出了一个妙不可言的假情报策略：用一具携带虚假机密的尸体误导德军，将其注意力引向希腊。希特勒中计后，盟军登陆了西西里岛，歼灭近20万德军，为欧洲战场的胜利奠定了坚实的基础。,https://img9.doubanio.com/view/photo/s_ratio_poster/public/p2691069194.jpg
热门,https://movie.douban.com/subject/35511448/,三个月 Three Months,2022,剧情/喜剧/同性,杰瑞德·弗里德,杰瑞德·弗里德,特洛耶·希文/维威克·卡拉/布芮妮·邱/哈维尔·穆尼奥斯/朱迪·格雷尔/小路易斯·格赛特/艾伦·伯斯汀/艾米·兰德克/卡洛斯·格雷罗/卡莱卡/Scott Daniel Johnson/Jillian Barrie/D.J. Stavropoulos,7.2,讲述戳爷扮演的凯莱布是南佛罗里达的一名高三学生，在他即将开始人生的新篇章时遇到了HIV感染的风险，与此同时，他也经历了一场新的爱情之旅。,https://img2.doubanio.com/view/photo/s_ratio_poster/public/p2867565843.jpg
热门,https://movie.douban.com/subject/34779516/,幻灭 Illusions perdues,2021,剧情/爱情/历史,泽维尔·吉亚诺利,雅克·菲耶斯基/泽维尔·吉亚诺利/Yves Stavrides/巴尔扎克,本杰明·瓦赞/塞西尔·德·弗朗斯/文森特·拉科斯特/泽维尔·多兰/莎乐美·德瓦斯/让娜·巴利巴尔/安德烈·马尔孔/路易多·德·朗克桑/热拉尔·德帕迪约/让-弗朗索瓦·斯泰弗南/Candice Bouchet/让-玛丽·弗兰/Saïd Amadis/Isabelle de Hertogh/Laurence Ferraro/让-保尔·米埃尔/亚历克西斯·巴尔博萨/米歇尔·克莱门特,7.4,Lucien是法国19世纪的一位充满抱负的年轻诗人。他离乡别井，告别以印刷为生的家族前往巴黎碰碰运气。在这座五光十色的城市裡，Lucien意识到自己来到一个充满谎言，一切以利益主导的世界。在巴尔札克的人间喜剧里，政治、感情、名气、灵魂... 万事也皆可买卖，每名 记者都变成了大作家。Lucien尝试爱，尝试挣扎，尝试在一切幻象中求存。,https://img9.doubanio.com/view/photo/s_ratio_poster/public/p2872896596.jpg
热门,https://movie.douban.com/subject/35172036/,空气杀人 공기살인,2022,上映日期,赵容善,金相庆/李先彬/尹敬浩/徐英姬/李至勋/张光/宋英奎/张赫镇/成秉淑,,6.5,该片改编自同名小说，素材取自于2011年发生的加湿器杀菌剂事件，通过这个事件来讲述有些事情必须有人去做，还没有结束的我们所有人的故事。,https://img1.doubanio.com/view/photo/s_ratio_poster/public/p2870177567.jpg
热门,https://movie.douban.com/subject/35307456/,穿过寒冬拥抱你,2021,剧情/爱情,薛晓路,薛晓路/柳青/张铂雷/郝哲/王越,黄渤/贾玲/朱一龙/徐帆/高亚麟/吴彦姝/许绍雄/王骁/周冬雨/刘昊然/乔欣/王一楠/刘天佐/田小洁/孙茜/张宥浩/尚语贤,6.0,2020年1月23日，农历腊月二十九，武汉宣布封城。本片聚焦这一特殊时刻，以温情和治愈为基调，刻画了普通市民守望相助、真挚动人的爱情群像。,https://img1.doubanio.com/view/photo/s_ratio_poster/public/p2801718909.jpg
热门,https://movie.douban.com/subject/30176790/,梅艳芳 梅艷芳,2021,剧情/音乐/传记,梁乐民,梁乐民/吴炜伦,王丹妮/古天乐/林家栋/杨千嬅/廖子妤/刘俊谦/杨祐宁/邵仲衡/陈家乐/杨诗敏/黄进/蒋志光/李子雄/李敏/陈柏宇/胡子彤/白只,6.9,电影讲述了梅艳芳一生的传奇经历。梅艳芳（王丹妮 饰）年仅4岁半便和姐姐梅爱芳一起登台卖唱，养家糊口。19岁参加华星唱片举办的第一届新秀歌唱大赛，获得冠军，从此同舞台结下不解之缘，凭借敬业的精神和过人的才华，慢慢成长为一代巨星，获封“百变天后”。2003年，一首《夕阳之歌》和一件定制的婚纱，她选择把自己嫁给了舞台。风华绝代尤可见，世间再无梅艳芳。,https://img9.doubanio.com/view/photo/s_ratio_poster/public/p2706812406.jpg
热门,https://movie.douban.com/subject/34840705/,呼朋引伴 C'mon C'mon,2021,剧情,迈克·米尔斯,迈克·米尔斯,华金·菲尼克斯/伍迪·诺曼/盖比·霍夫曼/斯科特·麦克纳里/雅布其·杨-怀特/Callan Farris/Elaine Kagan/Kate Adams/Brandon Rush/Mary Passeri/Cooper Jack Rubin/Molly Webster/Khadija Emma Neumann/Artrial Clark/Mya Gonzales,7.8,讲述一个好心眼儿的纪录片导演一边完成一个项目，一边照顾自己的小侄子。,https://img9.doubanio.com/view/photo/s_ratio_poster/public/p2687136996.jpg
热门,https://movie.douban.com/subject/35253900/,哆啦A梦：大雄的宇宙小战争2021 ドラえもん のび太の宇宙小戦争リトル・スター・ウォーズ2021,2022,剧情/科幻/动画,山口晋,佐藤大,水田山葵/大原惠美/嘉数由美/木村昴/关智一/香川照之/松冈茉优,6.2,电影改编自1985年剧场版《哆啦A梦：大雄的宇宙小战争》，讲述大雄意外结识来自匹里卡星、体形小巧的外星人帕比，并在哆啦A梦的帮助下，与大家一起穿越星际，共同守护友情和星球的宇宙冒险故事。,https://img1.doubanio.com/view/photo/s_ratio_poster/public/p2873563629.jpg
热门,https://movie.douban.com/subject/35202864/,"初识与告别之间 Hello, Goodbye and Everything in Between",2022,喜剧/爱情,Michael Lewen,本·约克·琼斯/Amy Reed/Jennifer E. Smith,塔莉娅·莱德/乔丹·费舍/朱莉娅·本森/莎拉·格雷/帕特里克·萨邦圭/尼科·希拉加/艾米丽·海内/Jennifer Robertson/Ayo Edebiri/Djouliet Amara/Eva Day/Dalias Blake/Sarah Hayward/Kyle Clark/Nicholas Dohy,5.7,克莱尔（塔莉娅·莱德饰）和艾丹（乔丹·费舍饰）约定在上大学前分手，并在分手前一晚进行了一场有纪念意义的约会。两人回首了一起走过的日子，包括第一次见面、亲吻和争吵，并开始认真思考是继续在一起，还是就此分道扬镳？《初识与告别之间》是一部精彩的浪漫喜剧，由热门系列《致所有我曾爱过的男孩》的制片人打造，改编自珍妮弗·E·史密斯的畅销小说。,https://img1.doubanio.com/view/photo/s_ratio_poster/public/p2874635277.jpg
热门,https://movie.douban.com/subject/34970422/,记忆 Memory,2022,动作/惊悚,马丁·坎贝尔,达里奥·斯卡达潘/杰弗·格瑞特/卡尔·乔斯/艾瑞克·范·洛依,连姆·尼森/莫妮卡·贝鲁奇/盖·皮尔斯/雷·史蒂文森/塔伊·阿特沃尔/斯特拉·斯托克尔/路易·曼迪勒/雷·费隆/安东尼奥·杰拉米洛/李·布罗德曼/娜塔莉·安德森/蕾贝卡·卡尔德/哈罗德·托雷斯/西加尔·迪亚曼特/凯特·尼科尔斯/阿塔纳斯·斯雷布雷夫/斯科特·威廉斯/道格·拉奥,5.9,该片改编自2003年丹麦影片《冷面赤心》。,https://img2.doubanio.com/view/photo/s_ratio_poster/public/p2870409802.jpg
热门,https://movie.douban.com/subject/35101435/,斯宾塞 Spencer,2021,剧情/传记,帕布罗·拉雷恩,斯蒂文·奈特,克里斯汀·斯图尔特/蒂莫西·斯波/杰克·法辛/莎莉·霍金斯/西恩·哈里斯/杰克·尼伦/弗雷迪·斯普里/伊丽莎白·贝林顿/斯特拉·古奈特/艾米·曼森/詹姆斯·哈克尼斯/理查德·塞梅尔/洛尔·斯特凡克/艾玛·达沃尔-史密斯/劳拉·本森/温迪·帕特森/约翰·基奥/米迦勒·埃普/伊恩·阿什皮特尔,6.5,讲述1990年代早期关键性的一个周末，戴安娜下了决心：她跟查尔斯王子的婚姻不会有好结果，必须背离那条“皇后预备役”的道路。影片故事发生在3天内，圣诞假日期间的桑德灵汉姆庄园。,https://img9.doubanio.com/view/photo/s_ratio_poster/public/p2678164205.jpg
热门,https://movie.douban.com/subject/35669441/,希尔达与山丘之王 Hilda and The Mountain King,2021,动画/奇幻/冒险,安迪·科伊尔,卢克·皮尔森/斯蒂芬妮·辛普森/库尔特·缪勒,贝拉·拉姆齐/阿米拉·法尔森-奥乔/奥利佛·尼尔森/黛西·海格达/拉斯穆斯·哈迪克/约翰·霍普金斯/露西·蒙格马利/迪诺·凯利/Rachel August/Agnes Peacock/Presley Charman/Ethan Dattani/Peter Dickson/Tafari Edwards/西蒙·格林诺,8.4,*本电影为剧场版，请先观看前两季，否则将严重影响观感。,https://img9.doubanio.com/view/photo/s_ratio_poster/public/p2799276725.jpg
热门,https://movie.douban.com/subject/35210620/,阿娜伊斯的爱恋 Les Amours d'Anaïs,2021,剧情/喜剧/爱情,夏琳·布儒瓦-塔凯,夏琳·布儒瓦-塔凯,阿娜伊斯·德穆斯蒂埃/瓦莱丽亚·布鲁尼·泰德斯基/德尼·波达利德斯/让-查理·克里切特/Xavier Guelfi/Christophe Montenez/安妮·卡诺斯瓦/布鲁诺·托德契尼/Annie Mercier/Grégoire Oestermann/Marie-Armelle Deguy/Sabrina Delarue/Seong-Young Kim/Estelle Cheon/Cédric Le Roy/Grégory Servant,7.7,"Anaïs a trente ans et pas assez d’argent.  Elle a un amoureux qu’elle n’est plus sûre d’aimer.  Elle rencontre Daniel, à qui tout de suite elle plaît.  Mais Daniel vit avec Emilie… qui plaît aussi à Anaïs. C’est l’histoire d’une jeune femme qui s'agite. Et c’est aussi l’histoire d’un grand désir.",https://img1.doubanio.com/view/photo/s_ratio_poster/public/p2869519927.jpg
热门,https://movie.douban.com/subject/35603695/,悸动 Crush,2022,喜剧/爱情,萨米·科恩,Kirsten King/Casey Rackham,罗温·布兰查德/奥丽伊·卡瓦洛/伊莎贝拉·费雷拉/泰勒·阿尔瓦雷兹/提亚拉·邓恩/Rico Paris/阿西夫·曼德维/蜜雪儿·伯托/梅根·莫拉莉/Addie Weyrich/Jes Tom/Addyson Tabankin/Ty DeMoya/Zoe Gandolfo/Samsara Leela Yett/埃里克·埃德尔斯坦/帕特里克·克莱因,7.1,一位有抱负的年轻艺术家加入了她高中的田径队，后来当她发现自己爱上了一个意想不到的队友时，她发现真爱是什么感觉。,https://img1.doubanio.com/view/photo/s_ratio_poster/public/p2872365648.jpg
