用户id,用户昵称,评论时间,IP地址,评论内容,评论人粉丝数,评论点赞数
4808300900388037,沐生-而立,2022-08-30 22:35:26,北京,真有钱 还给自己买个热搜,928,491
4808300405986169,林涧小鹿LU,2022-08-30 22:35:26,山西,又当又立在这里卖什么惨,1154,439
4808300790813112,Asulikeit_,2022-08-30 22:35:26,四川,《生育后的女性某些器官像巨峰葡萄》是这位的言论吧？yue了,1,340
4808300442948695,默默梨花落,2022-08-30 22:35:26,北京,淘汰的好，不喜欢她,41,293
4808303345930460,人间清醒FGJ,2022-08-30 22:35:26,河北,输给那个网络用语就很离谱,1129,221
4808314250069006,merewiccnqqz,2022-08-30 22:35:26,山东,就凭她粉丝疯狂diss周迅那英和拉宏桑这点，淘汰的好，别回来了，消费完了其他人再复活可是又当又立了,169,140
4808295972079229,不腰疼说话,2022-08-30 22:35:26,上海,周迅背锅,61,105
4808304385329301,酱爆哈西,2022-08-30 22:35:26,河北,不太喜欢她，之前很多不良言论,74,63
4808304272084926,ch2905,2022-08-30 22:35:26,江苏,45条评论的空降热搜,27,62
4808314121094867,冥华影闪,2022-08-30 22:35:26,北京,想放个她之前内涵杨笠和笑果的链接，一直被吞算了，反正让人知道有这事儿就行了，人家内涵完笑果和笑果艺人，笑果还给她开专场，让她上自家节目，很有排面了,327,59
4808301734792691,大咖秀i,2022-08-30 22:35:26,黑龙江,哎，一下子就不想看了。感觉是剧本，竟然输给了网剧烂梗,11,53
4808319333830976,DOUBLEY-19,2022-08-30 22:35:26,云南,怎么老嫂子还给自己买热搜啊不怕回旋镖吗,314,24
4808361226535288,会等到的对不对,2022-08-30 22:35:26,新疆,真棒 这种三观不正的人就不该出现在屏幕上！,2,17
4808323029012240,微博视频,2022-08-30 22:35:26,,您好，恭喜您的视频荣登视频飙升榜，综艺领域第2名，榜单可在【发现页-视频-视频飙升榜】中展示您的上榜信息，榜单小时级更新请尽快查看哦~快来查看分享你的上榜视频吧~榜单戳》网页链接,1511.2万,0
4808303769819930,羔六六mimir,2022-08-30 22:35:26,广东,小鹿淘汰真的很可惜啊！！！！凉茶笑的我头都要掉了,922,14
4808316255473246,爱珍珠不爱奶茶,2022-08-30 22:35:26,广西,好无语，输给了一堆网络用语,844,12
4808314049532603,黎先生的杂货铺,2022-08-30 22:35:26,四川,这个不是当初线下说肖战是杀人犯还是啥的那个脱口秀演员吗,21,15
4808377799278812,爱吃鱼丸面的咖喱鸡,2022-08-30 22:35:26,云南,你内涵杨笠的时候买热搜没啊？,327,8
4808301822611175,每天ai肉肉,2022-08-30 22:35:26,四川,她粉丝真可怕,13,8
4808312972119228,颜狗傲娇鬼,2022-08-30 22:35:26,北京,淘汰的好，活该,139,14
4808275390894925,小狗总是去花镇写歌,2022-08-30 20:50:55,四川,好烂。。拉宏。讲的。。,0,7548
4808281195288303,皮富贵儿,2022-08-30 20:50:55,北京,太扯淡了，一堆烂梗居然赢了小鹿,771,5543
4808277857403498,小猪罢了,2022-08-30 20:50:55,江苏,不是这是笑果对单立人的针对还是因为楼长段子的政治正确啊？拉宏说的是什么东西？我一下没笑，哦现在脱口秀说网络用语博笑也好使了是吗？看完俩人的演出我除了阴谋论真的想不出来别的。,248,4352
4808280948348765,zzzzz亘子,2022-08-30 20:50:55,山东,拉宏那是个啥呀啊啊啊啊啊啊 太烂了,1,3030
4808287701434536,不拿到证不换名,2022-08-30 20:50:55,河南,拉宏这说的啥啊 一灯不能再多了 这时候怎么不提大局观了 想念罗老师,93,2388
4808273997338428,-风之叶-,2022-08-30 20:50:55,浙江,她说的不是脱口秀,435,1509
4808269526732314,想要做好事但总闯祸,2022-08-30 20:50:55,贵州,小鹿走得越早我越好,0,675
4808283448417239,起司月震,2022-08-30 20:50:55,云南,愿脱口秀没有背刺,25,592
4808298371750447,亲爱的莱斯利,2022-08-30 20:50:55,湖北,拉宏桑靠啥火的啊，看她几个视频有点装呆萌人设………,1337,668
4808292116992872,冥华影闪,2022-08-30 20:50:55,北京,后排提示，小鹿曾经在一个节目上明着内涵笑果和杨笠，之后笑果还给她开了好几次专场[最右],327,497
4808306524951041,一条诚5016-马,2022-08-30 20:50:55,河南,看的太尴尬了，这也能晋级，这是脱口秀大会，不是可爱大会,861,392
4808302267728928,哎呦梦梦琦琦,2022-08-30 20:50:55,浙江,一般说忘记拍的其实她就是不想拍,172,420
4808298177498713,北方妖孽酱,2022-08-30 20:50:55,宁夏,感觉是那种会在长辈面前耍宝讨得喜欢的小孩子，同龄孩子会很烦这种咧,34,375
4808301713295929,海凼有点甜yuukiw,2022-08-30 20:50:55,江苏,拉宏桑说的全程都没有什么笑点啊，也不觉得可爱，真不懂,326,309
4808305077651239,魔Lovely,2022-08-30 20:50:55,山西,现在脱口秀已经靠卖萌了？,61,271
4808294755470059,一团毛线球球,2022-08-30 20:50:55,山东,离谱……（不用按头小鹿粉丝，第一次看她演出，也不讨厌这个可爱的up主，我特喜欢王小麦，所以看之前对拉宏桑有一定好感度），就是单纯的觉得离谱……,151,249
4808300543872687,北方妖孽酱,2022-08-30 20:50:55,宁夏,我寻思这水平放线下也不行啊，海选都不能过吧，咋就四灯了,34,279
4808317082272440,三百两6829,2022-08-30 20:50:55,江苏,那英去好好唱歌，周迅去好好演戏，行不行，真的会谢，栓Q,9,166
4808313470190484,默默大夜猫,2022-08-30 20:50:55,重庆,呃。。。这是乱拳打死老师傅吧。。。那英和周迅拍灯可以理解，但李诞和大张伟丢了“大局观”而且小鹿本来该四灯，迅哥忘了拍。。。最后就这么戏剧性（怎么感觉是导演故意）希望小鹿复活,1102,128
4808290532591730,夺目鑫辰,2022-08-30 20:50:55,贵州,离谱到家了,1226,117
4808293908486743,junejuneda,2022-08-30 22:30:21,四川,你竟然输给网络上都讲烂了的梗我气死！！！！！,212,3604
4808293178934681,super萌的白日梦,2022-08-30 22:30:21,北京,我不同意🙃🙃🙃 小鹿给妈妈回去干翻他们 怎么复活捞起,327,2587
4808293405427835,3生木,2022-08-30 22:30:21,北京,是剧本吗,12.4万,1012
4808293853692783,柳三便,2022-08-30 22:30:21,浙江,我怒关电脑,308.7万,712
4808294746558677,不腰疼说话,2022-08-30 22:30:21,上海,太欣赏鹿姐儿（此处表江湖地位）的高情商临场反应能力了，大气，又飒又高智，鹿姐儿的脱口秀无论是立意，内容，节奏表演都没问题，如果是罗老师与杨天真在，肯定四灯过到底了！看中间鹿姐的广告感觉最后是被拉回来了，周迅那英这两位真的不适合当领笑员，没有金刚钻就别领瓷器活。希望不要影响鹿姐心情,61,344
4808294750755792,苏大强的菜根花宝贝,2022-08-30 22:30:21,河南,抱歉小鹿，周迅第一次来没熟悉规则，她事后也很想补的,374,231
4808293254436964,鬼祟鬼祟,2022-08-30 22:30:21,江苏,感觉周仙女完全没有听懂你的哎嘛。。。,558,275
4808293191781533,文佳佳佳i,2022-08-30 22:30:21,河北,复活！！！！！！！！！！！！！！！！！！！！！！！！！！！！！！,4,282
4808298941126295,贾耗Xlife,2022-08-30 22:30:21,上海,“刚刚看了，小鹿很炸！表现很好！我们都很喜欢！简直啾啾啾啾啾！”from上海电动车一族,34万,181
4808302053561095,也就是鸟鸟,2022-08-30 22:30:21,山东,jiujiujiujiujiu,17.9万,159
4808293858676244,遥安同学,2022-08-30 22:30:21,上海,小鹿今晚也太好笑了吧哈哈哈哈哈哈哈哈哈哈哈不值得四灯吗！,2万,148
4808295019711875,等边对等角等角对等边,2022-08-30 22:30:21,辽宁,一个建议，那个20/30，死掉那个地方，死掉可以不说，因为大家都猜到了，不说，给大家的空间更大，效果更好，一点粗浅的感受，说的不对，别介意哈,100,132
4808296471462227,live2die,2022-08-30 22:30:21,甘肃,节目组收获了流量，也许你也扩大了知名度（不知道你认为是否值得），观众受到了永远的侮辱（从几季里很多次看见自己喜欢的选手被黑幕掉）,64,69
4808293236873254,范外外的名字,2022-08-30 22:30:21,北京,小鹿你真的是超级棒的脱口秀演员！不能接受小鹿被淘汰啊啊啊啊啊！,1793,59
4808293678060108,橙汁zccc,2022-08-30 22:30:21,山东,没事，在我心中你已经是脱口秀大王了,336,41
4808309330940287,小佳的生活方式,2022-08-30 22:30:21,山东,jiujiujiu,11.1万,35
4808300086428013,粥粥猫宁w,2022-08-30 22:30:21,河南,呜呜小鹿我不理解我不理解我最喜欢你这段了,223,28
4808297272320310,w祺祺祺祺,2022-08-30 22:30:21,北京,生育后的女性某些器官像巨峰葡萄👏🏻,112,71
4808295745067883,KaryTing,2022-08-30 22:30:21,广东,你被淘汰简直就是源源离大谱,986,33
4808293434529763,鹤er日记,2022-08-30 22:30:21,北京,九月线下见！！！女儿给我红！,306,25
4808287181088312,喜欢看七仙女打球,2022-08-30 22:02:11,海南,小鹿被拉宏桑淘汰我真的爆哭，好舍不得小鹿离开脱口秀的舞台啊！,83,107
4808287201264176,-封闭货车副驾驶-,2022-08-30 22:02:11,广东,还挺遗憾的，看脱口秀大会好喜欢小鹿啊，她真的讲到了我的心里,104,58
4808287230886829,明天不要不开心惹,2022-08-30 22:02:11,河南,小鹿确实说出来了我的疑问啊，好希望能够复活,26,19
4808289605652393,Dream-Cricle,2022-08-30 22:02:11,山西,我不喜欢她,177,64
4808288426528039,·清晨下了一场雨·,2022-08-30 22:02:11,四川,我还蛮喜欢小鹿的~很可惜啊淘汰了 还有机会复活吗！,19,25
4808287583207984,代表全国人民表扬你,2022-08-30 22:02:11,上海,挺有趣的，句句都是梗江湖没有周杰伦却处处有周杰伦的传说就是说,9,12
4808288899702724,风起叶落a,2022-08-30 22:02:11,河南,水军好多啊,7,44
4808320127338260,當下心動_,2022-08-30 22:02:11,河南,评论里水军太明显了吧哈哈哈哈哈哈哈哈哈,68,8
4808288191124800,你就是歌歌歌姬吧,2022-08-30 22:02:11,江苏,哇天哪怎么就淘汰了啊 我真的是爆哭啊哈哈哈,16,9
4808432999728817,语涵视听,2022-08-30 22:02:11,北京,脱口秀大会,35.3万,0
4808310941551811,周杰伦元宇宙,2022-08-30 22:02:11,江西,嗯？,139.9万,2
4808288707283398,铁拳母猴_,2022-08-30 22:02:11,辽宁,小鹿说的真的很对啊，好希望能复活啊,7,0
4808288468733931,u所长靖,2022-08-30 22:02:11,广西,这就淘汰了，别呀，能不能给个机会复活呀，真的很想看,44,0
4808309682471851,滔滔不绝37891,2022-08-30 22:02:11,北京,你笑的忘拍灯，我真的快气死,21,6
4808305257744095,无敌的三笠,2022-08-30 22:02:11,新疆,脱口秀大会的舞台不配,455,2
4808288435443360,珍惜今下zz,2022-08-30 22:02:11,河南,这个怎么淘汰了啊，感觉她的脱口秀超级有梗,15,3
4808294126588402,Jessie_uknow,2022-08-30 22:02:11,四川,就无语,633,2
4808288225202380,很喜欢你的每一天,2022-08-30 22:02:11,福建,舍不得小鹿啊 我好喜欢她的脱口秀 希望会复活吧,29,5
4808302167590621,一小坨云-,2022-08-30 22:02:11,贵州,可是这些段子都看过啊,31,1
4808296152170848,擂茶12,2022-08-30 22:02:11,重庆,无语，那小女孩讲的一点都不好笑,1213,2
4808270537560294,板栗丶丶丶丶丶猪,2022-08-30 21:00:34,湖北,小鹿被淘汰真的不能理解,480,1049
4808279773415942,迪迪要努力变强,2022-08-30 21:00:34,北京,我真无语了，别的不说，拉宏真的尬到我了，一堆网络用语好笑在哪啊,442,783
4808271691253621,不要碌碌一生,2022-08-30 21:00:34,河南,评论说被淘汰了，这种水平都被淘汰，剩下的是得多好啊,52,353
4808293233725351,一粒秋秋,2022-08-30 21:00:34,广东,拉宏晋级这件事真的拉低节目水准,444,290
4808277374272385,科言氏,2022-08-30 21:00:34,江苏,周迅就来搞事情！？？靠了,166,204
4808272409007090,我的果汁分你一罐,2022-08-30 21:00:34,天津,我不理解她会被淘汰,1050,186
4808278888157626,瓦西里上校,2022-08-30 21:00:34,山东,周迅冠冕堂皇的说忘了给小鹿拍灯，那她也不应该给拉宏拍，太假了,308,204
4808271719830256,珜洮,2022-08-30 21:00:34,黑龙江,有几个梗朋友圈见过,1.6万,77
4808299054891028,白桃柚子鸢尾花儿,2022-08-30 21:00:34,上海,劝女明星都别来沾这个节目，谢谢了那个灯不是给您拍着玩的,304,100
4808274690447233,拥晚风z,2022-08-30 21:00:34,吉林,没啥不能理解的，全是听过的梗凑到一起了，网络段子大合集,1,52
4808290742307510,诺式媒女,2022-08-30 21:00:34,重庆,说得挺有笑果啊，她怎么这么快被淘汰？？？？？,3.1万,48
4808278661930472,山海东荒有异兽爱甜不爱胖,2022-08-30 21:00:34,天津,淘汰小鹿留下一地网络用词？？,312,52
4808294495951373,小鑫不花钱,2022-08-30 21:00:34,四川,小鹿说得这么好 梗也很爽 怎么会淘汰呢？,49,39
4808290954905846,一摞月亮,2022-08-30 21:00:34,福建,这被淘汰我就是一脸？？？？,0,32
4808273511056622,一扎就破,2022-08-30 21:00:34,广东,到处找网上段子 其实都看烂了。。而且这位温和的女士怎么能叫黄阿丽呢🥺,464,57
4808306448667021,华依倜-海南ET,2022-08-30 21:00:34,海南,小鹿被淘汰太无语了。每年看脱口秀大会都很气人。太不公平了。把观众当傻子吗？,473,22
4808271220970397,winterlove04,2022-08-30 21:00:34,河南,真的好喜欢周杰伦那一段,163,15
4808271250855281,饭醉少年V,2022-08-30 21:00:34,江苏,大草了艾玛笑疯了,817,12
4808290364294578,夺目鑫辰,2022-08-30 21:00:34,贵州,最离谱的一个离开,1226,14
4808445054423254,微博视频,2022-08-30 21:00:34,,您好，恭喜您的视频荣登视频飙升榜，综艺领域第4名，榜单可在【发现页-视频-视频飙升榜】中展示您的上榜信息，榜单小时级更新请尽快查看哦~快来查看分享你的上榜视频吧~榜单戳》网页链接,1511.2万,0
4808472388961432,最近纠结名字的轩轩轩,2022-08-31 10:14:51,上海,只能说脱口秀大会不缺脱口秀演员，需要其他破圈的人,366,4
4808472526327677,菡萏97695,2022-08-31 10:14:51,江西,小鹿文本、台风和节奏都好棒,100,4
4808484066168492,偷蜜的大熊,2022-08-31 10:14:51,北京,小鹿这场真的可以啊,2.4万,0
4808482518209098,折磨小丸,2022-08-31 10:14:51,上海,我爱死小鹿了,41,0
4808476314568528,白駒過隙______,2022-08-31 10:14:51,山东,,114,0
4808475563262806,喊一声朕的江山,2022-08-31 10:14:51,福建,要是没复活，这节目还办个屁,42,0
4808474935166228,HappyMAJI,2022-08-31 10:14:51,陕西,没有颜值即正义啊 忘了拍灯,4,0
4808473231757269,法师Elaine-,2022-08-31 10:14:51,河南,从奇葩说开始就很喜欢小鹿，说的非常好，就这么淘汰也太可惜了,8,0
4808472924786532,丽77li,2022-08-31 10:14:51,广西,只是一个综艺节目，干嘛说得这么严重,100,1
4808478671767980,特斯拉不会飞_,2022-08-31 10:14:51,浙江,本身就是个节目，储老师当年也不是被淘汰了么,551,0
4808479036151250,我爱罗筱章,2022-08-31 10:14:51,北京,昨天能看的也就是小鹿和毛豆。,166,0
4808476322174807,冲浪团仔z,2022-08-31 10:14:51,广东,她会复活的 一切比较巧合吧  现场感受肯能确实不一样,174,0
4808476021491326,陳不知无谓,2022-08-31 10:14:51,山东,小鹿不错的。她的风格很让人喜欢。,17,0
4808473516441624,Dibny,2022-08-31 10:14:51,江苏,去其精华，取其糟粕,1555,2
4808473466374937,柯瓦多罗,2022-08-31 10:14:51,北京,过多解读也不必，BO1本就容易爆冷，何况成败也仅系于四个人的看法，无论那个灯是有意还是无意，先出场者的遭遇其实有利于后出场者,8,0
4808472895951087,维克多水果tea,2022-08-31 10:14:51,上海,自掘坟墓也挺合理，落袋为安和入土为安在诉求上也确实接近,187,1
4808329552201005,四尺玉9921,2022-08-31 00:54:54,河南,人家是我女我也吗？人家明明是我女，我知道她们也，但是我不也,115,15
4808333192856169,Mortimer05521,2022-08-31 00:54:54,江西,还是觉得说脱口秀 真诚很重要🙏   不要当什么两面人 也别搞什么背刺 报团攻击  这个社会女性生存已经很不容易了 希望听到更多真正的女生声音  期待杨笠 颜怡颜悦 鸟鸟以及更多新人,1,10
4808342994158973,-----管好你自己,2022-08-31 00:54:54,江苏,是的//@Mortimer05521:还是觉得说脱口秀 真诚很重要🙏   不要当什么两面人 也别搞什么背刺 报团攻击  这个社会女性生存已经很不容易了 希望听到更多真正的女生声音  期待杨笠 颜怡颜悦 鸟鸟以及更多新人,44,0
4808299557945627,海边种太阳,2022-08-30 22:51:46,河北,求求你告诉我，张灏喆讲了什么，一剪梅了,74,0
4808303248672575,WADS键,2022-08-30 22:51:46,辽宁,喜欢的选手被淘汰你们想撒气倒是找个像样点的理由啊，起码小鹿淘汰这个事怎么论也怪不到那英头上吧,55,25
4808301441451429,最爱这一天0628,2022-08-30 22:51:46,辽宁,又是被剪辑坑惨的英子,10,15
4808478139089995,珍的AI你201610,2022-08-30 22:51:46,浙江,那英拍灯也被骂，总有黑子找各种理由，咋做都不对。,126,4
4808450581726853,那喜剧人,2022-08-30 22:51:46,河南,转发，必须支持,71,1
4808301588254163,周杰伦的小公举s,2022-08-30 22:51:46,湖北,我真的快气死了,737,3
4808487009785026,小朋友傻憨憨的日常,2022-08-31 11:19:27,山西,这……啥时候说的？好恶,2,0
4808343699587637,一只小歪吖,2022-08-31 01:30:33,河南,嘴替,320,16
4808472929766877,-是山城君,2022-08-31 01:30:33,山东,拜托 站在♂角度指责女性没有必要容貌焦虑 她很拽吗,527,0
4808353110557092,充满爱但你完了哦,2022-08-31 01:30:33,四川,你的置顶可是永怀善意啊，这样的输出就为了和你充值v5一样取宠吗？why？,598,5
4808421439965310,未闻花名------,2022-08-31 01:30:33,江苏,🙊女版周奇墨的意思就是这季享有复活特权,249,1
4808340917978068,航欧巴亲个,2022-08-31 01:30:33,黑龙江,网络暴力 笑话人不如人 也可能就你觉得她输给一堆破网络梗是理所当然了,0,1
4808486195827018,豆芽妍妍,2022-08-31 11:15:41,安徽,每次领笑员的责任都要加之于选手身上 去年呼兰的灯也是 气死了,117,0
4808479220697837,梦想千娇百媚的家,2022-08-31 10:35:29,福建,就是好奇怪啊，就算小鹿那里周迅忘拍失误了，到拉宏桑那李诞大张伟不应控灯让观众投票吗？这种水平直接4灯天花板是什么鬼！脱口秀比赛啊，好歹也得讲顺成脱口秀吧,48,2
4808486426773912,aisideru-neko,2022-08-31 10:35:29,广东,应该会被复活，领笑员每期都会被吐槽，这期选那英这些人真是一言难尽,792,1
4808485671799680,龙青响,2022-08-31 10:35:29,江苏,只能说无语，小鹿和杨笠我最喜欢的女脱口秀演员,59,0
4808341928543339,viraha__,2022-08-31 01:32:30,陕西,还给人整年龄焦虑这一套  您快歇歇吧,146,7
4808340821508962,viraha__,2022-08-31 01:32:30,陕西,带着女权的面具其实充满爹味说教  我真服了  ,146,6
4808339790496674,viraha__,2022-08-31 01:32:30,陕西,你可别代表女性视角了  代表代表自己得了,146,2
4808466722195160,一梨他嚯嚯,2022-08-31 01:32:30,山西,奇葩说的风气就没笑果的好,55,0
4808486699404689,zhubuwai,2022-08-31 01:32:30,山西,是什么给了你振振有词的底气？逻辑好乱啊你,128,0
4808341567833451,viraha__,2022-08-31 01:32:30,陕西,救命啊  她的粉丝竟然说杨笠怎么没敢站  你们别搞笑了  她跟杨笠是一个级别吗  肉食她都没敢选  杨笠真站起来她敢选吗？ 她配选吗？,146,0
4808364536103361,您连不上的WiFi,2022-08-31 02:59:13,辽宁,前面周杰伦电动车和贵妇霜的梗就很好笑。不用特意加后面的内容,54,3
4808360984314671,您连不上的WiFi,2022-08-31 02:59:13,辽宁,身为女性却只想着吃“女性红利”，小鹿先生有点心急了,54,13
4808402532827844,搬砖达人小王,2022-08-31 02:59:13,北京,笑果都没当回事。你们比人家还操心呢，何必呢，笑果开评论精选就是讨厌你们总提那件破事，没完没了的。,246,1
4808361114338083,一股茶味儿,2022-08-31 02:59:13,安徽,她应得的,24,2
4808485089575657,fisheva77,2022-08-31 11:13:30,四川,真的是很无语,2439,0
4808485219340468,-屿州-,2022-08-31 11:13:27,山西,就是说人在做天在看，您且等着吧,0,0
4808456185318013,求幸运之神眷顾我这三年,2022-08-31 08:47:42,黑龙江,这不是那个野人吗,18,2
4808339714999040,IsThereNobody,2022-08-31 01:15:42,美国,我第一反应也是爹味太重了 只看稿子以为是个男的写的 感觉就是在漠视女性这些焦虑背后的原因在嘲讽这些行为,73,10
4808335356331543,我是次次次次次,2022-08-31 01:15:42,四川,真的太爹味了 都不只是我女我也 完全是我觉得 给人一种高高在上说教的感觉 我不like it,14,5
4808486091753657,是七七七七七爷,2022-08-31 01:15:42,浙江,千年女尸 的 那个梗 当这里是哪里 鸟鸟还在下面诶,117,0
4808359037370404,水喝多了上厕所,2022-08-31 01:15:42,广东,她说话的语气有一种特别趾高气昂的感觉，而且还攻击了年轻女性，讽刺年纪大的女性焦虑是一种矫情。就是雌竞啊。用女性来攻击女性,5,0
4808351789875291,trustyourselfdowntoearth,2022-08-31 01:15:42,广东,她哪里指责二十岁女性了 他讽刺的是消费主义所宣扬的年龄焦虑，告诉女性不要被洗脑焦虑罢了,39,3
4808342570271361,NataliSh,2022-08-31 01:15:42,山东,有种汉子婊的感觉,161,0
4808486812918008,小朋友傻憨憨的日常,2022-08-31 11:12:06,山西,给你点了,2,0
4808472098772968,小鸡肉馕,2022-08-31 09:51:53,福建,没看过 但是支持,169,0
4808479153587043,是七七七七七爷,2022-08-31 09:51:53,浙江,两个都笑不出来。,117,0
4808476583528792,即使再会,2022-08-31 09:51:53,湖北,一把子支持了，说得我生理不适,412,1
4808470530360735,Paradox-C,2022-08-31 09:51:53,安徽,支持,568,1
4808481594674755,小朋友傻憨憨的日常,2022-08-31 09:51:53,山西,干尸那个好特么尴尬，讲的没有鸟鸟好。而且全程都很尴尬,2,0
4808473415520935,June啊啊啊,2022-08-31 09:51:53,江苏,支持支持！她的这个段子根本就还是男凝！,58,0
4808465380280082,微博明星,2022-08-31 09:51:53,,嘿！你也在关注“脱口秀大会”吗？快戳《脱口秀大会》嘉宾进入专题页查看并关注相关博主吧，热门精彩内容不错过！,543.7万,0
4808293908486743,junejuneda,2022-08-30 22:30:21,四川,你竟然输给网络上都讲烂了的梗我气死！！！！！,212,3609
4808293178934681,super萌的白日梦,2022-08-30 22:30:21,北京,我不同意🙃🙃🙃 小鹿给妈妈回去干翻他们 怎么复活捞起,327,2589
4808293405427835,3生木,2022-08-30 22:30:21,北京,是剧本吗,12.4万,1012
4808293853692783,柳三便,2022-08-30 22:30:21,浙江,我怒关电脑,308.7万,712
4808294746558677,不腰疼说话,2022-08-30 22:30:21,上海,太欣赏鹿姐儿（此处表江湖地位）的高情商临场反应能力了，大气，又飒又高智，鹿姐儿的脱口秀无论是立意，内容，节奏表演都没问题，如果是罗老师与杨天真在，肯定四灯过到底了！看中间鹿姐的广告感觉最后是被拉回来了，周迅那英这两位真的不适合当领笑员，没有金刚钻就别领瓷器活。希望不要影响鹿姐心情,61,344
4808294750755792,苏大强的菜根花宝贝,2022-08-30 22:30:21,河南,抱歉小鹿，周迅第一次来没熟悉规则，她事后也很想补的,374,231
4808293254436964,鬼祟鬼祟,2022-08-30 22:30:21,江苏,感觉周仙女完全没有听懂你的哎嘛。。。,558,275
4808293191781533,文佳佳佳i,2022-08-30 22:30:21,河北,复活！！！！！！！！！！！！！！！！！！！！！！！！！！！！！！,4,282
4808298941126295,贾耗Xlife,2022-08-30 22:30:21,上海,“刚刚看了，小鹿很炸！表现很好！我们都很喜欢！简直啾啾啾啾啾！”from上海电动车一族,34万,181
4808302053561095,也就是鸟鸟,2022-08-30 22:30:21,山东,jiujiujiujiujiu,17.9万,161
4808293858676244,遥安同学,2022-08-30 22:30:21,上海,小鹿今晚也太好笑了吧哈哈哈哈哈哈哈哈哈哈哈不值得四灯吗！,2万,148
4808295019711875,等边对等角等角对等边,2022-08-30 22:30:21,辽宁,一个建议，那个20/30，死掉那个地方，死掉可以不说，因为大家都猜到了，不说，给大家的空间更大，效果更好，一点粗浅的感受，说的不对，别介意哈,100,132
4808296471462227,live2die,2022-08-30 22:30:21,甘肃,节目组收获了流量，也许你也扩大了知名度（不知道你认为是否值得），观众受到了永远的侮辱（从几季里很多次看见自己喜欢的选手被黑幕掉）,64,69
4808293236873254,范外外的名字,2022-08-30 22:30:21,北京,小鹿你真的是超级棒的脱口秀演员！不能接受小鹿被淘汰啊啊啊啊啊！,1793,59
4808293678060108,橙汁zccc,2022-08-30 22:30:21,山东,没事，在我心中你已经是脱口秀大王了,336,41
4808309330940287,小佳的生活方式,2022-08-30 22:30:21,山东,jiujiujiu,11.1万,35
4808300086428013,粥粥猫宁w,2022-08-30 22:30:21,河南,呜呜小鹿我不理解我不理解我最喜欢你这段了,223,28
4808297272320310,w祺祺祺祺,2022-08-30 22:30:21,北京,生育后的女性某些器官像巨峰葡萄👏🏻,112,71
4808295745067883,KaryTing,2022-08-30 22:30:21,广东,你被淘汰简直就是源源离大谱,986,33
