用户id,用户昵称,评论时间,IP地址,评论内容,评论人粉丝数,评论点赞数
4808421029447323,陳阿陈Ya,2022-08-31 06:28:24,山东,赞同 第一期我怎么看的那么气呢,350,0
4808439656351835,肥龙有鸡汤,2022-08-31 06:28:15,山东,#小鹿问周杰伦平时真的骑电动车吗#  他已不是电动车的代言人了，你忘了吗？,1.2万,0
4808440357323289,锦鲤小橙冒险记,2022-08-31 06:14:46,广东,她也不算天花板吧,73,0
4808451705801024,某媛,2022-08-31 06:07:11,四川,我就只看了小鹿的cut,1095,0
4808420072620601,上头ing的Marsyyy,2022-08-31 06:07:11,黑龙江,毛豆真的不错哈哈哈,144,0
4808425684601421,超话社区,2022-08-31 03:17:53,,你好，你感兴趣的“脱口秀大会[超话]”已开通了超话社区～ 超话社区是微博旗下兴趣互动社区，快来与志同道合的小伙伴们一起交流互动吧！ 戳我进入&gt;&gt; 脱口秀大会,2.35亿,0
4808365445743141,微博明星,2022-08-31 03:17:53,,嘿！你也在关注“脱口秀大会”吗？快戳《脱口秀大会》嘉宾进入专题页查看并关注相关博主吧，热门精彩内容不错过！,543.7万,0
4808294436701898,_今天也超喜欢你,2022-08-30 22:20:38,浙江,根本没有为女性发声，全程都是她自己的年龄焦虑还要说别人不好看她的面相觉得真是尖酸刻薄，根本不好笑,127,218
4808307388711329,解麸精神病院,2022-08-30 22:20:38,江苏,从她内涵杨笠那一刻起，就不喜欢,2,123
4808291392422709,大范儿er,2022-08-30 22:20:38,湖北,真的吗…是相似的吗？,1481,31
4808304541308134,一杯清酒换半盏_,2022-08-30 22:20:38,浙江,全程听她段子就感觉在贩卖焦虑 弹幕里粉丝一个劲吹 真的搞得我现在很反感她,105,85
4808306259920519,梅子清茶-,2022-08-30 22:20:38,广东,干尸那个我也是立刻想到鸟鸟的虽然角度不一样但是既视感太强了,36,66
4808299277456014,游ne娃纸怎么这个亚子,2022-08-30 22:20:38,云南,太敏感了吧,670,22
4808330084354315,还行啊_g,2022-08-30 22:20:38,新疆,就很奇怪听了她的段子一点不想笑还很想杠她，怎么本来就很美的人就不能护肤锦上添花了，还是不上火就不能喝凉茶，或者她住在周杰伦家看着他天天不骑电动车。就很无语,120,34
4808305770497361,状态良好的竹筒粽子呀,2022-08-30 22:20:38,陕西,主要是被拉宏淘汰就太过分了，换个别人都行，拉宏真的一言难尽啊我都怕他们后面全搞网络用语,2,23
4808300220387803,桃气泡芙,2022-08-30 22:20:38,山东,前半段听着觉得有点不太舒服，后面电动车那部分还挺好笑的。能看得出来技术 节奏是比较优秀的，但是观众缘还稍微差一些吧（拉宏那个感觉就是来玩玩的吧）,68,23
4808297112410924,不想吃得太饱,2022-08-30 22:20:38,重庆,是的 听的时候就感觉这些我不是看过吗？还有周杰伦电动车那段也是,187,6
4808321225199444,天真无邪本邪是也,2022-08-30 22:20:38,辽宁,虽然但是其实俩人都不怎么样。她的稿子，让一个人男人去这么吐槽女朋友完全不违和。从来没站在普通女性视角考虑，我只感受到了极大的讽刺和“怎么还不焦虑”。更别提还有杨笠那一茬，情感上完全喜欢不起来了？,1,7
4808302972112346,沾沾子草_,2022-08-30 22:20:38,湖北,反正她讲的确实不好笑，而且她选拉宏不也就是明摆着欺软怕硬嘛（别杠，杠就是我对）,105,40
4808294470518237,啊啊啊啊阿叽阿唑,2022-08-30 22:20:38,广东,人品行不行就不知道了，但是确实个人感觉不好笑，不懂一大批捧她的人,448,4
4808297850340754,不宜凉辣油咸甜,2022-08-30 22:20:38,山东,真的前半程没有笑，我觉得淘汰不亏，但是晋级的那个也很……,305,8
4808298362306689,树上乘凉凉凉,2022-08-30 22:20:38,湖北,但我觉得拉宏和他讲的都不行,87,12
4808301009961197,兔霓角,2022-08-30 22:20:38,山西,如果她所谓的“温和”就是把别人说烂的东西再嚼一遍的话😅😅😅,80,16
4808308580419374,十五只鹿,2022-08-30 22:20:38,黑龙江,对 和杨笠一对比就能对比出来 又想吃红利又没有自己换点,118,10
4808296886437484,想一只小猫咪,2022-08-30 22:20:38,四川,我不觉得是抄袭,586,5
4808421348737491,冉染然苒ran,2022-08-30 22:20:38,山东,我是从他之前说自己的段子没有杨笠那么激进，是因为体感上没有遭受过男性的伤害开始就知道她的段子或者是立场视角有问题，她根本不能写出我们想要的那种女性视角的段子。,69,2
4808336006712686,围披风的小蝴蝶,2022-08-30 22:20:38,重庆,不过我真的不敢相信她31，看起来应该在35+,875,4
4808418735687612,未闻花名------,2022-08-31 05:30:35,江苏,后面已经复活了,249,0
4808422144606974,猎户座刀客,2022-08-31 05:30:35,辽宁,她真复活就白瞎这个节目了，完全不想看了。,166,0
4808401756881250,科幻少年与梦,2022-08-31 05:29:52,辽宁,现在什么节目没有剧本,1,0
4808398325153839,是本颜naive了,2022-08-31 05:21:33,英国,我真的想念罗永浩,207,0
4808393661350442,袁妙不可b妍,2022-08-31 05:10:14,四川,有钱就是牛！,1.2万,3
4808398970814491,冰点零距离202206,2022-08-31 05:10:14,四川,不服？,1,3
4808457644934784,Lilith-Antares,2022-08-31 05:10:14,山东,超好看哒,2272,0
4808408190418973,摘一颗白桃,2022-08-31 05:06:27,上海,终于找到一条正常的评论了 拉的脱口秀全程嘴角我都没牵扯过一下真不好笑 说可爱的……这又不是女团选秀,1,0
4808420332931151,上头ing的Marsyyy,2022-08-31 05:06:27,黑龙江,雪琴是真的好,144,3
4808447948751447,黄老献的脱口秀,2022-08-31 04:56:47,广东,小鹿大会经验确实缺失,125,0
4808402595479664,拉拉手0029,2022-08-31 04:51:38,黑龙江,关键是你说你忘了拍，那凭什么到了挑战者这里就想起来了！不给一个公平的机会！谁爱四灯谁四灯！小鹿就应该是直接晋级的！！！,247,0
4808402595479664,拉拉手0029,2022-08-31 04:51:38,黑龙江,关键是你说你忘了拍，那凭什么到了挑战者这里就想起来了！不给一个公平的机会！谁爱四灯谁四灯！小鹿就应该是直接晋级的！！！,247,0
4808438456779110,一无可出的出口,2022-08-31 04:50:22,安徽,因为这样才有热度,348,0
4808397856178426,微博明星,2022-08-31 04:50:22,,嘿！你也在关注“脱口秀大会”吗？快戳《脱口秀大会》嘉宾进入专题页查看并关注相关博主吧，热门精彩内容不错过！,543.7万,0
4808447658562035,黄老献的脱口秀,2022-08-31 04:50:22,广东,也太小看另一组肉食动物了,125,0
4808288854344038,草莓多多十分糖,2022-08-30 22:03:00,江苏,拉宏那个水平凭什么上天花板啊什么破节目啊，别办了真的,185,85
4808303399405066,子子笏笏,2022-08-30 22:03:00,宁夏,可是小鹿以前内涵过好多女生啊   她的段子我听到年龄那儿就不想听了  她不是一直以讨好男人讽刺女生的风格立足的吗有啥好惋惜的,50,16
4808287792660668,heresayhi,2022-08-30 22:03:00,陕西,很难不赞同！！！,121,24
4808291798225483,MC柴柴,2022-08-30 22:03:00,浙江,还笑5分钟，李卤蛋让我气了50分钟,824,24
4808286718923888,____Sugar0080,2022-08-30 22:03:00,吉林,真的 追了5年脱口秀 今天给我气出来刷微博了,0,4
4808289999651009,一颗大大的小西柚,2022-08-30 22:03:00,天津,就 恶心！,308,3
4808292432615242,余青青霖xtg,2022-08-30 22:03:00,广东,步惊云四灯我也不能理解。。。拉宏我本身对她无感，但是因为节目这种操作让我对她反感了,1059,12
4808428079808618,slmlwrzllsy,2022-08-30 22:03:00,黑龙江,三百多赞，姐妹你火了，哈哈哈哈哈哈,260,0
4808311205532651,疯兔金金_,2022-08-30 22:03:00,广东,小鹿是单立人的 不是笑果的 会不会有这个原因,1497,1
4808296126750127,吃了睡了吃国王,2022-08-30 22:03:00,河南,就是！为啥不一直请大张伟杨老板大局观！！！,78,1
4808294403934887,翵羽,2022-08-30 22:03:00,陕西,真的，看一半给我气的退出去发了条朋友圈，真觉得没必要这么双标哈，新人随便拍，老人这就又有标准了?拍灯不看不看内容只看可爱，那还看啥脱口秀，看女团选秀不更好?,32,5
4808413978559417,药丸绝杀,2022-08-30 22:03:00,湖南,布惊云上一季的表现简直惊艳结果淘汰 这期还行结果4灯 拉宏4灯淘汰因为一个导师忘记拍灯导致只有3灯的小鹿我真的觉得扯 恶心至极了 没有规则没有公平可言,6387,0
4808315857013093,小Y在认真长大,2022-08-30 22:03:00,江苏,我宣布你是我的互联网嘴替！！！,40,0
4808310924249663,董嘻嘻-,2022-08-30 22:03:00,浙江,我真的吐血了啊啊啊啊啊 本来看到小鹿还很开心的 淘汰了我真的拴了个大Q 真的气到了,574,0
4808299684565343,-绝对值啊-,2022-08-30 22:03:00,河南,河南拔智齿  能云多云点！,150,0
4808294805802504,颗子必须早睡,2022-08-30 22:03:00,福建,我真的不理解！！！！！,679,0
4808291060029109,寒绻,2022-08-30 22:03:00,贵州,小鹿真的是这期最佳了，硬生生被淘汰了，我也不是不喜欢拉宏桑，但是小鹿真的很棒啊,33,4
4808290028751781,Aprilforth-,2022-08-30 22:03:00,甘肃,真的这一届怎么了，弄成这样气死我了,1,0
4808315870124172,AceCream13,2022-08-30 22:03:00,上海,坠了,1802,0
4808313147757397,你这个年纪怎么睡得着啊,2022-08-30 22:03:00,贵州,我真的会谢,747,0
4808442584237840,我说月亮不必奔我而来,2022-08-31 04:32:05,江苏,有一说一，不选拉宏就只能选肉食，肉食多强大家有目共睹，她不还是会输吗,36,0
4808431389377336,行云不问,2022-08-31 04:02:28,加拿大,童漠男前半段可以，后半段太使劲儿了,10.8万,0
4808423495960942,行云不问,2022-08-31 04:02:28,加拿大,怎么复活啊,10.8万,0
4808423461882024,行云不问,2022-08-31 04:02:28,加拿大,既然给小鹿忘记拍，那就该给拉宏桑也不拍，留给观众投票啊。,10.8万,0
4808436702775710,Misfloruitshow,2022-08-31 03:48:42,福建,雨哥注意休息,857,0
4808374276063636,蝴蝶和潜水员,2022-08-31 03:48:42,湖南,只针对这次talk本身！一点不好笑！喜剧最忌讳什么，作为“老人”得最门儿清了吧！,116,0
4808370219385218,Hersheyhe,2022-08-31 03:36:58,北京,这次rs终于不是奈良的鹿了是你自己,1.2万,0
4808370223579444,微博明星,2022-08-31 03:36:58,,嘿！你也在关注“脱口秀大会”吗？快戳《脱口秀大会》嘉宾进入专题页查看并关注相关博主吧，热门精彩内容不错过！,543.7万,0
4808430059261922,雅洲第一聪明智人,2022-08-31 03:36:30,上海,真的气死,815,0
4808365434208996,Hedy不想当废物,2022-08-31 03:14:43,浙江,我真的栓Q,451,0
4808376757780918,王鑫6830,2022-08-31 03:14:43,江苏,第一反应就是周迅背锅。,0,0
4808427735353554,岛屿-微光,2022-08-31 03:14:43,广东,单从这一段，她讲的还不如鸟鸟……借鉴鸟鸟的段子借鉴的好生硬，固然拉宏的四灯太随意，作为一个所谓的成熟脱口秀演员，她确实也不配四灯,316,4
4808430059261922,雅洲第一聪明智人,2022-08-31 03:36:30,上海,真的气死,815,0
4808365434208996,Hedy不想当废物,2022-08-31 03:14:43,浙江,我真的栓Q,451,0
4808376757780918,王鑫6830,2022-08-31 03:14:43,江苏,第一反应就是周迅背锅。,0,0
4808427735353554,岛屿-微光,2022-08-31 03:14:43,广东,单从这一段，她讲的还不如鸟鸟……借鉴鸟鸟的段子借鉴的好生硬，固然拉宏的四灯太随意，作为一个所谓的成熟脱口秀演员，她确实也不配四灯,316,4
4808420148119882,超话社区,2022-08-31 02:55:14,,你好，你感兴趣的“脱口秀大会[超话]”已开通了超话社区～ 超话社区是微博旗下兴趣互动社区，快来与志同道合的小伙伴们一起交流互动吧！ 戳我进入&gt;&gt; 脱口秀大会,2.35亿,0
4808359847133611,微博明星,2022-08-31 02:55:14,,嘿！你也在关注“脱口秀大会”吗？快戳《脱口秀大会》嘉宾进入专题页查看并关注相关博主吧，热门精彩内容不错过！,543.7万,0
4808454957175592,穿睡衣的一一,2022-08-31 02:55:14,上海,"小鹿和周老板可差的不是一星半点, 一个是天花板，一个是自认天花板",13,0
4808373368782991,唐僧护发用飘柔,2022-08-31 02:53:35,美国,这一季真的剧本太明显啦,43,0
4808362149019778,一股茶味儿,2022-08-31 00:25:17,安徽,给你点了,24,0
4808349701636697,奇迹小羊yyy,2022-08-31 00:25:17,湖北,我也 姐妹还喜欢茜,29,0
4808349109977135,Echo枱焉,2022-08-31 00:25:17,新疆,我也,4,0
4808328930394779,浅瞳是没有少女感的少女,2022-08-31 00:25:17,广东,支持,135,0
4808346475693349,Angerona翘,2022-08-31 01:34:04,重庆,但我是去按摩的话 技术不好就是原罪了 再帅再可爱都没办法原谅,179,11
4808359172374877,小白涂__阿潺,2022-08-31 01:34:04,重庆,去理发店，小鹿是技术娴熟的Tony，给你剪了一个大众贴脸发型，但嘲讽了你几句“头发挺少啊，发质也差”：拉宏手忙脚乱慌里慌张剪完，你发现卧槽剪成了地中海，眉毛也掉了半截，但胜在态度贼好又诚恳还少见的可爱，于是你舒舒服服步入了秃顶的怀抱。,105,8
4808339352977971,蜡笔小新没有心_dua,2022-08-31 01:34:04,内蒙古,完美点评，应该裱起来。,24,2
4808350989025886,trustyourselfdowntoearth,2022-08-31 01:34:04,广东,你放屁,39,0
4808316067513804,喉咙很深,2022-08-30 23:55:14,江苏,就是比她顺吧,11,0
4808315634716431,做我的鹿777,2022-08-30 23:55:14,安徽,嗯嗯嗯  从男性凝视角度看到女性30+,1198,3
4808345443631815,慢捻余香,2022-08-30 23:55:14,安徽,我也想说都是烂梗，看到热搜点进去看脱口秀大会以为会是肉食动物淘汰掉小鹿，那样更合理些，总之拉轰和小鹿这两个段子都不应该晋级,133,1
4808354981478415,F泽兮兮,2022-08-31 02:36:31,江西,网络喷子我当定了,3,1
4808360932934389,一股茶味儿,2022-08-31 02:36:31,安徽,就是,24,0
4808415367660048,超话社区,2022-08-31 02:36:07,,你好，你感兴趣的“脱口秀大会[超话]”已开通了超话社区～ 超话社区是微博旗下兴趣互动社区，快来与志同道合的小伙伴们一起交流互动吧！ 戳我进入&gt;&gt; 脱口秀大会,2.35亿,0
4808355463561974,微博明星,2022-08-31 02:36:07,,嘿！你也在关注“脱口秀大会”吗？快戳《脱口秀大会》嘉宾进入专题页查看并关注相关博主吧，热门精彩内容不错过！,543.7万,0
4808319216388312,我所梦想的都能实现,2022-08-30 23:44:59,北京,更何况你小鹿说了多少年脱口秀了 你选一个压根就没想过自己会拿灯的第一次说脱口秀的小姑娘本来就是欺负人 现在到踩着人家小姑娘开始卖惨了😅,24,23
4808312267473764,ll钟灵ll,2022-08-30 23:44:59,福建,啥事啊,516,3
4808317929523148,一只快活的野指针Le,2022-08-30 23:44:59,新疆,真的是，，内涵别人还一群人搁那心疼。,881,2
4808317757036204,旺仔橘子奶,2022-08-30 23:44:59,天津,不真诚也不好笑，还一天天内涵别人,94,1
4808372140638596,超话社区,2022-08-30 23:44:59,,你好，你感兴趣的“脱口秀大会[超话]”已开通了超话社区～ 超话社区是微博旗下兴趣互动社区，快来与志同道合的小伙伴们一起交流互动吧！ 戳我进入&gt;&gt; 脱口秀大会,2.35亿,0
4808311898115723,微博明星,2022-08-30 23:44:59,,嘿！你也在关注“脱口秀大会”吗？快戳《脱口秀大会》嘉宾进入专题页查看并关注相关博主吧，热门精彩内容不错过！,543.7万,0
4808312363942873,小鹿撞昏装混,2022-08-30 23:44:59,河北,同,34,0
4808322768966241,一只快活的野指针Le,2022-08-31 00:23:28,新疆,前半段真的好重的爹味……,881,13
4808321880555719,Leeyeung11,2022-08-31 00:23:28,泰国,个人也不太喜欢前面 本来不焦虑 说得我焦虑了 后半部分讲的喜欢！！！,74,2
4808337360683223,满月月月月_莞莞居揪在何心洲,2022-08-31 00:23:28,广东,但我还是要说这位姐姐讲得比拉宏桑好OJZ,1120,0
4808365157122350,会等到的对不对,2022-08-31 00:23:28,新疆,她这样好多次了，diss女性又吃女性红利算是让她玩明白了,2,1
4808336556164044,Tombliboosa,2022-08-31 00:23:28,四川,同感,1,0
4808322768966241,一只快活的野指针Le,2022-08-31 00:23:28,新疆,前半段真的好重的爹味……,881,13
4808321880555719,Leeyeung11,2022-08-31 00:23:28,泰国,个人也不太喜欢前面 本来不焦虑 说得我焦虑了 后半部分讲的喜欢！！！,74,2
4808337360683223,满月月月月_莞莞居揪在何心洲,2022-08-31 00:23:28,广东,但我还是要说这位姐姐讲得比拉宏桑好OJZ,1120,0
4808365157122350,会等到的对不对,2022-08-31 00:23:28,新疆,她这样好多次了，diss女性又吃女性红利算是让她玩明白了,2,1
4808336556164044,Tombliboosa,2022-08-31 00:23:28,四川,同感,1,0
4808328138459245,有风-东来,2022-08-31 00:46:06,江苏,不过人家真的会嗷，买热搜美美虐粉,325,6
4808328587512232,阿啊啊啊啊飞啊,2022-08-31 00:46:06,浙江,嗨，当初看不起，现在发现有钱赚就屁颠屁颠跑来了，果然还是得为五斗米折腰,254,7
4808387685253256,超话社区,2022-08-31 00:46:06,,你好，你感兴趣的“脱口秀大会[超话]”已开通了超话社区～ 超话社区是微博旗下兴趣互动社区，快来与志同道合的小伙伴们一起交流互动吧！ 戳我进入&gt;&gt; 脱口秀大会,2.35亿,0
4808327122651075,微博明星,2022-08-31 00:46:06,,嘿！你也在关注“脱口秀大会”吗？快戳《脱口秀大会》嘉宾进入专题页查看并关注相关博主吧，热门精彩内容不错过！,543.7万,0
4808334946074841,钢铁郁金香532,2022-08-31 00:46:06,北京,别说了我看有人剧透她还会复活！！！无语，这一波美美虐粉了，还发离别感言。。。,1,0
4808343707190023,陈宇烊_,2022-08-31 01:24:15,山西,不管怎么样小鹿和拉宏比也是小鹿该晋级啊,3,7
4808349394405014,爱吃柠檬的小猫咪酱,2022-08-31 01:24:15,法国,那不是那英强迫她选的吗？你看节目了吗？,2,1
4808350795563973,trustyourselfdowntoearth,2022-08-31 01:24:15,广东,你放屁,39,1
4808313826444830,钟钟钟Zancia,2022-08-30 23:19:43,四川,她怎么了啊 好奇,1236,3
4808305488170423,微博明星,2022-08-30 23:19:43,,嘿！你也在关注“脱口秀大会”吗？快戳《脱口秀大会》嘉宾进入专题页查看并关注相关博主吧，热门精彩内容不错过！,543.7万,0
4808316965098796,想吃冬天的糖葫芦,2022-08-30 23:19:43,河北,没错，我记得当时她内涵杨笠和笑果，现在怎么还好意思来上笑果的节目,0,2
4808319079028919,一只快活的野指针Le,2022-08-30 23:19:43,新疆,是的呢，真的活该。,881,0
4808307670254281,執杯勸星辰,2022-08-30 23:19:43,福建,给你点了,49,0
4808385906344416,好好睡觉蔡同学,2022-08-31 01:18:18,云南,确实!被这个评判标准整懵了,85,0
4808345287918403,陌芍茶冷,2022-08-31 01:18:18,广东,最后两句说得对！！,1,0
4808350216749570,微博明星,2022-08-31 02:06:21,,嘿！你也在关注“脱口秀大会”吗？快戳《脱口秀大会》嘉宾进入专题页查看并关注相关博主吧，热门精彩内容不错过！,543.7万,0
4808453312217920,乐呵娜拉,2022-08-31 01:59:10,北京,确实没想到，虽然不反感大版“王小麦”。,4077,0
4808345443893829,超话社区,2022-08-31 01:59:10,,你好，你感兴趣的“脱口秀大会[超话]”已开通了超话社区～ 超话社区是微博旗下兴趣互动社区，快来与志同道合的小伙伴们一起交流互动吧！ 戳我进入&gt;&gt; 脱口秀大会,2.35亿,0
4808405816180800,超话社区,2022-08-31 01:58:46,,你好，你感兴趣的“脱口秀大会[超话]”已开通了超话社区～ 超话社区是微博旗下兴趣互动社区，快来与志同道合的小伙伴们一起交流互动吧！ 戳我进入&gt;&gt; 脱口秀大会,2.35亿,0
4808346231637005,微博明星,2022-08-31 01:58:46,,嘿！你也在关注“脱口秀大会”吗？快戳《脱口秀大会》嘉宾进入专题页查看并关注相关博主吧，热门精彩内容不错过！,543.7万,0
4808318596155381,旺仔橘子奶,2022-08-31 00:01:58,天津,在杨笠被骂上热搜第一，被网爆的时候你美美倒油内涵，这时候就别买水军卖惨了哈，段子真的不好笑。,94,0
4808343417259116,Timoyaiscra,2022-08-31 01:50:52,湖北,内涵背刺完杨笠和笑果又跑过来拿女性取笑讲段子 不要太晦气了你,565,0
4808350434329535,奇迹小羊yyy,2022-08-31 01:50:11,湖北,同感,29,0
4808403291472304,超话社区,2022-08-31 01:48:29,,你好，你感兴趣的“脱口秀大会[超话]”已开通了超话社区～ 超话社区是微博旗下兴趣互动社区，快来与志同道合的小伙伴们一起交流互动吧！ 戳我进入&gt;&gt; 脱口秀大会,2.35亿,0
4808347708293968,微博明星,2022-08-31 01:48:29,,嘿！你也在关注“脱口秀大会”吗？快戳《脱口秀大会》嘉宾进入专题页查看并关注相关博主吧，热门精彩内容不错过！,543.7万,0
4808402787631766,超话社区,2022-08-31 01:46:46,,你好，你感兴趣的“脱口秀大会[超话]”已开通了超话社区～ 超话社区是微博旗下兴趣互动社区，快来与志同道合的小伙伴们一起交流互动吧！ 戳我进入&gt;&gt; 脱口秀大会,2.35亿,0
4808343808639999,微博明星,2022-08-31 01:46:46,,嘿！你也在关注“脱口秀大会”吗？快戳《脱口秀大会》嘉宾进入专题页查看并关注相关博主吧，热门精彩内容不错过！,543.7万,0
4808402792612256,微博明星,2022-08-31 01:46:31,,嘿！你也在关注“脱口秀大会”吗？快戳《脱口秀大会》嘉宾进入专题页查看并关注相关博主吧，热门精彩内容不错过！,543.7万,0
4808402787631252,超话社区,2022-08-31 01:46:31,,你好，你感兴趣的“脱口秀大会[超话]”已开通了超话社区～ 超话社区是微博旗下兴趣互动社区，快来与志同道合的小伙伴们一起交流互动吧！ 戳我进入&gt;&gt; 脱口秀大会,2.35亿,0
4808323016166804,一只快活的野指针Le,2022-08-31 00:01:26,新疆,点了。,881,4
4808321200031019,想当智秀粉头,2022-08-31 00:01:26,海南,人家就是吐槽年龄焦虑呀,31,0
4808337054499008,澄澄澄程,2022-08-31 00:01:26,北京,说太对了。她就是在制造焦虑。还拿受害者的焦虑来调侃，并不觉得她的内容在帮女性说话,1185,1
4808320319491630,想当智秀粉头,2022-08-31 00:01:26,海南,这也可以和女性情绪联想在一起吗？,31,0
4808344533992637,南笙nns,2022-08-31 01:38:29,福建,不攻击拉宏桑仅针对本场段子   笑果是真的烂,43,0
4808342674867911,南笙nns,2022-08-31 01:38:29,福建,周迅拍第四灯我是万万没有想到  您真的会看脱口秀是吗,43,0
4808342868591649,做梦做到外太空,2022-08-31 01:38:29,广东,气死了！！刚看,284,0
4808340721632561,星期五的栀风小厨,2022-08-31 01:37:26,北京,,1.2万,1
4808340699350169,星期五的栀风小厨,2022-08-31 01:37:26,北京,期待,1.2万,1
4808340682834134,星期五的栀风小厨,2022-08-31 01:37:26,北京,,1.2万,1
4808340909327844,蜡笔小新没有心_dua,2022-08-31 01:00:14,内蒙古,她内涵过不少笑果的演员。,24,5
4808336888037650,xxxxyxxxxxx_,2022-08-31 01:00:14,福建,小鹿背刺杨笠。。。,116,4
4808342176008782,小薛RIxezo,2022-08-31 01:00:14,四川,也没有说顺杨笠生逆杨笠死，小鹿看不上笑果，内涵笑果内涵其他演员内涵杨笠,87,1
4808334639366274,钢铁郁金香532,2022-08-31 01:00:14,北京,啊姐妹吃瓜吃全啊，她那是很明显内涵杨笠跟笑果啊，不是单单分享感悟,1,1
4808339341181951,序临-,2022-08-31 01:00:14,四川,把瓜吃全,1,3
4808340909327844,蜡笔小新没有心_dua,2022-08-31 01:00:14,内蒙古,她内涵过不少笑果的演员。,24,5
4808336888037650,xxxxyxxxxxx_,2022-08-31 01:00:14,福建,小鹿背刺杨笠。。。,116,4
4808342176008782,小薛RIxezo,2022-08-31 01:00:14,四川,也没有说顺杨笠生逆杨笠死，小鹿看不上笑果，内涵笑果内涵其他演员内涵杨笠,87,1
4808334639366274,钢铁郁金香532,2022-08-31 01:00:14,北京,啊姐妹吃瓜吃全啊，她那是很明显内涵杨笠跟笑果啊，不是单单分享感悟,1,1
4808339341181951,序临-,2022-08-31 01:00:14,四川,把瓜吃全,1,3
4808400271049079,超话社区,2022-08-31 01:36:41,,你好，你感兴趣的“脱口秀大会[超话]”已开通了超话社区～ 超话社区是微博旗下兴趣互动社区，快来与志同道合的小伙伴们一起交流互动吧！ 戳我进入&gt;&gt; 脱口秀大会,2.35亿,0
4808342093169752,微博明星,2022-08-31 01:36:41,,嘿！你也在关注“脱口秀大会”吗？快戳《脱口秀大会》嘉宾进入专题页查看并关注相关博主吧，热门精彩内容不错过！,543.7万,1
4808475722912943,Sirius盛可以,2022-08-31 01:36:41,辽宁,这些女的很搞笑，打着女性主义的旗帜在攻击小鹿，结果girls迫害girls,2806,0
4808404306231830,搬砖达人小王,2022-08-31 01:36:41,北京,杨笠都没说啥，粉丝们蹦起来了,246,0
4808342873309733,猫咪三号_,2022-08-31 01:36:13,英国,我咋觉得她俩讲得都一般,102,0
4808339471205376,好想吃肥锅,2022-08-31 01:34:49,贵州,新一季了？,39,0
4808352792838769,微博明星,2022-08-31 01:34:12,,嘿！你也在关注“脱口秀大会”吗？快戳《脱口秀大会》嘉宾进入专题页查看并关注相关博主吧，热门精彩内容不错过！,543.7万,0
