用户id,用户昵称,评论时间,IP地址,评论内容,评论人粉丝数,评论点赞数
4808533381743076,淄博检察,2022-08-31 08:51:58,,关注热点，传播正能量。,1.4万,0
4808485000187602,济宁高新检察,2022-08-31 08:51:58,,关注,4204,0
4808470941664022,神木检察,2022-08-31 08:51:58,,,340,0
4808468869155390,丹棱县公安局,2022-08-31 08:51:58,,,2907,0
4808467799346057,眉山公安,2022-08-31 08:51:58,,,25.4万,0
4808467229180863,毕节消防,2022-08-31 08:51:58,,,21.5万,0
4808466679467193,菏泽中院,2022-08-31 08:51:58,,关注,46.5万,0
4808464931750988,高新服务,2022-08-31 08:51:58,,,17.7万,0
4808460325357513,菏泽市人民检察院,2022-08-31 08:51:58,,关注   @菏泽市人民检察院,2.6万,0
4808458623261047,丹东市人民检察院,2022-08-31 08:51:58,,传播信息微平台传递法治正能量,2.6万,0
4808456492814135,法润成华,2022-08-31 08:51:58,,,3万,0
4808466171953765,綦江法院,2022-08-31 08:51:58,,,5918,0
4808484338798441,白水检察,2022-08-31 08:51:58,,共同关注,2.7万,0
4808483645425824,红花岗检察在线,2022-08-31 08:51:58,,,857,0
4808492634603692,你有点晕,2022-08-31 09:20:27,河南,#刘学州遗书希望加害者得到惩罚#,59,0
4808467950868908,木电水暖工,2022-08-31 10:01:47,北京,转发微博,30,0
4808436183469533,稻田等风,2022-08-31 07:54:32,四川,工资都能兑付，老人的钱为啥要拖到明年才结清？风口一过还是拿不到钱，农民就这么该被区别对待吗……,103,19
4808448145361977,一条大路哟通向我家哟,2022-08-31 07:54:32,安徽,监管靠网络，不得不说是法治的一种悲哀,60,4
4808435701123826,无明神风liu,2022-08-31 07:54:32,四川,明年老人有可能都走了,184,4
4808444744040532,此文档不可修改,2022-08-31 07:54:32,山东,明年二月底？你玩呢？老人指着这钱过年呢？这么个事也要等半年？,228,4
4808441778405998,开拓者V1,2022-08-31 07:54:32,河南,明年2月底，然后还是明年2月底，2月何其多～,95,2
4808436908560827,河内先生,2022-08-31 07:54:32,北京,西部地区还是太落后,626,1
4808462984811604,明月TWINKLE,2022-08-31 07:54:32,广东,笑死了，又开始忽悠网民，明年二月谁还记得这事？,208,0
4808453065539839,Ksha,2022-08-31 07:54:32,广东,就这？,170,0
4808451609855861,哈迪巴巴,2022-08-31 07:54:32,广东,要看道歉视频,218,0
4808451009810961,黄江·水,2022-08-31 07:54:32,广东,捅到中央去也是明年2月底，你把地租给别人，主动权就到人家手里了,11,1
4808448086641923,立春春暖花开,2022-08-31 07:54:32,河南,为什么要等到明年2月，很多钱？,127,0
4808446354656975,几年后回头看看现在,2022-08-31 07:54:32,上海,若没有这段视频，没有舆论压力，事情又以何种结果处理呢,3,1
4808445914257194,高洛文,2022-08-31 07:54:32,北京,令人发指的画面，令人窒息的处理通报。,496,2
4808442881507705,是懒猫鱼,2022-08-31 07:54:32,北京,明年2月底。。。。。真是好笑,293,1
4808438800713500,贺先生999,2022-08-31 07:54:32,广东,荒唐的我，荒唐的你，荒唐的它,115,0
4808435146949183,大魔幻拉面酱,2022-08-31 07:54:32,安徽,明年？,29,0
4808495260240749,山东王公子,2022-08-31 07:54:32,山东,没有处罚吗？越来越失望了,30,0
4808460347113746,力木各,2022-08-31 07:54:32,江苏,这种尿性,112,0
4808447516477724,蒙恩蒙恩Moon,2022-08-31 07:54:32,新疆,明日复明日，利息给不给,2737,0
4808466876863723,好想捉一只蛙,2022-08-31 10:00:53,河南,地主阶级死灰复燃,43,0
4808529959717503,玛卡巴卡大白鹅,2022-08-31 10:00:53,新疆,然后天天用所谓的正能量去掩盖 只是觉得吵闹,3,0
4808468030296530,木电水暖工,2022-08-31 10:00:24,北京,转发微博,30,0
4808534669137099,YourMoal,2022-08-31 10:00:22,山东,啊啊啊看着好气,262,0
4808468987121470,自然卷柚子,2022-08-31 09:59:50,四川,虽然实缴了500万，但不代表银行账户上就有500万，可能早就转出去了,17,0
4808525816267792,番茄不剥皮的段汤,2022-08-31 09:04:30,湖北,农民永远是炮灰和背锅侠,294,0
4808467649400431,好想捉一只蛙,2022-08-31 09:58:27,河南,被打倒的地主阶级死灰复燃,43,0
4808467507055583,淘废品的大爷,2022-08-31 08:13:13,江西,#陕西蓝田通报老人被群嘲事件#西安鑫龙门农林科技有限公司，蓝田县蓝关街道三十米路宏辉秀水花园第三幢一单元三层东户孙答向。笑的最开心的那个就是孙答向。,86,0
4808471377614043,快乐蹲,2022-08-31 09:55:29,浙江,这些人好像也没啥损失,436,5
4808468139607475,我和阿玉手拉手,2022-08-31 09:55:29,广东,道歉有用要警察干嘛，轻飘飘的对不起能抵消伤害嘛,252,3
4808468387859192,生活小不点123,2022-08-31 09:55:29,山东,都是官老爷，我可是见过的，动不动就让警察抓人威胁。,1874,2
4808473797200518,yi切都会好的,2022-08-31 09:55:29,山西,分期有利息么？,142,1
4808490789372523,Starfish,2022-08-31 09:55:29,天津,那个老人太可怜了,890,0
4808468672020482,-Bronson,2022-08-31 09:55:29,内蒙古,好家伙拖到明年二月了,238,0
4808465560111820,林毛毛童鞋思密达,2022-08-31 09:55:29,上海,道歉！！！诚恳道歉！！！真是世界大了，什么渣渣子都有，也配当人,140,3
4808490909959170,竹乡慢羊羊,2022-08-31 05:58:18,浙江,,770,0
4808432449751806,ca王哥,2022-08-31 05:58:18,浙江,不出事不上热搜，没人关心更没人重视，为人民服务仅仅是一句口号，这就是现状。,15,1
4808424850457241,大秦宰相,2022-08-31 05:58:18,陕西,这种情况不是个例，必须要引起重视！,21.6万,7
4808528487517478,金xiao柱,2022-08-31 09:07:17,安徽,村里普遍有这种现象,1.1万,0
4808512126065221,o晓茗的慧慧,2022-08-31 09:07:17,江苏,谁都有老的一天,16万,0
4808477233645225,蓝瑟情缘66,2022-08-31 09:07:17,福建,有些老人没有背景，谁会理你哟,1.3万,0
4808463635185853,·暗黑蒂蒂·,2022-08-31 09:07:17,美国,人都会有老的一天,1883,1
4808464004286769,二之前是一啊,2022-08-31 09:48:19,河南,企业不就是这样能拖就拖，都是钱,0,0
4808482366163163,红星闪闪好多鱼,2022-08-31 09:47:13,浙江,周三愉快,2066,0
4808476188479248,小市民很老,2022-08-31 09:47:13,内蒙古,周三愉快！,2291,0
4808509886042739,--Morris,2022-08-31 09:47:13,北京,回复 @Khalessi-x 的赞: 哈哈,1001,0
4808509873717850,--Morris,2022-08-31 09:47:13,北京,回复 @小T是也 的赞: 哈哈,1001,0
4808509843052635,--Morris,2022-08-31 09:47:13,北京,回复 @小市民很老 的赞: 感谢支持,1001,0
4808509830989706,--Morris,2022-08-31 09:47:13,北京,回复 @石村点李 的赞: 感谢支持,1001,0
4808509806612150,--Morris,2022-08-31 09:47:13,北京,回复 @橘子orangemen 的赞: 哈哈,1001,0
4808464218462015,二之前是一啊,2022-08-31 09:46:48,河南,参考黄淑芬事件呗，没办法，法律有局限性,0,0
4808463341322323,-天眸之神-,2022-08-31 09:45:14,四川,咱们广大网友不光要忙工作还要在百忙之中来微博办案，简直不要太累,250,0
4808453056368517,芝士想说很爱你,2022-08-31 08:58:25,河北,啊啊啊啊啊啊啊气死了！,0,2
4808452961206774,芝士想说很爱你,2022-08-31 08:58:25,河北,还有这个视频 让我感觉在看扫黑风暴,0,2
4808452512417117,芝士想说很爱你,2022-08-31 08:58:25,河北,还有为什么不强制执行！,0,2
4808452420145475,芝士想说很爱你,2022-08-31 08:58:25,河北,这些人没有父母吗 这么对待老人,0,1
4808457422897160,-甜茶追逐日-,2022-08-31 09:23:33,江西,受不了了,5,3
4808461034980640,王言之小築,2022-08-31 09:37:33,浙江,并没有哦。你看通报其实并没有解决问题,1199,0
4808465333096874,Karryzus,2022-08-31 09:37:12,陕西,艺术来源于生活,26,0
4808504991549958,木槿BX95,2022-08-31 09:36:18,广东,25万多,108,0
4808461767937529,__阿比安吉,2022-08-31 09:35:20,上海,再拖半年,33,11
4808463337391420,口袋巴拉,2022-08-31 09:35:20,甘肃,跪求原谅，全网直播一小时,218,4
4808461500552373,新乡赫胥黎,2022-08-31 09:35:20,江苏,土匪露出小马脚了,16,1
4808505175838218,一线生机交易员,2022-08-31 09:35:20,江苏,两年不给承包费，政府熟视无睹，好意思！,413,0
4808464352940716,郝赫2,2022-08-31 09:35:20,新加坡,是不是盼着老人活不到那时候？还是说等着网民忘了就算了？,387,0
4808461646561295,还是再退了吧,2022-08-31 09:35:20,北京,欠钱不给的，耻笑债主……,98,1
4808460606375983,hyqqq-hyq,2022-08-31 09:35:20,北京,请公开道歉 谢谢,108,0
4808461944359208,lfg228_708,2022-08-31 09:35:20,北京,难道不应该立即兑付吗？拖过新闻热度，明年2月就不给了,35,2
4808480067686200,夏言其37927,2022-08-31 09:35:20,广东,后续会不会打击报复老人,0,0
4808480374128683,勇敢和快乐的孩子,2022-08-31 09:35:20,广东,烂透,5,0
4808473730613428,胆小的兔子爱吃肉,2022-08-31 09:35:20,北京,没有问责，没有贪腐，没有渎职，个人感觉处理的仅仅是舆情，对···是舆情事件而不是这件事情的本来问题。,293,1
4808461290309690,大大大大大大大大大大大博,2022-08-31 09:35:20,北京,看到这种新闻，已经不像以前替弱势一方感到特别开心了，而是慢慢变的无感，甚至有点悲哀。,60,0
4808459583226322,人人贷快还我钱888,2022-08-31 09:29:50,辽宁,#官方回应老人索要土地承包费被群嘲# 朝阳区几百万出借人拭目以待，看看朝阳的伞到底有多大？正义最终能不能战胜邪恶？！民财不可夺！民心不可伤！民意不可违！#人人贷平台逾期兑付两年#,46,2
4808527664907944,汉人76422,2022-08-31 09:29:50,陕西,#人人贷平台逾期兑付两年#人人贷还涉嫌诈骗、违法《合同法》、《民典法》等。人人贷经营地北京朝阳区，朝阳区经侦#张吉星#以130多万元，摆平了各路门神，每月嫖资达30万元，平台经营人以3亿收割30多亿。,46,0
4808460279222073,对荔枝过敏_,2022-08-31 09:26:12,陕西,西安拔智齿。,3,0
4808459260268188,也太难了吧,2022-08-31 09:25:46,陕西,有些人根本不配为人,118,1
4808492366695617,一颗仙人掌J,2022-08-31 09:25:46,陕西,我看蓝天那个老人要工资视频 把我都快气死了  为啥么良心的人这么多,53,0
4808481460457460,是佩奇的小朋友啊,2022-08-31 09:25:46,江西,原来项目上真的会拖欠工资我之前还以为我同学他们在乱说,135,0
4808457850455097,小麦公考陈洁,2022-08-31 09:25:26,陕西,答案来了,124.7万,0
4808457745600963,岢岚绽放,2022-08-31 09:23:11,上海,着急点错了，孔字！,599,0
4808454185680990,淙淙ksk,2022-08-31 09:01:42,河北,爆出来了钱也未必能给，给到手是钱，承诺明年二月给不算钱因为明年二月就没人关注了。照样不给也没有人有办法。,0,0
4808228975940824,中年危机小光头,2022-08-30 17:51:12,四川,到底叫孙答向还是叫孙答相啊,47,257
4808224765903299,舆情探长,2022-08-30 17:51:12,河北,该公司目前制定相应的还款计划,33.2万,100
4808229533515841,true_achen,2022-08-30 17:51:12,上海,什么时候落实呢，我还计划明年挣得比马化腾多呢,23,60
4808225189527970,屎里逃豆丁be哟,2022-08-30 17:51:12,广东,顶,976,40
4808414515430569,野心悠扬,2022-08-30 17:51:12,河南,我想去替天行道,163,14
4808222903638358,电线电缆回收厂家,2022-08-30 17:51:12,河北,转发微博,2,3
4808235276309864,李氏天启,2022-08-30 17:51:12,广西,我看成孙答应,63,55
4808222772303388,回收电缆厂家万越,2022-08-30 17:51:12,河北,转发微博,8,5
4808231904087605,醉声梦语,2022-08-30 17:51:12,北京,全国还有多少这样恃强凌弱、欺负底层人民的事没有曝光，一只蟑螂出现时说明暗处已经有一窝了,296,119
4808228620210556,有一个花园的房子,2022-08-30 17:51:12,四川,已经发去问候,91,36
4808231261836294,这是个诗意的名字,2022-08-30 17:51:12,上海,二股东有点意思,364,19
4808231002310999,孤行者011,2022-08-30 17:51:12,四川,从今天开始，这个公司凉了，耶稣来了也没用，我说的,0,23
4808234408608251,下一步是请叫我鸭大王,2022-08-30 17:51:12,四川,哦，也就是说从15年用地开始到今天根本没打算给钱？然后看闹大了决定开始还款？利息给别人算不,144,36
4808231006241704,胆小鬼lismy,2022-08-30 17:51:12,重庆,还款计划还是得老人自己去催,67,33
4808262501797524,小白哥嗨嗨,2022-08-30 17:51:12,河北,西安产业扶贫投资基金占19%股份，这是什么性质的基金啊,19,10
4808244813631858,招牌小埋,2022-08-30 17:51:12,山东,可不可以让他们马上死掉呀，用他们抚恤金还钱。,37,15
4808233392537742,TheWorld_Hu,2022-08-30 17:51:12,尼日利亚,扶贫基金都落入这种人手里了,330,29
4808234193915555,专心等时影zx,2022-08-30 17:51:12,江苏,两年内总额产生的利息是不是也该计算一下,49,15
4808262521718504,小喵掰包谷33,2022-08-30 17:51:12,贵州,是不是不曝光，还得拖几年,43,3
4808284320301988,nine要夏天,2022-08-30 17:51:12,辽宁,@冲浪的小南,57,0
4808456936096697,超话社区,2022-08-31 09:22:12,,你好，你感兴趣的“隐入尘烟[超话]”已开通了超话社区～ 超话社区是微博旗下兴趣互动社区，快来与志同道合的小伙伴们一起交流互动吧！ 戳我进入&gt;&gt; 隐入尘烟,2.35亿,0
4808472912728645,第两百个小太阳,2022-08-31 09:22:09,江西,“扫黑除恶攻坚战”，是打自己吗，还在行动，真讽刺,129,0
4808457335083457,我只喝豆奶-,2022-08-31 09:22:09,陕西,这对这些人不就是个装饰品吗，看不见的人贴在他们家大门上人家也看不见啊,628,2
4808421117526260,拥抱所罗门,2022-08-31 06:55:35,福建,这个场面，跟乌纳侮辱二战老兵，没有本质的区别！,127,5
4808457834464080,喵了个咪冲鸭冲鸭冲鸭,2022-08-31 09:19:03,河南,"实则,通报出来的时候,当下一件事儿都没解决,而是拖到几个月后了!",128,0
4808457683472303,都比程,2022-08-31 09:17:40,安徽,道歉有用的话还需要警察干嘛？,101,2
4808471168161461,皮卡UU,2022-08-31 09:17:40,江苏,呕心,138,0
4808458597830634,哈良苏苏,2022-08-31 09:17:40,浙江,这么多人都要感谢这老头，西北民风彪悍，竟然要靠一个老头讨债，脸呢？,106,0
4808477820059728,第两百个小太阳,2022-08-31 09:16:44,江西,该公司法人是村党支部书记，“最美乡村科技致富带头人”,129,0
4808462360384385,-天眸之神-,2022-08-31 09:16:44,四川,这种公司一般只是为了吃国家的农业补贴款，拿到钱就欠别人钱跑路，到时人影你都看不到一点,250,0
4808455468354679,理想主义诗人·,2022-08-31 09:15:49,江西,呵呵,1.1万,6
4808455443189107,理想主义诗人·,2022-08-31 09:15:49,江西,,1.1万,6
4808455418288264,理想主义诗人·,2022-08-31 09:15:49,江西,无言以对,1.1万,6
4808456575385849,理想主义诗人·,2022-08-31 09:15:49,江西,。。,1.1万,1
4808455716082052,氧的意义,2022-08-31 09:15:49,江西,嗯。。。,1,5
4808457032568310,刘玄霖,2022-08-31 09:15:49,江苏,抱歉并没重视,1,0
4808459457398730,倚栏释闲情,2022-08-31 09:14:29,湖南,关爱老人,130,1
4808455225608446,雨落心555,2022-08-31 09:14:29,山东,不曝光是不是打算一直拖欠下去,79,1
4808326577651780,wencuncun,2022-08-31 00:34:53,广东,战狼3再不出 我顶不住了,50,10
4808425571878251,宇文-朝阳,2022-08-31 00:34:53,江西,看看热播，隐入尘烟,1009,5
4808427262706315,车车来了123,2022-08-31 00:34:53,北京,有一点权利就牛逼的很,42,1
4808422773489787,我叫刘三喜,2022-08-31 00:34:53,湖南,“南村群童欺我老无力，忍能对面为盗贼”，前几天做梦梦见自己年老力衰，面对世间的不好，再也没有力气抗争，可怜又可悲,12,2
4808419834069287,刘一多少,2022-08-31 00:34:53,广东,盛世如它所愿,30,1
4808327819693553,不知当年,2022-08-31 00:34:53,河北,很不舒服,339,1
4808340352533954,心若水寒7,2022-08-31 00:34:53,浙江,此情可待成追忆，只是当时已惘然,570,2
4808418500543179,熏悟空打怪兽,2022-08-31 00:34:53,天津,这就是老百姓现状，无奈,19,1
4808444583874414,荒野中的西顿,2022-08-31 00:34:53,天津,云横秦岭家何在，雪拥蓝关马不前。,59,0
4808325696850766,北京太可惜1984,2022-08-31 00:34:53,北京,胖哥早睡吧,727,0
4808325205856409,羽凌封雪,2022-08-31 00:34:53,山东,胖哥看看电影。引入尘烟,212,0
4808463119025044,贝塔572,2022-08-31 09:12:27,甘肃,劳动监察大队是摆设呗？,12,0
4808473193484529,小哥看威海,2022-08-31 09:12:27,山东,怎么评论又过滤了？官官相护吗？,7,0
4808455402294033,天雷滚滚Jeff,2022-08-31 09:12:27,浙江,正在处理？是在把老人给处理了吧,188,0
4808450892105956,春夏秋冬STARRY,2022-08-31 08:33:09,北京,好气居然还能拖半年,33,2
4808514704773666,黄弋石弋石戈诗人,2022-08-31 06:38:36,江苏,内心善良，真正许愿。,3923,0
4808453854070961,叶昼城,2022-08-31 08:53:33,陕西,天下的乌鸦一般黑,73,0
4808459936334397,佛系小记,2022-08-31 09:03:19,福建,非要等到媒体关注了再来一句“正在处理”,710,0
4808452130213339,王言之小築,2022-08-31 09:02:12,浙江,劳动监察大队,1199,0
4808446266837908,·春野醉辞時·,2022-08-31 08:38:59,山西,,1万,1
4808446153064701,·春野醉辞時·,2022-08-31 08:38:59,山西,,1万,1
4808446098278156,·春野醉辞時·,2022-08-31 08:38:59,山西,,1万,1
4808450099383752,周杰伦啥时候出第16张专辑,2022-08-31 08:52:41,浙江,我们需要后续跟进！这才9月份！一杆子支到半年后 谁知道半年后什么样！,135,9
4808458643443355,SHE娜娜,2022-08-31 08:52:41,山东,不发上网永远解决不了,222,0
4808451915779717,Emma画图版,2022-08-31 08:52:41,广东,,5,0
4808450356021063,义忠梁山伯,2022-08-31 08:52:41,北京,这种有限责任的农业公司就是骗子：1骗国家的种养殖、农机、农资等补贴；2骗租村里的土地，签10—30年合同，前两年还能给地租，种苗下地或养上规模就不付租金，村里也不能去拔苗牵牲口啊；3骗建场地施工队、材料供应商和招来的生产工人，有收入都进个人账户了，公司账上没有钱。总之谁起诉都没钱执行。,61,0
4808452406775884,朱兵198303,2022-08-31 08:52:31,山东,就是官商勾结拖时间，等舆论不关注了就行了，流转费肯定不会给的。,14,0
4808437524858299,贪养这栀,2022-08-31 08:04:02,山西,,1.2万,1
4808437479772071,贪养这栀,2022-08-31 08:04:02,山西,,1.2万,1
4808437441497732,贪养这栀,2022-08-31 08:04:02,山西,,1.2万,1
4808437424194934,贪养这栀,2022-08-31 08:04:02,山西,,1.2万,1
4808437412661773,贪养这栀,2022-08-31 08:04:02,山西,,1.2万,1
4808437404270707,贪养这栀,2022-08-31 08:04:02,山西,,1.2万,1
4808437387493558,贪养这栀,2022-08-31 08:04:02,山西,,1.2万,1
4808437365738644,贪养这栀,2022-08-31 08:04:02,山西,,1.2万,1
4808437354205738,贪养这栀,2022-08-31 08:04:02,山西,,1.2万,1
4808468483803688,贪养这栀,2022-08-31 08:04:02,山西,,1.2万,0
4808439182135077,贪养这栀,2022-08-31 08:04:02,山西,,1.2万,0
4808438381546041,贪养这栀,2022-08-31 08:04:02,山西,,1.2万,0
4808438368176643,贪养这栀,2022-08-31 08:04:02,山西,,1.2万,0
4808439769596256,不耍流氓会死星人,2022-08-31 08:04:02,江苏,这也太过分了，拖欠农民的土地流转费，怎么敢的？！这单位什么背景敢这么横行霸道？,2342,1
4808456063685007,Ghibli369,2022-08-31 08:43:51,河南,,7,0
4808324783278219,温酒醉月nice,2022-08-31 00:24:14,陕西,土地兼并，历代亡国根本原因就是这个,108,130
4808330146481536,何留香,2022-08-31 00:24:14,上海,还有乡贤下乡。,79,66
4808326686442954,l艳阳高赵l,2022-08-31 00:24:14,辽宁,每一次危机农村都是兜底的，如果土地私有化了，谁又是冤大头呢？中产？肯定不再是农民了，因为他们已经一无所有了,300,91
4808325515972268,QQMKFOO,2022-08-31 00:24:14,河南,这破公司还有政府投资基金背景,10,64
4808330466035290,元元你好啊,2022-08-31 00:24:14,上海,土地私有化，7亿农民去哪里,18,35
4808416994264434,柚荷暧,2022-08-31 00:24:14,广东,流转是趋势啊，因为大部分农村只剩老人种地了，种不了的只能荒掉。,33,7
4808342588097025,奇怪的fengchi十一,2022-08-31 00:24:14,广东,私有化和流转是两个概念，当然应该流转，流转使用权，固定所有权，让农村土地证券化，这样农村才有未来……这个案子有问题，不一定是政策有问题，可能更多是执行问题。哪怕政策有问题，只要固定住所有权，一时的使用权损失无伤大雅,6,11
4808367413133614,雨下2020520,2022-08-31 00:24:14,福建,还敢私有化，没私有化都作威作福，一旦私有化，最后的保障就彻底没了，王朝规律又开始波动了,2,14
4808431653356287,利刃9637,2022-08-31 00:24:14,江苏,农民没了土地就会变成流民，想想明朝末年从甘肃一带起来的流民，当时有一支很牛逼的队伍，有一个带头人叫李自成，结果大家都知道了,14,7
4808399840084227,又耳摘桃,2022-08-31 00:24:14,广东,放心，现在农村新型地主大把！！！农村土地都快被卖光了,21,6
4808447525129374,趿拉板儿的春天2022,2022-08-31 00:24:14,北京,政策上，“三自一包四大自由”不进行公开批判和取消，也就是说不做批评与自我批评，那么土地流转就永远取消不了，确定一定以及肯定……,0,1
4808332935954979,功夫茶不要武功,2022-08-31 00:24:14,广东,农村需要有智慧的人才因地制宜谋发展之路,0,1
4808466257153964,东东有礼了,2022-08-31 00:24:14,上海,谁主张这个，就疯了,1,0
4808460174890156,扎了个克fighting,2022-08-31 00:24:14,浙江,村集体的土地应该由村里统一管理经营，不能转包给个人。,37,0
4808447755030475,乡野有栗子,2022-08-31 00:24:14,山东,可以适当流转，但是不能私有化，私有化成了农民的财产，第二天可能就被资本买走了,496,1
4808445305295022,子不理,2022-08-31 00:24:14,吉林,这老头也有问题吧，国家的土地，他凭啥出租啊？,2,0
4808439979574654,LP醒着做梦,2022-08-31 00:24:14,广西,土地都私有化还是社会主义吗？,59,0
4808412187067663,咕咕咚咚6666,2022-08-31 00:24:14,广东,不私有化，卖田款基本村书记说了算。,5,2
4808323323136654,Oo-破茧oO,2022-08-31 00:24:14,广东,你说了不算,89,0
4808493720145086,嘛呀哈,2022-08-31 00:24:14,广东,稻谷小夫,155,0
4808448389417808,丰铝VVV,2022-08-31 08:37:47,河北,隐入尘烟不只是文艺片，像是现实纪录片，,4.6万,18
4808449173751948,淮上月于我心,2022-08-31 08:37:47,河北,通透,340,2
4808495750448065,鱿鱼1978,2022-08-31 08:37:47,山东,赞同,364,0
4808487916276198,百八九百,2022-08-31 08:37:47,山西,小微企业主又成有权势的人了，你们真要笑死我，世界上最有权势的是那个男人拜登,9,0
4808452968810163,顾念蓄物VS拼搏一笑,2022-08-31 08:37:47,北京,小心被风,278,0
4808466931646980,淘废品的大爷,2022-08-31 08:37:47,江西,#陕西蓝田通报老人被群嘲事件#西安鑫龙门农林科技有限公司，蓝田县蓝关街道三十米路宏辉秀水花园第三幢一单元三层东户孙答向。笑的最开心的那个就是孙答向。,86,4
4808464239692005,等我胖起来,2022-08-31 08:37:47,陕西,需要莫言来亲自辟谣吗,113,1
4808489694661562,可乐只吃水果不吃饭,2022-08-31 08:37:47,四川,权力需要监管，这才是重点,3,0
4808475043432194,逆转花猫,2022-08-31 08:37:47,北京,转发微博,788,0
4808469402882656,T守护N我的T时代,2022-08-31 08:37:47,江西,真的挺可悲的，不知道类似的现象还有多少都藏在阴暗的角落不为人知，底层人民只能忍气吞声，求助无门,0,0
4808449731332935,快乐风雨雪,2022-08-31 08:37:47,湖北,转发微博,437,0
4808453551559399,小河Thisisariver,2022-08-31 08:37:47,北京,越来越觉得莫言经典了,246,4
4808508581610478,百八九百,2022-08-31 08:37:47,山西,大哥莫笑二哥，商人也是群众，是和你一样伟大的人民呢//@势必取尔狗命:你真是个睿智//@百八九百:小微企业主又成有权势的人了，你们真要笑死我，世界上最有权势的是那个男人拜登,9,0
4808481497943168,鼎格的空间,2022-08-31 08:37:47,江苏,借莫言之口说出来，莫言恐怕又要发布认领启事了,58,0
4808464271938091,等我胖起来,2022-08-31 08:37:47,陕西,回复@小河Thisisariver:需要莫言来亲自辟谣吗,113,0
4808458459939895,我说风景好,2022-08-31 08:37:47,江苏,十大金句1、为人民服务2、医者仁心3、法律面前人人平等4、房住不炒5、共同富裕6、正义永远不会缺席7、人民“公仆”为人民8、诚信第一，以人为本9、法网恢恢疏而不漏10、十年树木，百年树人,4266,7
4808444596980954,说教师,2022-08-31 08:33:06,安徽,Ｃ,24.8万,0
4808449152258143,沐清浅2019,2022-08-31 08:29:46,甘肃,和歧视没关系，是为了最大程度覆盖所有家庭,232,1
4808459575624810,心无尘埃的守候,2022-08-31 08:29:46,甘肃,找一堆理由其实很简单，让你少蹭一次核酸检测,50,1
4808459079651087,MercuryLeaves,2022-08-31 08:29:46,甘肃,实施男女分开采的原因一是因为奥密克戎变异毒株传播速度快，其中平均2~3天就可能会形成一代传播，所以将不同人群分别安排在一周内不同的时间分别进行检测，更有利于从时间分布上排查风险到早发现。,91,0
