标题名,影片名,格式,音频,属性,年份,时长,IMDB值,简介,影片海报,影片下载web_url,影片下载url之一
The Flight Attendant A Comissária de Bordo 2ª Temporada Torrent Dual Áudio / Dublado WEB-DL 720p & 1080p – Download,A Comissária de Bordo,MKV,"Português, Inglês","Comédia,Drama,Mistério,Suspense",2022,46 Min./ Ep.,7.1/10,":Cassandra Bowen é uma comissária de bordo que acorda de ressaca em um hotel em Dubai ao lado de um cadáver. Ao invés de ligar para a polícia, ela foge e parte com seus colegas em um voo para Nova York. Mas a situação se complica quando ela é abordada por agentes do FBI, que têm algumas perguntas para ela em pleno voo. ",https://filmestorrents.site/wp-content/uploads/2022/04/A-Comissaria-de-Bordo-filmestorrents-net.jpg,https://filmestorrents.site/a-comissaria-de-bordo-2a-temporada-torrent-dual-audio-dublado-web-dl-720p-1080p-download/#more-33013,magnet:?xt=urn:btih:d6bf3f23ad3b9b0ce7408aca1e3b8c4af31c538b&dn=The.Flight.Attendant.S02E01-02.720p.WEB-DL.DUAL&tr=udp%3a%2f%2ftracker.openbittorrent.com%3a80%2fannounce&tr=udp%3a%2f%2ftracker.publicbt.com%3a80%2fannounce&tr=udp%3a%2f%2ftracker.internetwarriors.net%3a1337%2fannounce&tr=udp%3a%2f%2ftracker.opentrackr.org%3a1337%2fannounce&tr=udp%3a%2f%2fexodus.desync.com%3a6969%2fannounce&tr=udp%3a%2f%2fopen.stealth.si%3a80%2fannounce&tr=udp%3a%2f%2fwww.torrent.eu.org%3a451%2fannounce
Passado Violento Torrent (2022) Dual Áudio / Dublado BluRay 1080p – Download,Passado Violento,MKV,"Português, Inglês","Drama,Crime,Suspense",2022,1h 33 Min.,5.6/10,":Um coletor de lixo que tenta ativamente reparar seu passado sombrio e trágico. Mas quando suas boas intenções o marcam como alvo do chefe do crime local, ele é forçado a se reconciliar com a violência de seu passado. ",https://filmestorrents.site/wp-content/uploads/2022/05/Passado-Violento-filmestorrents-net.jpg,https://filmestorrents.site/passado-violento-torrent-2022-dual-audio-dublado-bluray-1080p-download/#more-33636,magnet:?xt=urn:btih:ce1bfc925d2aa682c011076e20a61c14177520c8&dn=Passado%20Violento%202022%201080p%20BluRay%20DUAL&tr=udp%3a%2f%2ftracker.openbittorrent.com%3a80%2fannounce&tr=udp%3a%2f%2ftracker.publicbt.com%3a80%2fannounce&tr=udp%3a%2f%2ftracker.internetwarriors.net%3a1337%2fannounce&tr=udp%3a%2f%2ftracker.opentrackr.org%3a1337%2fannounce&tr=udp%3a%2f%2fexodus.desync.com%3a6969%2fannounce&tr=udp%3a%2f%2fopen.stealth.si%3a80%2fannounce&tr=udp%3a%2f%2fwww.torrent.eu.org%3a451%2fannounce
Fortaleza: O Olhar Do Sniper Torrent (2022) Dual Áudio / Dublado WEB-DL 1080p – Download,Fortaleza O Olhar Do Sniper,MKV,"Português, Inglês","Ação,Crime",2022,1h 37 Min.,2.6/10,":Semanas após o ataque mortífero ao Fortress Camp, Robert faz um resgate ousado para salvar Sasha, a viúva de seu antigo inimigo Balzary. ",https://filmestorrents.site/wp-content/uploads/2022/05/Fortaleza-O-Olhar-Do-Sniper-filmestorrents-net.jpg,https://filmestorrents.site/fortaleza-o-olhar-do-sniper-torrent-2022-dual-audio-dublado-web-dl-1080p-download/#more-33633,magnet:?xt=urn:btih:b7eaeedf15389105dacf4d4e9160f6f7a0977f12&dn=Fortaleza%20-%20O%20Olhar%20Do%20Sniper%202022%201080p%20WEB-DL%20DUAL%205.1&tr=udp%3a%2f%2ftracker.openbittorrent.com%3a80%2fannounce&tr=udp%3a%2f%2ftracker.publicbt.com%3a80%2fannounce&tr=udp%3a%2f%2ftracker.internetwarriors.net%3a1337%2fannounce&tr=udp%3a%2f%2ftracker.opentrackr.org%3a1337%2fannounce&tr=udp%3a%2f%2fexodus.desync.com%3a6969%2fannounce&tr=udp%3a%2f%2fopen.stealth.si%3a80%2fannounce&tr=udp%3a%2f%2fwww.torrent.eu.org%3a451%2fannounce
"Adeus, idiotas Torrent (2022) Dublado BluRay 1080p – Download",Adeus idiotas,MKV,"Português, Francês","Drama,Comédia",2022,1h 27 Min.,6.7/10,":Quando a cabeleireira Suze Trappet, de 43 anos, descobre que está gravemente doente, ela decide procurar uma criança que foi forçada a abandonar quando tinha apenas 15 anos. Em sua louca jornada burocrática, ela se cruza com JB, de 50 anos – um velho no meio de um esgotamento, e o Sr. Blin, um arquivista cego com tendência a exagerar no entusiasmo. O improvável trio partiu em uma jornada hilariante e pungente pela cidade em busca do filho há muito perdido de Suze. ",https://filmestorrents.site/wp-content/uploads/2022/05/Adeus-idiotas-filmestorrents-net.jpg,https://filmestorrents.site/adeus-idiotas-torrent-2022-dublado-bluray-1080p-download/#more-33630,magnet:?xt=urn:btih:ae9794396b80961da7a9dc5ac1f69bf6a9a2d765&dn=Adeus%2c%20Idiotas%202020%201080p%20BluRay%20DUAL%205.1&tr=udp%3a%2f%2ftracker.openbittorrent.com%3a80%2fannounce&tr=udp%3a%2f%2ftracker.publicbt.com%3a80%2fannounce&tr=udp%3a%2f%2ftracker.internetwarriors.net%3a1337%2fannounce&tr=udp%3a%2f%2ftracker.opentrackr.org%3a1337%2fannounce&tr=udp%3a%2f%2fexodus.desync.com%3a6969%2fannounce&tr=udp%3a%2f%2fopen.stealth.si%3a80%2fannounce&tr=udp%3a%2f%2fwww.torrent.eu.org%3a451%2fannounce
Vai Dar Nada Torrent (2022) Dublado WEB-DL 1080p – Download,Vai Dar Nada,MP4,Português,"Ação,Comédia",2022,1h 31 Min.,N/A/10,":O filme conta a história de Kelson, um ladrão jovem de carros e motos, que usa a sua motocicleta para escapar da polícia e para conquistar seu o amor de sua vida. ",https://filmestorrents.site/wp-content/uploads/2022/05/Vai-Dar-Nada-filmestorrents-net.jpg,https://filmestorrents.site/vai-dar-nada-torrent-2022-dublado-web-dl-1080p-download/#more-33627,magnet:?xt=urn:btih:b85ac188680336225c6e12fd1339d135a701e50c&dn=Vai%20Dar%20Nada%202022%201080p%20WEB-DL%20NACIONAL&tr=udp%3a%2f%2ftracker.openbittorrent.com%3a80%2fannounce&tr=udp%3a%2f%2ftracker.publicbt.com%3a80%2fannounce&tr=udp%3a%2f%2ftracker.internetwarriors.net%3a1337%2fannounce&tr=udp%3a%2f%2ftracker.opentrackr.org%3a1337%2fannounce&tr=udp%3a%2f%2fexodus.desync.com%3a6969%2fannounce&tr=udp%3a%2f%2fopen.stealth.si%3a80%2fannounce&tr=udp%3a%2f%2fwww.torrent.eu.org%3a451%2fannounce
Bel-Air 1ª Temporada Torrent Dual Áudio / Dublado WEB-DL 1080p – Download,Bel-Air,MKV,"Português, Inglês",Drama,2022,51 Min./ Ep.,6.0/10,":Situado na América moderna, a série oferece uma nova e dramática visão da jornada de mudança de vida de Will, das ruas do oeste da Filadélfia às mansões fechadas de Bel-Air. Deixando para trás a única casa que ele já conheceu por uma segunda chance em um lugar desconhecido, Will vê sua vida virar de cabeça para baixo ao encontrar novos desafios e preconceitos em um mundo de riqueza e aspiração. ",https://filmestorrents.site/wp-content/uploads/2022/05/Bel-Air-filmestorrents-net.jpg,https://filmestorrents.site/bel-air-1a-temporada-torrent-dual-audio-dublado-web-dl-1080p-download/#more-33624,magnet:?xt=urn:btih:ZRIN6YJJ45KZKICPLUQADZFZ6BUUSVHW&dn=Bel-Air.S01.1080p.WEB-DL.H.264.DUAL&tr=udp%3A%2F%2Ftracker.openbittorrent.com%3A80%2Fannounce
Naomi 1ª Temporada Torrent Dual Áudio / Dublado WEB-DL 720p & 1080p – Download,Naomi 1ª Temporada Torrent,MKV,"Português, Inglês","Ação,Aventura,Drama",2022,42 Min.,5.6/10,":Em Naomi, conhecemos Naomi McDuffie (Kaci Walfall), uma adolescente divertida, confiante e apaixonada por histórias em quadrinhos. Naomi irá embarcar em uma jornada de autoconhecimento depois que um evento sobrenatural abala a pequena cidade onde vive, Port Oswego. Após o ocorrido, sua vida vira de cabeça para baixo. ",https://filmestorrents.site/wp-content/uploads/2022/03/Naomi-filmestorrents-net.jpg,https://filmestorrents.site/naomi-1a-temporada-torrent-dual-audio-dublado-web-dl-720p-1080p-download/#more-32122,magnet:?xt=urn:btih:a2b36958ae4a47dee742a982bd5a1f911a6046b5&dn=Naomi.S01.720p.AMZN.WEBRip.DDP5.1.x264-NTb%5Brartv%5D&tr=http%3A%2F%2Ftracker.trackerfix.com%3A80%2Fannounce&tr=udp%3A%2F%2F9.rarbg.me%3A2890&tr=udp%3A%2F%2F9.rarbg.to%3A2800&tr=udp%3A%2F%2Ftracker.tallpenguin.org%3A15760&tr=udp%3A%2F%2Ftracker.thinelephant.org%3A12720
New Amsterdam 4ª Temporada Torrent (2021) Dual Áudio / Legendado WEB-DL 720p | 1080p – Download,Hospital New Amsterdam,MKV,"Português, Inglês",Drama,2022,42 Min./ Ep.,8.1/10,":Novo na direção do hospital mais antigo dos EUA, Max promete mudar o burocrático sistema. Enquanto aposta no lado humano da medicina, ele lida com seu diagnóstico e sua família. ",https://filmestorrents.site/wp-content/uploads/2021/09/New-Amsterdam-4a-Temporada-Torrent-200x300.jpg,https://filmestorrents.site/new-amsterdam-4a-temporada-torrent-2021-dual-audio-legendado-web-dl-720p-1080p-download/#more-28824,magnet:?xt=urn:btih:1e718e0d1abf32fc2bbc719d294f81a038a0ed8a&dn=New.Amsterdam.2018.S04.720p.AMZN.WEBRip.DDP5.1.x264-NTb%5Brartv%5D&tr=http%3A%2F%2Ftracker.trackerfix.com%3A80%2Fannounce&tr=udp%3A%2F%2F9.rarbg.me%3A2870&tr=udp%3A%2F%2F9.rarbg.to%3A2860&tr=udp%3A%2F%2Ftracker.fatkhoala.org%3A13790&tr=udp%3A%2F%2Ftracker.tallpenguin.org%3A15720
Super Pumped: A Guerra Pela Uber 1ª Temporada Torrent Dual Áudio / Dublado WEB-DL 1080p – Download,Super Pumped A Guerra Pela Uber,MKV,"Português, Inglês","Biografia,Drama",2022,56 Min./ Ep.,7.2/10,:A série te leva a incansável batalha entre os super poderosos pelo aplicativo Uber. ,https://filmestorrents.site/wp-content/uploads/2022/05/Super-Pumped-A-Guerra-Pela-Uber-filmestorrents-net.jpg,https://filmestorrents.site/super-pumped-a-guerra-pela-uber-1a-temporada-torrent-dual-audio-dublado-web-dl-1080p-download/#more-33614,magnet:?xt=urn:btih:Q44OUBU4R23OUXFXAPSC6G3AM3NKIWO7&dn=Super.Pumped_A.Guerra.Pela.Uber.S01.1080p.NF.WEB-DL.DDP5.1.www.animestotais.xyz&tr=udp%3A%2F%2Ftracker.openbittorrent.com%3A80%2Fannounce
A Chorona Torrent (2022) Dublado WEB-DL 1080p – Download,A Chorona,MKV,"Português, Espanhol","Terror,Drama,Suspense",2022,1h 37 Min.,3.1/10,":O general aposentado, Enrique, finalmente enfrenta julgamento pelo massacre genocida de milhares de maias décadas atrás. Enquanto uma horda de manifestantes raivosos ameaça invadir seu lar opulento, as mulheres da casa – sua esposa arrogante, filha em conflito e neta precoce – refletem sobre sua responsabilidade de proteger Enrique, errático e senil, contra as verdades devastadoras que são reveladas publicamente enquanto começam a sentir uma força sobrenatural em busca de vingança por seus crimes. Enquanto isso, grande parte dos empregados da família foge, deixando apenas a governanta leal Valeriana até que uma misteriosa jovem indígena chega… ",https://filmestorrents.site/wp-content/uploads/2022/05/A-Chorona-filmestorrents-net.jpg,https://filmestorrents.site/a-chorona-torrent-2022-dublado-web-dl-1080p-download/#more-33611,magnet:?xt=urn:btih:5b82a0682d369f6f4ce53d0cbdb509cb6fa2975b&dn=A%20Chorona%202020%201080p%20WEB-DL%20DUAL%205.1&tr=udp%3a%2f%2ftracker.openbittorrent.com%3a80%2fannounce&tr=udp%3a%2f%2ftracker.publicbt.com%3a80%2fannounce&tr=udp%3a%2f%2ftracker.internetwarriors.net%3a1337%2fannounce&tr=udp%3a%2f%2ftracker.opentrackr.org%3a1337%2fannounce&tr=udp%3a%2f%2fexodus.desync.com%3a6969%2fannounce&tr=udp%3a%2f%2fopen.stealth.si%3a80%2fannounce&tr=udp%3a%2f%2fwww.torrent.eu.org%3a451%2fannounce
The Neighborhood 4ª Temporada Torrent (2021) Dual Áudio / Legendado WEB-DL 720p | 1080p – Download,The Neighborhood 4ª Temporada Torrent,MKV,Inglês,Comédia,2022,25 Min.,6.4/10,":Dave Johnson se muda com a família de Michigan para Los Angeles e percebe que o segredo para se adaptar ao novo bairro é fazer amizade com Calvin Butler, o seu teimoso vizinho. ",https://filmestorrents.site/wp-content/uploads/2021/10/The-Neighborhood-4a-Temporada-Torrent-200x300.jpg,https://filmestorrents.site/the-neighborhood-4a-temporada-torrent-2021-dual-audio-legendado-web-dl-720p-1080p-download/#more-29294,magnet:?xt=urn:btih:16bb4e36a56e971debfe30a00a44dd0c43195d5e&dn=The.Neighborhood.S04E01.720p.WEB.H264-PLZPROPER%5Brartv%5D&tr=http%3A%2F%2Ftracker.trackerfix.com%3A80%2Fannounce&tr=udp%3A%2F%2F9.rarbg.me%3A2730&tr=udp%3A%2F%2F9.rarbg.to%3A2760&tr=udp%3A%2F%2Ftracker.fatkhoala.org%3A13720&tr=udp%3A%2F%2Ftracker.tallpenguin.org%3A15720
NCIS: Investigação Naval 19ª Temporada Torrent (2021) Legendado WEB-DL 720p | 1080p – Download,NCIS Investigaçao Naval,MKV,Inglês,"Ação,Crime,Drama",2022,42 Min.,7.7/10,":Sob o exemplar comando de Leroy Jethro Gibbs, uma equipe de agentes especiais investiga crimes relacionados com a Marinha dos Estados Unidos. ",https://filmestorrents.site/wp-content/uploads/2021/09/NCIS-Investigacao-Naval-19a-Temporada-Torrent-200x300.jpg,https://filmestorrents.site/ncis-investigacao-naval-19a-temporada-torrent-2021-legendado-web-dl-720p-1080p-download/#more-28591,magnet:?xt=urn:btih:f4f7501013b2063ec2f7119ac6aefce23a30f912&dn=NCIS.S19E01.720p.WEB.H264-PLZPROPER%5Brartv%5D&tr=http%3A%2F%2Ftracker.trackerfix.com%3A80%2Fannounce&tr=udp%3A%2F%2F9.rarbg.me%3A2850&tr=udp%3A%2F%2F9.rarbg.to%3A2750&tr=udp%3A%2F%2Ftracker.fatkhoala.org%3A13770&tr=udp%3A%2F%2Ftracker.slowcheetah.org%3A14720
Wayne 1ª Temporada Torrent Dual Áudio / Dublado WEB-DL 1080p – Download,Wayne 1ª Temporada,MKV,"Português, Inglês","Ação,Comédia",2022,36 Min. /Ep.,8.4/10,":Esta é a história de Wayne, um garoto de 16 anos que viaja em uma moto velha para Ocala, na Flórida, com sua nova paixão, Del, para recuperar o Pontiac 1979, roubado de seu pai antes de ele morrer. ",https://filmestorrents.site/wp-content/uploads/2022/05/Wayne-filmestorrents-net.jpg,https://filmestorrents.site/wayne-1a-temporada-torrent-dual-audio-dublado-web-dl-1080p-download/#more-33604,magnet:?xt=urn:btih:1E91EB75E52C6FB95FA8E0433AD9AE16B2C1FA7F&dn=Wayne.S01.1080p.AMZN.WEB-DL.DDP2.0.H.264-DUAL&tr=udp%3a%2f%2ftracker.openbittorrent.com%3a80%2fannounce&tr=udp%3a%2f%2ftracker.opentrackr.org%3a1337%2fannounce
Top Gun: Maverick Torrent (2022) Dual Áudio / Dublado HDCAM 720p – Download,Top Gun Maverick,MKV,Português / Inglês,Ação|Drama,2022,2h 11 Min.,N/A/10,"Depois de mais de 30 anos de serviço como um dos principais aviadores da Marinha, Pete “Maverick” Mitchell está de volta, rompendo os limites como um piloto de testes corajoso. No mundo contemporâneo das guerras tecnológicas, Maverick enfrenta drones e prova que o fator humano ainda é essencial.",https://filmestorrents.site/wp-content/uploads/2022/05/Top-Gun-Maverick-filmestorrents-net.jpg,https://filmestorrents.site/top-gun-maverick-torrent-2022-dual-audio-dublado-hdcam-720p-download/#more-33599,magnet:?xt=urn:btih:6E78FE486402E54F24309C0167A3C7F285AFEC74&dn=Top.Gun.Maverick.2022.720p.CAMRip.Dublado.mkv&tr=udp%3a%2f%2ftracker.openbittorrent.com%3a80%2fannounce&tr=udp%3a%2f%2ftracker.opentrackr.org%3a1337%2fannounce&tr=http%3a%2f%2ftrax.corbina.net%3a6969%2fannounce
Duro na Queda Torrent (2022) Dublado WEB-DL 1080p – Download,Duro na Queda,MKV,"Português, Tailandês","Ação,Drama,Suspense",2022,1h 34 Min.,7.1/10,":após ficar seis anos preso injustamente num centro psiquiátrico, Manop está pronto para fazer justiça com as próprias mãos e buscar vingança contra uma gangue de criminosos, responsável pela morte de sua família. ",https://filmestorrents.site/wp-content/uploads/2022/05/Duro-na-Queda-filmestorrents-net.jpg,https://filmestorrents.site/duro-na-queda-torrent-2022-dublado-web-dl-1080p-download/#more-33596,magnet:?xt=urn:btih:d1925b227d07c2445ee9ef47fa2218bf4b8a8e85&dn=Duro%20na%20Queda%202020%201080p%20WEB-DL%20DUAL&tr=udp%3a%2f%2ftracker.openbittorrent.com%3a80%2fannounce&tr=udp%3a%2f%2ftracker.publicbt.com%3a80%2fannounce&tr=udp%3a%2f%2ftracker.internetwarriors.net%3a1337%2fannounce&tr=udp%3a%2f%2ftracker.opentrackr.org%3a1337%2fannounce&tr=udp%3a%2f%2fexodus.desync.com%3a6969%2fannounce&tr=udp%3a%2f%2fopen.stealth.si%3a80%2fannounce&tr=udp%3a%2f%2fwww.torrent.eu.org%3a451%2fannounce
Comboio 48: A Última Resistência Torrent (2022) Dublado BluRay 1080p – Download,Comboio 48 A Ultima Resistencia,MKV,"Português, Russo","Drama,Guerra",2022,2h 20 Min.,5.7/10,":Durante a defesa de Leningrado, muitas mulheres recebem a missão de entregar equipamento militar por meio das linhas ferroviárias, correndo o risco de serem pegas pelos Nazistas. ",https://filmestorrents.site/wp-content/uploads/2022/05/Comboio-48-A-Ultima-Resistencia-filmestorrents-net.jpg,https://filmestorrents.site/comboio-48-a-ultima-resistencia-torrent-2022-dublado-bluray-1080p-download/#more-33593,magnet:?xt=urn:btih:3a3f4cfd586d9d4c755ea96c81792eae784e0457&dn=Comboio%2048%20A%20%c3%9altima%20Resist%c3%aancia%202019%201080p%20BluRay%20DUAL&tr=udp%3a%2f%2ftracker.openbittorrent.com%3a80%2fannounce&tr=udp%3a%2f%2ftracker.publicbt.com%3a80%2fannounce&tr=udp%3a%2f%2ftracker.internetwarriors.net%3a1337%2fannounce&tr=udp%3a%2f%2ftracker.opentrackr.org%3a1337%2fannounce&tr=udp%3a%2f%2fexodus.desync.com%3a6969%2fannounce&tr=udp%3a%2f%2fopen.stealth.si%3a80%2fannounce&tr=udp%3a%2f%2fwww.torrent.eu.org%3a451%2fannounce
O Marinheiro das Montanhas Torrent (2022) Dublado WEB-DL 1080p – Download,O Marinheiro das Montanhas,MKV,Português,"Documentário,Romance",2022,: 1h 35 Min.,N/A/10,":Ainouz se baseou na história de seus pais, Iracema, uma brasileira, e Majid, um argelino, que se conheceram nos Estados Unidos. Eles se separaram em 1965, quando ele retornou à Argélia e ela, ao Brasil, grávida. Karim só conheceu o pai aos 20 anos. O filme é um inventário afetivo dessa relação. “O Marinheiro das Montanhas” integra a seleção Sessões Especiais da 74ª edição do Festival de Cannes. ",https://filmestorrents.site/wp-content/uploads/2022/05/O-Marinheiro-das-Montanhas-filmestorrents-net.jpg,https://filmestorrents.site/o-marinheiro-das-montanhas-torrent-2022-dublado-web-dl-1080p-download/#more-33590,magnet:?xt=urn:btih:c8bcaac7dabaf90921d9390e7b1e4ea8d8095035&dn=Mariner.of.the.Mountains.2021.PORTUGUESE.1080p.AMZN.WEBRip.DDP2.0.x264-SMURF&tr=http%3A%2F%2Ftracker.trackerfix.com%3A80%2Fannounce&tr=udp%3A%2F%2F9.rarbg.me%3A2800&tr=udp%3A%2F%2F9.rarbg.to%3A2720&tr=udp%3A%2F%2Ftracker.fatkhoala.org%3A13720&tr=udp%3A%2F%2Ftracker.tallpenguin.org%3A15750
Boa Viagem Torrent (2022) Dublado WEB-DL 1080p – Download,Boa Viagem,MKV,"Português, Turco",Drama,2022,1h 59 Min.,N/A/10,:Um ex-capitão do exército viaja a Daylan para impedir um casamento. Mas o luto e o trauma de uma tragédia de guerra podem atrapalhar essa missão. ,https://filmestorrents.site/wp-content/uploads/2022/05/Boa-Viagem-filmestorrents-net.jpg,https://filmestorrents.site/boa-viagem-torrent-2022-dublado-web-dl-1080p-download/#more-33587,magnet:?xt=urn:btih:7335b6e5998142ecfb4824bfc9474cd83d686835&dn=Boa%20Viagem%202022%201080p%20WEB-DL%20DUAL%205.1&tr=udp%3a%2f%2ftracker.openbittorrent.com%3a80%2fannounce&tr=udp%3a%2f%2ftracker.publicbt.com%3a80%2fannounce&tr=udp%3a%2f%2ftracker.internetwarriors.net%3a1337%2fannounce&tr=udp%3a%2f%2ftracker.opentrackr.org%3a1337%2fannounce&tr=udp%3a%2f%2fexodus.desync.com%3a6969%2fannounce&tr=udp%3a%2f%2fopen.stealth.si%3a80%2fannounce&tr=udp%3a%2f%2fwww.torrent.eu.org%3a451%2fannounce
The Simpsons 33ª Temporada Torrent (2021) Dual Áudio / Legendado WEB-DL 720p | 1080p – Download,Os Simpsons,MKV,"Português, Inglês","Animação,Comédia",2022,20 Min.,8.7/10,":Os Simpsons moram na cidade de  Springfield, uma cidade americana como qualquer outra. Homer trabalha como inspetor de segurança em uma usina de  energia nuclear, Marge tenta manter a paz em sua família, Bart é um  travesso garoto de 10 anos, Lisa, de 8 anos, é a inteligente da família que  adora tocar saxofone e é vegetariana e a pequena Maggie conquista todos  enquanto não larga sua chupeta. E a série tem um rico, e muitas vezes  estranho, universo de personagens que também habitam Springfield. Com roteiros inteligentes, humor subversivo e divertidamente  genial, a série faz piadas de si mesma e de todo mundo que aparecer em  seu caminho. ",https://filmestorrents.site/wp-content/uploads/2021/09/The-Simpsons-33a-Temporada-Torrent-200x300.jpg,https://filmestorrents.site/the-simpsons-33a-temporada-torrent-2021-dual-audio-legendado-web-dl-720p-1080p-download/#more-28877,magnet:?xt=urn:btih:57b0b10e17b196b1f5a0d26062c3e1251c005608&dn=The.Simpsons.S33E01.720p.WEB.H264-CAKES%5Brartv%5D&tr=http%3A%2F%2Ftracker.trackerfix.com%3A80%2Fannounce&tr=udp%3A%2F%2F9.rarbg.me%3A2980&tr=udp%3A%2F%2F9.rarbg.to%3A2880&tr=udp%3A%2F%2Ftracker.fatkhoala.org%3A13760&tr=udp%3A%2F%2Ftracker.slowcheetah.org%3A14710
Family Guy (Uma Família da Pesada) 20ª Temporada Torrent (2021) Dual Áudio / Legendado WEB-DL 720p | 1080p – Download,Uma Familia da Pesada,MKV,Inglês,"Animação,Comédia",2022,20 Min.,8.2/10,":A série animada apresenta as aventuras da família Griffin. O ignorante Peter e sua esposa Lois residem em Quahog, em Rhode Island e têm três filhos. Meg, a filha mais velha, é uma pária social, e o adolescente Chris é estranho e sem noção quando se trata do sexo oposto. O mais novo, Stewie, é um bebê gênio decidido a matar sua mãe e destruir o mundo. O cachorro falante, Brian, mantém Stewie sob controle enquanto toma martinis e resolve seus próprios problemas de vida. ",https://filmestorrents.site/wp-content/uploads/2021/09/Family-Guy-Uma-Familia-da-Pesada-21a-Temporada-Torrent-200x300.jpg,https://filmestorrents.site/family-guy-uma-familia-da-pesada-21a-temporada-torrent-2021-dual-audio-legendado-web-dl-720p-1080p-download/#more-28884,magnet:?xt=urn:btih:8aeba8b6a9f2e528bdbce6fa0afe70d399a529a7&dn=Family.Guy.S20E01.720p.WEB.H264-CAKES%5Brartv%5D&tr=http%3A%2F%2Ftracker.trackerfix.com%3A80%2Fannounce&tr=udp%3A%2F%2F9.rarbg.me%3A2720&tr=udp%3A%2F%2F9.rarbg.to%3A2840&tr=udp%3A%2F%2Ftracker.thinelephant.org%3A12710&tr=udp%3A%2F%2Ftracker.slowcheetah.org%3A14730
Anos-luz 1ª Temporada Torrent Dual Áudio / Dublado WEB-DL 720p & 1080p – Download,Anos-luz,MKV,"Português, Inglês","Drama,Fantasia",2022,42 Min./ Ep.,7.2/10,":Irene e Franklin York, um casal de aposentados, têm um segredo: uma câmara enterrada no seu quintal milagrosamente leva a um planeta estranho e deserto. Quando um jovem enigmático aparece, a vidinha pacífica dos York sofre uma reviravolta, e a misteriosa câmara, que eles achavam que conheciam tão bem, prova ser muito mais do que jamais haviam imaginado. ",https://filmestorrents.site/wp-content/uploads/2022/05/Anos-luz-filmestorrents-net.jpg,https://filmestorrents.site/anos-luz-1a-temporada-torrent-dual-audio-dublado-web-dl-720p-1080p-download/#more-33582,magnet:?xt=urn:btih:BAANFDLGPEHPRFZRCH4R34XKBMKUL6YU&dn=Night.Sky.S01.1080p.AMZN.WEB-DL.DDP5.1.H.264&tr=udp%3A%2F%2Ftracker.openbittorrent.com%3A80%2Fannounce
O Chefinho: De Volta ao Berço 1ª Temporada Torrent Dual Áudio / Dublado WEB-DL 720p & 1080p – Download,O Chefinho De Volta ao Berço,MKV,"Português, Inglês","Animação,Comédia",2022,24 Min./ Ep.,7.8/10,":A versão adulta de Ted Templeton está numa enrascada. Para não ser preso, ele volta a ser o Chefinho, fingindo ser um dos filhos do seu irmão, Tim. ",https://filmestorrents.site/wp-content/uploads/2022/05/O-Chefinho-De-Volta-ao-Berco-filmestorrents-net.jpg,https://filmestorrents.site/o-chefinho-de-volta-ao-berco-1a-temporada-torrent-dual-audio-dublado-web-dl-720p-1080p-download/#more-33579,magnet:?xt=urn:btih:2XVSEI7XXNGK3SCT2HULH7ETWFFUSOFO&dn=O.Chefinho.de.Volta.ao.Berco.S01.1080p.NF.WEB-DL.DDP5.1.x264.DUAL-www.animestotais.xyz&tr=udp%3A%2F%2Ftracker.openbittorrent.com%3A80%2Fannounce
NCIS: Los Angeles 13ª Temporada Torrent (2021) Legendado WEB-DL 720p | 1080p – Download,NCIS Los Angeles,MKV,Inglês,"Ação,Crime,Drama",2022,42 Min.,6.7/10,":Uma equipe de agentes do Departamento de Projetos Especiais, uma divisão do NCIS em Los Angeles, trabalha para prender criminosos que são considerados uma ameaça à segurança nacional. ",https://filmestorrents.site/wp-content/uploads/2021/10/NCIS-Los-Angeles-13a-Temporada-Torrent-203x300.jpg,https://filmestorrents.site/ncis-los-angeles-13a-temporada-torrent-2021-legendado-web-dl-720p-1080p-download/#more-29430,magnet:?xt=urn:btih:cf185e8ebd426f21d792f4401cf2d502a7b7c5bb&dn=NCIS.Los.Angeles.S13E01.720p.WEB.H264-GGEZ%5Brartv%5D&tr=http%3A%2F%2Ftracker.trackerfix.com%3A80%2Fannounce&tr=udp%3A%2F%2F9.rarbg.me%3A2860&tr=udp%3A%2F%2F9.rarbg.to%3A2740&tr=udp%3A%2F%2Ftracker.fatkhoala.org%3A13730&tr=udp%3A%2F%2Ftracker.tallpenguin.org%3A15740
S.W.A.T. 5ª Temporada Torrent (2021) Dual Áudio / Legendado WEB-DL 720p | 1080p – Download,S.W.A.T.: Força de Intervenção,MKV,"Português, Inglês","Ação,Aventura,Crime",2022,45 Min./ Ep.,7.0/10,":Dividido entre a corporação e as ruas, o tenente Daniel Harrelson encara a missão de liderar uma unidade do Esquadrão de Armas e Táticas Especiais na comunidade onde cresceu. ",https://filmestorrents.site/wp-content/uploads/2021/10/S.W.A.T.-5a-Temporada-Torrent-200x300.jpg,https://filmestorrents.site/s-w-a-t-5a-temporada-torrent-2021-dual-audio-legendado-web-dl-720p-1080p-download/#more-29201,magnet:?xt=urn:btih:eed64839644619fde50c67c92302474e137cc0b0&dn=S.W.A.T.2017.S05E01.720p.WEB.H264-GGEZ%5Brartv%5D&tr=http%3A%2F%2Ftracker.trackerfix.com%3A80%2Fannounce&tr=udp%3A%2F%2F9.rarbg.me%3A2900&tr=udp%3A%2F%2F9.rarbg.to%3A2980&tr=udp%3A%2F%2Ftracker.fatkhoala.org%3A13720&tr=udp%3A%2F%2Ftracker.thinelephant.org%3A12760
Entrevías 1ª Temporada Torrent Dublado WEB-DL 1080p – Download,Entrevias,MKV,"Português, Espanhol","Drama,Crime",2022,59 Min./ Ep.,6.3/10,":A neta de um veterano de guerra é vítima de traficantes de drogas no bairro onde ele mora. Indignado, o avô não mede esforços para que a justiça seja feita.",https://filmestorrents.site/wp-content/uploads/2022/05/Entrevias-filmestorrents-net.jpg,https://filmestorrents.site/entrevias-1a-temporada-torrent-dublado-web-dl-1080p-download/#more-33567,magnet:?xt=urn:btih:XKSRDFIPMPH3ASV7HZIN2GMIRVBOGYWQ&dn=Entrevias.S01.1080p.NF.WEB-DL.DDP5.1.x264.DUAL&tr=udp%3A%2F%2Ftracker.openbittorrent.com%3A80%2Fannounce
