标题名,影片名,格式,音频,属性,年份,时长,IMDB值,简介,影片海报,影片下载web_url,影片下载url之一
Fronteira Virtual Torrent (2022) Dual Áudio / Dublado WEB-DL – Download,Fronteira Virtual,MKV,"Português, Inglês",Suspense,2022,1h 30 Min.,3.5/10,":Após dezenas de pessoas serem mortas em ataques terroristas em série, dois gênios da tecnologia criam uma maneira de acessar as memórias do terrorista em um espaço virtual. ",https://filmestorrents.site/wp-content/uploads/2022/06/Fronteira-Virtual-filmestorrents-net.jpg,https://filmestorrents.site/fronteira-virtual-torrent-2022-dual-audio-dublado-web-dl-download/#more-34193,magnet:?xt=urn:btih:a06371149aff1637ab2daa94034e538b1d73e8f5&dn=Fronteira%20Virtual%202018%20720p%20WEB-DL%20DUAL&tr=udp%3a%2f%2ftracker.openbittorrent.com%3a80%2fannounce&tr=udp%3a%2f%2ftracker.publicbt.com%3a80%2fannounce&tr=udp%3a%2f%2ftracker.internetwarriors.net%3a1337%2fannounce&tr=udp%3a%2f%2ftracker.opentrackr.org%3a1337%2fannounce&tr=udp%3a%2f%2fexodus.desync.com%3a6969%2fannounce&tr=udp%3a%2f%2fopen.stealth.si%3a80%2fannounce&tr=udp%3a%2f%2fwww.torrent.eu.org%3a451%2fannounce
O Rei da Festa Torrent (2022) Dublado WEB-DL – Download,O Rei da Festa,MKV,"Português, Espanhol","Drama,Suspense",2022,1h 29 Min.,N/A/10,":Durante uma crise emocional, um homem escolhe viver a vida de seu irmão gêmeo que acreditava estar morto. Após essa experiência, sua identidade será completamente transformada. ",https://filmestorrents.site/wp-content/uploads/2022/06/O-Rei-da-Festa-filmestorrents-net.jpg,https://filmestorrents.site/o-rei-da-festa-torrent-2022-dublado-web-dl-download/#more-34183,magnet:?xt=urn:btih:b0a3fba00f082649cd87f187da41086212cfa7b6&dn=O%20Rei%20da%20Festa%202022%20720p%20WEB-DL%20DUAL&tr=udp%3a%2f%2ftracker.openbittorrent.com%3a80%2fannounce&tr=udp%3a%2f%2ftracker.publicbt.com%3a80%2fannounce&tr=udp%3a%2f%2ftracker.internetwarriors.net%3a1337%2fannounce&tr=udp%3a%2f%2ftracker.opentrackr.org%3a1337%2fannounce&tr=udp%3a%2f%2fexodus.desync.com%3a6969%2fannounce&tr=udp%3a%2f%2fopen.stealth.si%3a80%2fannounce&tr=udp%3a%2f%2fwww.torrent.eu.org%3a451%2fannounce
7th & Union Torrent (2022) Dual Áudio / Dublado WEB-DL 1080p – Download,7th E Union,MKV,"Português, Inglês",Drama,2022,1h 39 Min.,N/A/10,":Raymundo, um ex-boxeador mexicano, forma um vínculo improvável com um ex-campeão fracassado cuja vida e relacionamento com sua filha estão desmoronando. Os dois homens unem forças para vencer uma luta que pode muito bem salvá-los e dar a sua família a chance de uma vida melhor. ",https://filmestorrents.site/wp-content/uploads/2022/06/7th-E-Union-filmestorrents-net.jpg,https://filmestorrents.site/7th-union-torrent-2022-dual-audio-dublado-web-dl-1080p-download/#more-34180,magnet:?xt=urn:btih:449967e25df2623737fb16dadbb40aef731fb67b&dn=7th%20and%20Union%202021%201080p%20x265%20WEB-DL%20DUAL%205.1&tr=udp%3a%2f%2ftracker.openbittorrent.com%3a80%2fannounce&tr=udp%3a%2f%2ftracker.publicbt.com%3a80%2fannounce&tr=udp%3a%2f%2ftracker.internetwarriors.net%3a1337%2fannounce&tr=udp%3a%2f%2ftracker.opentrackr.org%3a1337%2fannounce&tr=udp%3a%2f%2fexodus.desync.com%3a6969%2fannounce&tr=udp%3a%2f%2fopen.stealth.si%3a80%2fannounce&tr=udp%3a%2f%2fwww.torrent.eu.org%3a451%2fannounce
Glamour Girls Torrent (2022) Dual Áudio / Dublado WEB-DL 1080p – Download,Glamour Girls,MKV,"Português, Inglês",Drama,2022,2h 00 Min.,6.3/10,:O  mundo das acompanhantes de luxo atrai um grupo de mulheres com a promessa de muito glamour e dinheiro. Até que um assassinato ameaça colocar tudo a perder. ,https://filmestorrents.site/wp-content/uploads/2022/06/Glamour-Girls-filmestorrents-net.jpg,https://filmestorrents.site/glamour-girls-torrent-2022-dual-audio-dublado-web-dl-1080p-download/#more-34177,magnet:?xt=urn:btih:ab1860424c53b53f3b4f0a3fe06685aede6a1ec6&dn=Glamour%20Girls%202022%201080p%20WEB-DL%20DUAL%205.1&tr=udp%3a%2f%2ftracker.openbittorrent.com%3a80%2fannounce&tr=udp%3a%2f%2ftracker.publicbt.com%3a80%2fannounce&tr=udp%3a%2f%2ftracker.internetwarriors.net%3a1337%2fannounce&tr=udp%3a%2f%2ftracker.opentrackr.org%3a1337%2fannounce&tr=udp%3a%2f%2fexodus.desync.com%3a6969%2fannounce&tr=udp%3a%2f%2fopen.stealth.si%3a80%2fannounce&tr=udp%3a%2f%2fwww.torrent.eu.org%3a451%2fannounce
Chloe 1ª Temporada Torrent Legendado WEB-DL 1080p & 2160p 4K – Download,Chloe,MKV,Inglês,"Drama,Mistério",2022,55 Min./ Ep.,6.5/10,":A vida de Becky é diferente da vida de Chloe. Foram amigas na adolescência, mas hoje Becky só acompanha a vida de Chloe pelas redes sociais. Com a morte de Chloe, Becky assume uma nova identidade e se infiltra na vida dos amigos de Chloe para descobrir o que houve. Como Sasha, descobre as faces conflituosas de Chloe, mas se perde em suas mentiras. Descobrirá a verdade antes de se perder? ",https://filmestorrents.site/wp-content/uploads/2022/06/Chloe-filmestorrents-net.jpg,https://filmestorrents.site/chloe-1a-temporada-torrent-legendado-web-dl-1080p-2160p-4k-download/#more-34174,magnet:?xt=urn:btih:8f89215ba2c1521cc8d9dce0e461fb50978a89b5&dn=Chloe.S01.1080p.AMZN.WEBRip.DDP5.1.x264-FLUX%5Brartv%5D&tr=http%3A%2F%2Ftracker.trackerfix.com%3A80%2Fannounce&tr=udp%3A%2F%2F9.rarbg.me%3A2900&tr=udp%3A%2F%2F9.rarbg.to%3A2840&tr=udp%3A%2F%2Ftracker.thinelephant.org%3A12720&tr=udp%3A%2F%2Ftracker.slowcheetah.org%3A14760
Legacies (Legados) 4ª Temporada Torrent (2021) Dublado / Legendado WEB-DL 720p | 1080p – Download,Legados,MKV,"Português, Inglês",,2022,42 Min.,7.0/10,":Hope Mikaelson, descendente da linhagem mais poderosa de vampiros, lobisomens e bruxas, frequenta a Escola Salvatore para Jovens e Superdotados, um refúgio onde ela pode aprender a controlar suas habilidades e impulsos sobrenaturais. ",https://filmestorrents.site/wp-content/uploads/2021/10/Legacies-Legados-4a-Temporada-Torrent-203x300.jpg,https://filmestorrents.site/legacies-legados-4a-temporada-torrent-2021-dublado-legendado-web-dl-720p-1080p-download/#more-29681,magnet:?xt=urn:btih:2838d2e8bdc7f1198826dbae985835c41d9a4b11&dn=Legacies.S04.720p.AMZN.WEBRip.DDP5.1.x264-NTb%5Brartv%5D&tr=http%3A%2F%2Ftracker.trackerfix.com%3A80%2Fannounce&tr=udp%3A%2F%2F9.rarbg.me%3A2890&tr=udp%3A%2F%2F9.rarbg.to%3A2740&tr=udp%3A%2F%2Ftracker.tallpenguin.org%3A15720&tr=udp%3A%2F%2Ftracker.thinelephant.org%3A12800
Walker 2ª Temporada Torrent Legendado WEB-DL 720p & 1080p – Download,Walker 2ª Temporada Torrent,MKV,Inglês,"Ação,Aventura,Crime,Drama",2022,42 Min.,5.9/10,":Após um evento trágico com sua esposa, o policial Cordell Walker retorna a sua cidade natal, no Texas, onde combaterá o crime local, seguindo apenas as suas próprias regras. ",https://filmestorrents.site/wp-content/uploads/2022/03/Walker-filmestorrents-net.jpg,https://filmestorrents.site/walker-2a-temporada-torrent-legendado-web-dl-720p-1080p-download/#more-31968,magnet:?xt=urn:btih:3ffcd1b81866226905e9d5fabd9680b7b9139c1e&dn=Walker.S02E01.720p.WEB.h264-GOSSIP%5Brartv%5D&tr=http%3A%2F%2Ftracker.trackerfix.com%3A80%2Fannounce&tr=udp%3A%2F%2F9.rarbg.me%3A2750&tr=udp%3A%2F%2F9.rarbg.to%3A2910&tr=udp%3A%2F%2Ftracker.tallpenguin.org%3A15740&tr=udp%3A%2F%2Ftracker.slowcheetah.org%3A14790
Now and Then: O Segredo que Nos Une 1ª Temporada Torrent Legendado WEB-DL 1080p & 2160p 4K – Download,Now and Then O Segredo Que Nos Une,MKV,Inglês,"Drama,Mistério",2022,50 Min./ Ep.,N/A/10,":Na véspera da formatura da faculdade, seis melhores amigos embarcam em um fim de semana épico para comemorar – mas que tem uma reviravolta fatal. Quase 20 anos depois, os sobreviventes são obrigados a se encontrar por causa de uma mensagem de texto com uma chantagem que ameaça expor a verdade sobre aquela noite fatídica. ",https://filmestorrents.site/wp-content/uploads/2022/06/Now-and-Then-O-Segredo-que-Nos-Une-filmestorrents-net.jpg,https://filmestorrents.site/now-and-then-o-segredo-que-nos-une-1a-temporada-torrent-legendado-web-dl-1080p-2160p-4k-download/#more-34159,magnet:?xt=urn:btih:0399fc3c472b75803c22b927e084716c3aa5ee15&dn=Now.and.Then.2022.S01.1080p.ATVP.WEB-DL.DDP5.1.Atmos.h264-MIXED%5Brartv%5D&tr=http%3A%2F%2Ftracker.trackerfix.com%3A80%2Fannounce&tr=udp%3A%2F%2F9.rarbg.me%3A2880&tr=udp%3A%2F%2F9.rarbg.to%3A2890&tr=udp%3A%2F%2Ftracker.slowcheetah.org%3A14790&tr=udp%3A%2F%2Ftracker.fatkhoala.org%3A13790
Em Casa com os Gil 1ª Temporada Torrent Dublado WEB-DL 1080p – Download,Em Casa com os Gil,MKV,Português,Documentário,2022,35 Min./Ep.,N/A/10,:A série acompanha a família de Gilberto Gil nos bastidores da preparação para a turnê que celebra os 80 anos de vida do cantor e compositor. ,https://filmestorrents.site/wp-content/uploads/2022/06/Em-Casa-com-os-Gil-filmestorrents-net.jpg,https://filmestorrents.site/em-casa-com-os-gil-1a-temporada-torrent-dublado-web-dl-1080p-download/#more-34156,magnet:?xt=urn:btih:ab8d5413c73032259ae5d0ebe031b3f3f18075a1&dn=At.Home.with.the.Gils.S01.PORTUGUESE.1080p.AMZN.WEBRip.DDP5.1.x264-KOGi%5Brartv%5D&tr=http%3A%2F%2Ftracker.trackerfix.com%3A80%2Fannounce&tr=udp%3A%2F%2F9.rarbg.me%3A2820&tr=udp%3A%2F%2F9.rarbg.to%3A2940&tr=udp%3A%2F%2Ftracker.tallpenguin.org%3A15710&tr=udp%3A%2F%2Ftracker.thinelephant.org%3A12710
La Casa de Papel: Coreia 1ª Temporada Torrent Dublado WEB-DL 720p & 1080p – Download,La Casa de Papel Coreia,MKV,"Português, Coreano","Ação,Crime,Drama,Mistério",2022,50 Min./ Ep.,N/A/10,":Ladrões invadem a casa da moeda da Coreia unificada. Com reféns presos lá dentro, a polícia precisa detê-los, assim como a mente por trás do plano.",https://filmestorrents.site/wp-content/uploads/2022/06/La-Casa-de-Papel-Coreia-filmestorrents-net.jpg,https://filmestorrents.site/la-casa-de-papel-coreia-1a-temporada-torrent-dublado-web-dl-720p-1080p-download/#more-34149,magnet:?xt=urn:btih:3d6cd05ab2482c0f16d910b1c41e67b9eca71759&dn=La%20Casa%20de%20Papel%20Coreia%201%c2%aa%20Temporada%202022%20720p%20WEB-DL%20DUAL%205.1&tr=udp%3a%2f%2ftracker.openbittorrent.com%3a80%2fannounce&tr=udp%3a%2f%2ftracker.publicbt.com%3a80%2fannounce&tr=udp%3a%2f%2ftracker.internetwarriors.net%3a1337%2fannounce&tr=udp%3a%2f%2ftracker.opentrackr.org%3a1337%2fannounce&tr=udp%3a%2f%2fexodus.desync.com%3a6969%2fannounce&tr=udp%3a%2f%2fopen.stealth.si%3a80%2fannounce&tr=udp%3a%2f%2fwww.torrent.eu.org%3a451%2fannounce
O Homem de Toronto Torrent (2022) Dual Áudio / Dublado WEB-DL 1080p – Download,O Homem de Toronto,MKV,"Português, Inglês","Ação,Aventura",2022,1h 50 Min.,6.5/10,:Um caso de identidade trocada obriga um homem desastrado a se unir a um famoso assassino na esperança de continuar vivo. ,https://filmestorrents.site/wp-content/uploads/2022/06/O-Homem-de-Toronto-filmestorrents-net.jpg,https://filmestorrents.site/o-homem-de-toronto-torrent-2022-dual-audio-dublado-web-dl-1080p-download/#more-34146,magnet:?xt=urn:btih:6697c5807aaf79177dc50791d2676572255c9b4d&dn=O%20Homem%20de%20Toronto%202022%201080p%20WEB-DL%20DUAL%205.1&tr=udp%3a%2f%2ftracker.openbittorrent.com%3a80%2fannounce&tr=udp%3a%2f%2ftracker.publicbt.com%3a80%2fannounce&tr=udp%3a%2f%2ftracker.internetwarriors.net%3a1337%2fannounce&tr=udp%3a%2f%2ftracker.opentrackr.org%3a1337%2fannounce&tr=udp%3a%2f%2fexodus.desync.com%3a6969%2fannounce&tr=udp%3a%2f%2fopen.stealth.si%3a80%2fannounce&tr=udp%3a%2f%2fwww.torrent.eu.org%3a451%2fannounce
Rise Torrent (2022) Dual Áudio / Dublado WEB-DL 1080p – Download,Rise,MKV,"Português, Inglês","Biografia,Drama",2022,1h 53 Min.,N/A/10,":Depois de emigrar da Nigéria para a Grécia, Vera e Charles Antetokounmpo lutaram para sobreviver e sustentar seus cinco filhos, vivendo sob a ameaça diária de deportação. Desesperados para obter a cidadania grega, eram prejudicados por um sistema que os impedia a cada tentativa, mas a visão, a determinação e a fé da família tiraram seus membros do anonimato para dar início às carreiras de três campeões da NBA.",https://filmestorrents.site/wp-content/uploads/2022/06/Rise-filmestorrents-net.jpg,https://filmestorrents.site/rise-torrent-2022-dual-audio-dublado-web-dl-1080p-download/#more-34142,magnet:?xt=urn:btih:b38819cb9ff1ca27db688b56036dd6ddda3d779e&dn=Rise%202022%201080p%20WEB-DL%20DUAL%205.1&tr=udp%3a%2f%2ftracker.openbittorrent.com%3a80%2fannounce&tr=udp%3a%2f%2ftracker.publicbt.com%3a80%2fannounce&tr=udp%3a%2f%2ftracker.internetwarriors.net%3a1337%2fannounce&tr=udp%3a%2f%2ftracker.opentrackr.org%3a1337%2fannounce&tr=udp%3a%2f%2fexodus.desync.com%3a6969%2fannounce&tr=udp%3a%2f%2fopen.stealth.si%3a80%2fannounce&tr=udp%3a%2f%2fwww.torrent.eu.org%3a451%2fannounce
Homem X Abelha: A Batalha 1ª Temporada Torrent Dual Áudio / Dublado WEB-DL 1080p – Download,Homem X Abelha A Batalha,MKV,"Português, Inglês",Comédia,2022,10 Min./ Ep.,N/A/10,":O desastrado Trevor é contratado para tomar conta de uma mansão luxuosa, mas entra em guerra com uma abelha. É o início do caos! ",https://filmestorrents.site/wp-content/uploads/2022/06/Homem-X-Abelha-A-Batalha-filmestorrents-net.jpg,https://filmestorrents.site/homem-x-abelha-a-batalha-1a-temporada-torrent-dual-audio-dublado-web-dl-1080p-download/#more-34139,magnet:?xt=urn:btih:af3b2cc224bfe1040bc74ee9ec5809b4f7b63ade&dn=Homem%20X%20Abelha%20-%20A%20Batalha%201%c2%aa%20Temporada%202022%201080p%20WEB-DL%20DUAL%205.1&tr=udp%3a%2f%2ftracker.openbittorrent.com%3a80%2fannounce&tr=udp%3a%2f%2ftracker.publicbt.com%3a80%2fannounce&tr=udp%3a%2f%2ftracker.internetwarriors.net%3a1337%2fannounce&tr=udp%3a%2f%2ftracker.opentrackr.org%3a1337%2fannounce&tr=udp%3a%2f%2fexodus.desync.com%3a6969%2fannounce&tr=udp%3a%2f%2fopen.stealth.si%3a80%2fannounce&tr=udp%3a%2f%2fwww.torrent.eu.org%3a451%2fannounce
Queen Loretta 1ª Temporada Torrent Legendado WEB-DL 1080p – Download,Queen Loretta,MKV,Polonês,Drama,2022,50 Min./ Ep.,N/A/10,":Após passar décadas longe, um renomado alfaiate e drag queen de Paris volta à sua cidade natal na Polônia para se reconciliar com a filha. ",https://filmestorrents.site/wp-content/uploads/2022/06/Queen-Loretta-filmestorrents-net.jpg,https://filmestorrents.site/queen-loretta-1a-temporada-torrent-legendado-web-dl-1080p-download/#more-34135,magnet:?xt=urn:btih:5bd9d7b00807fde4896efcb2a70b6b693f225efa&dn=Queen.S01.POLISH.1080p.NF.WEBRip.DDP5.1.Atmos.x264-SMURF%5Brartv%5D&tr=http%3A%2F%2Ftracker.trackerfix.com%3A80%2Fannounce&tr=udp%3A%2F%2F9.rarbg.me%3A2990&tr=udp%3A%2F%2F9.rarbg.to%3A2810&tr=udp%3A%2F%2Ftracker.fatkhoala.org%3A13750&tr=udp%3A%2F%2Ftracker.slowcheetah.org%3A14800
Post Mortem Torrent (2022) Dublado BluRay – Download,Post Mortem Fotos do Alem,MKV,Português | Húngaro,"Terror,Mistério,Suspense",2022,1h 55 Min.,5.6/10,":Após a Primeira Guerra Mundial, Tomas, um jovem fotógrafo de cadáveres, chega a uma pequena vila húngara acompanhado de Anna, uma menina órfã. Logo, ele se sente aprisionado no local, com as estranhas sombras, os barulhos noturnos, a hostilidade dos habitantes e as mortes suspeitas. Com a ajuda de Anna e convencido da existência de fantasmas, Tomas decide investigar uma maneira de libertá-los. ",https://filmestorrents.site/wp-content/uploads/2022/06/Post-Mortem-filmestorrents-net.jpg,https://filmestorrents.site/post-mortem-torrent-2022-dublado-bluray-download/#more-34126,magnet:?xt=urn:btih:452be488059c5c78522b7aa8477101e7f91c9b35&dn=Post%20Mortem%20-%20Fotos%20do%20Al%c3%a9m%202022%20720p%20BluRay%20DUAL%205.1&tr=udp%3a%2f%2ftracker.openbittorrent.com%3a80%2fannounce&tr=udp%3a%2f%2ftracker.publicbt.com%3a80%2fannounce&tr=udp%3a%2f%2ftracker.internetwarriors.net%3a1337%2fannounce&tr=udp%3a%2f%2ftracker.opentrackr.org%3a1337%2fannounce&tr=udp%3a%2f%2fexodus.desync.com%3a6969%2fannounce&tr=udp%3a%2f%2fopen.stealth.si%3a80%2fannounce&tr=udp%3a%2f%2fwww.torrent.eu.org%3a451%2fannounce
Em Fuga Torrent (2022) Dual Áudio / Dublado BluRay – Download,Em Fuga,MKV,Português | Inglês,"Ação,Suspense",2022,1h 36 Min.,3.8/10,":Uma ex-dançarina burlesca que virou autora (Lena Headey) descobre uma segunda chance de vida e redenção quando arrisca tudo para resgatar seu jovem vizinho depois que ele testemunha o assassinato de seus pais. Agora fugindo do chefe do crime local (Sam Worthington), que por acaso é seu ex de longa data, ela faz uma tentativa desesperada de colocar o menino em segurança. ",https://filmestorrents.site/wp-content/uploads/2022/06/Em-Fuga-filmestorrents-net.jpg,https://filmestorrents.site/em-fuga-torrent-2022-dual-audio-dublado-bluray-download/#more-34123,magnet:?xt=urn:btih:ffc3d35414a37af761840e96724f89a3812ab6a3&dn=Em%20Fuga%202022%201080p%20BluRay%20DUAL&tr=udp%3a%2f%2ftracker.openbittorrent.com%3a80%2fannounce&tr=udp%3a%2f%2ftracker.publicbt.com%3a80%2fannounce&tr=udp%3a%2f%2ftracker.internetwarriors.net%3a1337%2fannounce&tr=udp%3a%2f%2ftracker.opentrackr.org%3a1337%2fannounce&tr=udp%3a%2f%2fexodus.desync.com%3a6969%2fannounce&tr=udp%3a%2f%2fopen.stealth.si%3a80%2fannounce&tr=udp%3a%2f%2fwww.torrent.eu.org%3a451%2fannounce
Epa! Cadê o Noé? 2 Torrent (2022) Dual Áudio / Dublado BluRay 1080p – Download,Epa Cade o Noe 2,MKV,"Português, Inglês","Animação,Aventura,Comédia",2022,1h 20 Min.,5.8/10,":À deriva em uma inundação, dois náufragos desajustados lutam para reunir uma família pouco ortodoxa, superar um vulcão e negociar um acordo de paz em uma arca que range. ",https://filmestorrents.site/wp-content/uploads/2022/06/Epa-Cade-o-Noe-2-filmestorrents-net.jpg,https://filmestorrents.site/epa-cade-o-noe-2-torrent-2022-dual-audio-dublado-bluray-1080p-download/#more-34120,magnet:?xt=urn:btih:6063870b19ac879a5a0b9a6c9b2ce4955b8140a1&dn=Epa!%20Cad%c3%aa%20o%20No%c3%a9%202%202020%201080p%20BluRay%20DUAL&tr=udp%3a%2f%2ftracker.openbittorrent.com%3a80%2fannounce&tr=udp%3a%2f%2ftracker.publicbt.com%3a80%2fannounce&tr=udp%3a%2f%2ftracker.internetwarriors.net%3a1337%2fannounce&tr=udp%3a%2f%2ftracker.opentrackr.org%3a1337%2fannounce&tr=udp%3a%2f%2fexodus.desync.com%3a6969%2fannounce&tr=udp%3a%2f%2fopen.stealth.si%3a80%2fannounce&tr=udp%3a%2f%2fwww.torrent.eu.org%3a451%2fannounce
O Quarto Mosqueteiro Torrent (2022) Dual Áudio / Dublado WEB-DL 1080p – Download,DArtagnan O 4° Mosqueteiro,MKV,"Português, Inglês","Ação,Aventura",2022,1h 25 Min.,2.9/10,":A mando de seu pai, o jovem d’Artagnan viaja da Gasconha rural para Paris, onde se envolve em uma trama desonesta entre os mosqueteiros do rei e os guardas do cardeal Richelieu. ",https://filmestorrents.site/wp-content/uploads/2022/06/O-Quarto-Mosqueteiro-filmestorrents-net.jpg,https://filmestorrents.site/o-quarto-mosqueteiro-torrent-2022-dual-audio-dublado-web-dl-1080p-download/#more-34117,magnet:?xt=urn:btih:42f13b89746ff626e45945b369667e1d1e3368cd&dn=D%27Artagnan%20O%204%c2%b0%20Mosqueteiro%202022%201080p%20WEB-DL%20DUAL%205.1&tr=udp%3a%2f%2ftracker.openbittorrent.com%3a80%2fannounce&tr=udp%3a%2f%2ftracker.publicbt.com%3a80%2fannounce&tr=udp%3a%2f%2ftracker.internetwarriors.net%3a1337%2fannounce&tr=udp%3a%2f%2ftracker.opentrackr.org%3a1337%2fannounce&tr=udp%3a%2f%2fexodus.desync.com%3a6969%2fannounce&tr=udp%3a%2f%2fopen.stealth.si%3a80%2fannounce&tr=udp%3a%2f%2fwww.torrent.eu.org%3a451%2fannounce
Assassino Sem Rastro Torrent (2022) Dublado WEB-DL – Download,Assassino sem Rastro,MKV,"Português, nglês","Mistério,Suspense,Ação,Crime",2022,1h 58 Min.,N/A/10,":Em Assassino Sem Rastro, Alex Lewis é um assassino experiente com reputação de precisão discreta. Preso em um dilema moral, Alex se recusa a concluir um trabalho que viola seu código de ética e deve rapidamente caçar e matar as pessoas que o contrataram antes que eles e o agente do FBI Vincent Serra o encontrem primeiro. Alex tinha o objetivo de se vingar, mas, com uma memória que começa a vacilar, ele é forçado a questionar todas as suas ações, se perdendo na linha entre o certo e o errado.",https://filmestorrents.site/wp-content/uploads/2022/06/Assassino-Sem-Rastro-filmestorrents-net.jpg,https://filmestorrents.site/assassino-sem-rastro-torrent-2022-dublado-web-dl-download/#more-34113,magnet:?xt=urn:btih:3557a802e73d05d550cc129c01174a4fa65fe23d&dn=Assassino%20Sem%20Rastro%202022%201080p%20WEB-DL%20DUAL%205.1&tr=udp%3a%2f%2ftracker.openbittorrent.com%3a80%2fannounce&tr=udp%3a%2f%2ftracker.publicbt.com%3a80%2fannounce&tr=udp%3a%2f%2ftracker.internetwarriors.net%3a1337%2fannounce&tr=udp%3a%2f%2ftracker.opentrackr.org%3a1337%2fannounce&tr=udp%3a%2f%2fexodus.desync.com%3a6969%2fannounce&tr=udp%3a%2f%2fopen.stealth.si%3a80%2fannounce&tr=udp%3a%2f%2fwww.torrent.eu.org%3a451%2fannounce
The Umbrella Academy 3ª Temporada Torrent Dual Áudio / Dublado WEB-DL 720p & 1080p – Download,The Umbrella Academy 3ª Temporada,MKV,"Português, Inglês","Ação,Aventura,Fantasia",2022,42 Min. / Ep.,8.0/10,":Com a morte do pai, irmãos com poderes extraordinários se reencontram e descobrem surpreendentes segredos de família – além de uma ameaça iminente à humanidade. ",https://filmestorrents.site/wp-content/uploads/2022/06/The-Umbrella-Academy-filmestorrents-net.jpg,https://filmestorrents.site/the-umbrella-academy-3a-temporada-torrent-dual-audio-dublado-web-dl-720p-1080p-download/#more-34084,magnet:?xt=urn:btih:Z5BMOWAWGKHNOMCZHD7ZAO6Z3BDHCE42&dn=The.Umbrella.Academy.S03.1080p.NF.WEB-DL.DDP5.1.x264.Dual&tr=udp%3A%2F%2Ftracker.openbittorrent.com%3A80%2Fannounce
Landscapers 1ª Temporada Torrent Dual Áudio / Dublado WEB-DL 720p & 1080p – Download,Landscapers,MKV,"Português, Inglês","Comédia,Crime,Drama",2022,50 Min./ Ep.,7.0/10,:Um casal aparentemente comum que se torna o foco de uma investigação quando dois corpos são descobertos no quintal de uma casa. ,https://filmestorrents.site/wp-content/uploads/2022/06/Landscapers-filmestorrents-net.jpg,https://filmestorrents.site/landscapers-1a-temporada-torrent-dual-audio-dublado-web-dl-720p-1080p-download/#more-34109,magnet:?xt=urn:btih:OLAZSKWQU4HVMIH5U6EZ5P3WCCY5YRV2&dn=Landscapers.S01.1080p.WEB-DL.DUAL&tr=udp%3A%2F%2Ftracker.openbittorrent.com%3A80%2Fannounce
Doutor Estranho no Multiverso da Loucura Torrent IMAX (2022) Dual Áudio / Dublado WEB-DL 720p & 1080p & 4K – Download,Doutor Estranho no Multiverso da Loucura,MKV,"Português, Inglês","Ação,Aventura,Fantasia",2022,2h 06 Min.,7.3/10,":Doutor Estranho, com a ajuda de aliados místicos antigos e novos, atravessa as perigosas realidades alternativas e alucinantes do Multiverso para enfrentar um novo adversário misterioso.",https://filmestorrents.site/wp-content/uploads/2022/06/Doutor-Estranho-no-Multiverso-da-Loucura-filmestorrents-net.jpg,https://filmestorrents.site/doutor-estranho-no-multiverso-da-loucura-torrent-2022-dual-audio-dublado-web-dl-720p-1080p-4k-download/#more-34099,magnet:?xt=urn:btih:a778472b4edda562a29d602fb763904d24c74c45&dn=Doutor%20Estranho%20no%20Multiverso%20da%20Loucura%202022%201080p%20WEB-DL%20DUAL%205.1&tr=udp%3a%2f%2ftracker.openbittorrent.com%3a80%2fannounce&tr=udp%3a%2f%2ftracker.publicbt.com%3a80%2fannounce&tr=udp%3a%2f%2ftracker.internetwarriors.net%3a1337%2fannounce&tr=udp%3a%2f%2ftracker.opentrackr.org%3a1337%2fannounce&tr=udp%3a%2f%2fexodus.desync.com%3a6969%2fannounce&tr=udp%3a%2f%2fopen.stealth.si%3a80%2fannounce&tr=udp%3a%2f%2fwww.torrent.eu.org%3a451%2fannounce
Obi-Wan Kenobi 1ª Temporada Torrent Dual Áudio / Dublado WEB-DL 720p & 1080p & 4K – Download,Obi-Wan Kenobi,MKV,"Português, Inglês","Ação,Fantasia,Aventura",2022,50 Min./Ep.,8.6/10,":Durante o reinado do Império Galáctico, o antigo Mestre Jedi Obi-Wan Kenobi embarca em uma missão crucial. Kenobi deve confrontar aliados que se tornaram inimigos e enfrentar a fúria do Império.",https://filmestorrents.site/wp-content/uploads/2022/05/Obi-Wan-Kenobi-filmestorrents-net.jpg,https://filmestorrents.site/obi-wan-kenobi-1a-temporada-torrent-dual-audio-dublado-web-dl-720p-1080p-4k-download/#more-33671,magnet:?xt=urn:btih:af22187b3d2be4dd0bcd3d8b0cea2f77c48a924d&dn=Obi-Wan.Kenobi.S01E01-02.720p.WEB-DL.DUAL&tr=udp%3a%2f%2ftracker.openbittorrent.com%3a80%2fannounce&tr=udp%3a%2f%2ftracker.publicbt.com%3a80%2fannounce&tr=udp%3a%2f%2ftracker.internetwarriors.net%3a1337%2fannounce&tr=udp%3a%2f%2ftracker.opentrackr.org%3a1337%2fannounce&tr=udp%3a%2f%2fexodus.desync.com%3a6969%2fannounce&tr=udp%3a%2f%2fopen.stealth.si%3a80%2fannounce&tr=udp%3a%2f%2fwww.torrent.eu.org%3a451%2fannounce
Chicago Fire: Heróis Contra o Fogo 10ª Temporada Torrent (2021) Dual Áudio / Legendado WEB-DL 720p | 1080p – Download,Chicago Fire: Heróis Contra o Fogo,MKV,"Português, Inglês","Ação,Drama",2022,45 Min./ Ep.,8.0/10,":Acompanhe o dia-a-dia intenso e os dramas dos oficiais do Departamento de Bombeiros de Chicago e paramédicos do Quartel 51. A equipe composta por bombeiros, equipe de resgate e paramédicos, irá passar por situações tensas e delicadas, arriscando suas próprias vidas para salvar pessoas em perigo, além de ter que lidar com os conflitos pessoais e os desafios que surgem por conta das diferenças entre os companheiros de equipe. ",https://filmestorrents.site/wp-content/uploads/2021/09/Chicago-Fire-Herois-Contra-o-Fogo-10a-Temporada-Torrent-200x300.jpg,https://filmestorrents.site/chicago-fire-herois-contra-o-fogo-10a-temporada-torrent-2021-dual-audio-legendado-web-dl-720p-1080p-download/#more-28802,magnet:?xt=urn:btih:66ec22bbbbe1e7d828ac58c0d5cecaa27cf24e8d&dn=Chicago.Fire.S10.720p.AMZN.WEBRip.DDP5.1.x264-KiNGS%5Brartv%5D&tr=http%3A%2F%2Ftracker.trackerfix.com%3A80%2Fannounce&tr=udp%3A%2F%2F9.rarbg.me%3A2850&tr=udp%3A%2F%2F9.rarbg.to%3A2990&tr=udp%3A%2F%2Ftracker.thinelephant.org%3A12770&tr=udp%3A%2F%2Ftracker.fatkhoala.org%3A13760
