标题名,影片名,格式,音频,属性,年份,时长,IMDB值,简介,影片海报,影片下载web_url,影片下载url之一
From 1ª Temporada Torrent Dual Áudio / Dublado WEB-DL 720p & 1080p & 4K – Download,From,MKV,"Português, Inglês","Drama,Terror,Mistério",2022,45 min.,7.8/10,":Desvende o mistério de uma cidade de pesadelo na América Central que prende todos aqueles que entram. À medida que os moradores relutantes lutam para manter um senso de normalidade e procurar uma saída, eles também devem sobreviver às ameaças da floresta ao redor – incluindo as criaturas aterrorizantes que surgem quando o sol se põe. ",https://filmestorrents.site/wp-content/uploads/2022/03/From-filmestorrents-net.jpg,https://filmestorrents.site/from-1a-temporada-torrent-dual-audio-dublado-web-dl-720p-1080p-4k-download/#more-32055,magnet:?xt=urn:btih:c572a9f7b9c6534e39e1bf1b6009089db736922e&dn=From.S01E01.720p.WEB.h264-GOSSIP%5Brartv%5D&tr=http%3A%2F%2Ftracker.trackerfix.com%3A80%2Fannounce&tr=udp%3A%2F%2F9.rarbg.me%3A2940&tr=udp%3A%2F%2F9.rarbg.to%3A2740&tr=udp%3A%2F%2Ftracker.fatkhoala.org%3A13720&tr=udp%3A%2F%2Ftracker.tallpenguin.org%3A15790
Um Jantar Entre Espiões Torrent (2022) Dual Áudio / Dublado WEB-DL 1080p – Download,Um Jantar Entre Espioes,MKV,"Português, Inglês",Suspense,2022,1h 42 Min.,N/A/10,":Dois agentes da CIA e ex-namorados são reunidos anos após uma tentativa de resgate fracassada e forçados a obscurecer os limites entre profissão e paixão nesta história profundamente fascinante de espionagem global, dilema moral e traição mortal. ",https://filmestorrents.site/wp-content/uploads/2022/04/Um-Jantar-Entre-Espioes-filmestorrents-net.jpg,https://filmestorrents.site/um-jantar-entre-espioes-torrent-2022-dual-audio-dublado-web-dl-1080p-download/#more-32838,magnet:?xt=urn:btih:675725fcc63fbd1334f5a3d39f755cb24bed4869&dn=Um%20Jantar%20Entre%20Espi%c3%b5es%202022%201080p%20WEB-DL%20DUAL%205.1&tr=udp%3a%2f%2ftracker.openbittorrent.com%3a80%2fannounce&tr=udp%3a%2f%2ftracker.publicbt.com%3a80%2fannounce&tr=udp%3a%2f%2ftracker.internetwarriors.net%3a1337%2fannounce&tr=udp%3a%2f%2ftracker.opentrackr.org%3a1337%2fannounce&tr=udp%3a%2f%2fexodus.desync.com%3a6969%2fannounce&tr=udp%3a%2f%2fopen.stealth.si%3a80%2fannounce&tr=udp%3a%2f%2fwww.torrent.eu.org%3a451%2fannounce
Yaksha: Operação Implacável Torrent (2022) Dublado WEB-DL 1080p – Download,Yaksha Operaçao Implacavel,MKV,"Português, Coreano","Ação,Crime,Suspense",2022,2h 05 Min.,N/A/10,":Durante a investigação de uma equipe de operações secretas em um local de alto risco, um promotor exemplar enfrenta uma guerra entre espiões. ",https://filmestorrents.site/wp-content/uploads/2022/04/Yaksha-Operacao-Implacavel-filmestorrents-net.jpg,https://filmestorrents.site/yaksha-operacao-implacavel-torrent-2022-dublado-web-dl-1080p-download/#more-32835,magnet:?xt=urn:btih:3fa26024d12ffcb44f6a6a8eaca856cb3bec42dd&dn=Yaksha%20-%20Opera%c3%a7%c3%a3o%20Implac%c3%a1vel%202022%201080p%20WEB-DL%20DUAL%205.1&tr=udp%3a%2f%2ftracker.openbittorrent.com%3a80%2fannounce&tr=udp%3a%2f%2ftracker.publicbt.com%3a80%2fannounce&tr=udp%3a%2f%2ftracker.internetwarriors.net%3a1337%2fannounce&tr=udp%3a%2f%2ftracker.opentrackr.org%3a1337%2fannounce&tr=udp%3a%2f%2fexodus.desync.com%3a6969%2fannounce&tr=udp%3a%2f%2fopen.stealth.si%3a80%2fannounce&tr=udp%3a%2f%2fwww.torrent.eu.org%3a451%2fannounce
Resurrection Torrent (2022) Dual Áudio / Dublado WEB-DL 1080p – Download,A Ressurreiçao de Jesus,MKV,"Português, Inglês","Drama,História",2022,1h 35 Min.,5.9/10,":Os seguidores de Jesus são caçados, sem liderança e procurando desesperadamente por compreensão, mas quando Jesus ressuscita da morte, eles percebem que a esperança não morreu na cruz. Ele vive neles. ",https://filmestorrents.site/wp-content/uploads/2022/04/Resurrection-filmestorrents-net.jpg,https://filmestorrents.site/resurrection-torrent-2022-dual-audio-dublado-web-dl-1080p-download/#more-32829,magnet:?xt=urn:btih:950fc3ca2d02fc04977db014a064b0ec15c8814a&dn=A%20Ressurrei%c3%a7%c3%a3o%20de%20Jesus%202021%201080p%20WEB-DL%20DUAL&tr=udp%3a%2f%2ftracker.openbittorrent.com%3a80%2fannounce&tr=udp%3a%2f%2ftracker.publicbt.com%3a80%2fannounce&tr=udp%3a%2f%2ftracker.internetwarriors.net%3a1337%2fannounce&tr=udp%3a%2f%2ftracker.opentrackr.org%3a1337%2fannounce&tr=udp%3a%2f%2fexodus.desync.com%3a6969%2fannounce&tr=udp%3a%2f%2fopen.stealth.si%3a80%2fannounce&tr=udp%3a%2f%2fwww.torrent.eu.org%3a451%2fannounce
Uma Noite com a Família Blacks 2: O Perigo Mora ao Lado Torrent (2022) Dual Áudio / Dublado BluRay 1080p – Download,Uma Noite com a Familia Blacks 2 O Perigo Mora ao Lado,MKV,"Português, Inglês","Ação,Comédia,Terror",2022,1h 37 Min.,3.8/10,":Quando o autor de best-sellers Carl Black muda sua família de volta para a casa de sua infância, ele deve se juntar a vizinhos excêntricos para lutar com um cafetão, que pode ou não ser um vampiro de verdade. ",https://filmestorrents.site/wp-content/uploads/2022/04/Uma-Noite-com-a-Familia-Blacks-2-O-Perigo-Mora-ao-Lado-filmestorrents-net.jpg,https://filmestorrents.site/uma-noite-com-a-familia-blacks-2-o-perigo-mora-ao-lado-torrent-2022-dual-audio-dublado-bluray-1080p-download/#more-32823,magnet:?xt=urn:btih:df0091063dc4738a2c543031ca153bdfe17b498f&dn=Uma%20Noite%20com%20a%20Fam%c3%adlia%20Blacks%202%20-%20O%20Perigo%20Mora%20ao%20Lado%202021%201080p%20BluRay%20DUAL&tr=udp%3a%2f%2ftracker.openbittorrent.com%3a80%2fannounce&tr=udp%3a%2f%2ftracker.publicbt.com%3a80%2fannounce&tr=udp%3a%2f%2ftracker.internetwarriors.net%3a1337%2fannounce&tr=udp%3a%2f%2ftracker.opentrackr.org%3a1337%2fannounce&tr=udp%3a%2f%2fexodus.desync.com%3a6969%2fannounce&tr=udp%3a%2f%2fopen.stealth.si%3a80%2fannounce&tr=udp%3a%2f%2fwww.torrent.eu.org%3a451%2fannounce
Mistério das Palavras Cruzadas: A Queda Fatal Torrent (2022) Dual Áudio / Dublado WEB-DL 1080p – Download,Misterio das Palavras Cruzadas A Queda Fatal,MKV,"Português, Inglês","Crime,Drama,Mistério",2022,1h 24 Min.,7.2/10,":Tess entra como voluntária em uma competição de palavras cruzadas contra um novo supercomputador. No entanto, ela se vê envolvida em mais uma investigação após o assassinato de um famoso CEO de tecnologia. ",https://filmestorrents.site/wp-content/uploads/2022/04/Misterio-das-Palavras-Cruzadas-A-Queda-Fatal-filmestorrents-net.jpg,https://filmestorrents.site/misterio-das-palavras-cruzadas-a-queda-fatal-torrent-2022-dual-audio-dublado-web-dl-1080p-download/#more-32816,magnet:?xt=urn:btih:981819b606b6235147af026a57b4513c6eb16135&dn=Mist%c3%a9rio%20das%20Palavras%20Cruzadas%20A%20Queda%20Fatal%202021%201080p%20WEB-DL%20DUAL&tr=udp%3a%2f%2ftracker.openbittorrent.com%3a80%2fannounce&tr=udp%3a%2f%2ftracker.publicbt.com%3a80%2fannounce&tr=udp%3a%2f%2ftracker.internetwarriors.net%3a1337%2fannounce&tr=udp%3a%2f%2ftracker.opentrackr.org%3a1337%2fannounce&tr=udp%3a%2f%2fexodus.desync.com%3a6969%2fannounce&tr=udp%3a%2f%2fopen.stealth.si%3a80%2fannounce&tr=udp%3a%2f%2fwww.torrent.eu.org%3a451%2fannounce
A Faxineira 1ª Temporada Torrent Dual Áudio / Dublado : WEB-DL 720p & 1080p – Download,A Faxineira,MKV,"Português, Inglês","Crime,Drama,Suspense",2022,42 Min./ Ep.,7.1/10,":Uma médica se muda para os Estados Unidos buscando um tratamento para seu filho doente. Porém, o sistema norte-americano falha com ela, obrigando-a a se esconder. Se recusando a perder e ser marginalizada, ela se torna faxineira para a máfia, jogando com suas próprias regras. ",https://filmestorrents.site/wp-content/uploads/2022/03/A-Faxineira-filmestorrents-net.jpg,https://filmestorrents.site/a-faxineira-1a-temporada-torrent-dual-audio-dublado-web-dl-720p-1080p-download/#more-31986,magnet:?xt=urn:btih:11e6effc15cd8fc4b04ef4b68dbdb3d7b43e8975&dn=A.Faxineira.S01E01.720p.WEB-DL.DUAL&tr=udp%3a%2f%2ftracker.openbittorrent.com%3a80%2fannounce&tr=udp%3a%2f%2ftracker.publicbt.com%3a80%2fannounce&tr=udp%3a%2f%2ftracker.internetwarriors.net%3a1337%2fannounce&tr=udp%3a%2f%2ftracker.opentrackr.org%3a1337%2fannounce&tr=udp%3a%2f%2fexodus.desync.com%3a6969%2fannounce&tr=udp%3a%2f%2fopen.stealth.si%3a80%2fannounce&tr=udp%3a%2f%2fwww.torrent.eu.org%3a451%2fannounce
Elite 5ª Temporada Torrent Dublado WEB-DL 720p & 1080p – Download,Elite Torrent,MKV,"Português, Espanhol","Crime,Drama,Suspense",2022,42 Min./ Ep.,7.5/10,":Após três jovens da escola pública serem transferidos para um conceituado colégio de elite, o conflito entre classes acaba levando a um assassinato. ",https://filmestorrents.site/wp-content/uploads/2022/04/Elite-filmestorrents-net.jpg,https://filmestorrents.site/elite-5a-temporada-torrent-dublado-web-dl-720p-1080p-download/#more-32803,magnet:?xt=urn:btih:f5968cf36a3127db8ad26f108a73ed82830dbf31&dn=Elite.S05.SPANISH.1080p.NF.WEBRip.DDP5.1.Atmos.x264-TEPES%5Brartv%5D&tr=http%3A%2F%2Ftracker.trackerfix.com%3A80%2Fannounce&tr=udp%3A%2F%2F9.rarbg.me%3A2880&tr=udp%3A%2F%2F9.rarbg.to%3A2900&tr=udp%3A%2F%2Ftracker.fatkhoala.org%3A13750&tr=udp%3A%2F%2Ftracker.slowcheetah.org%3A14800
South of Heaven Torrent (2022) Dual Áudio / Dublado BluRay – Download,South of Heaven,MKV,"Português, Inglês","Ação,Crime,Drama",2022,2h 00 Min.,5.7/10,":O criminoso condenado Jimmy obtém liberdade condicional após cumprir 12 anos por assalto à mão armada. Após a sua libertação, ele promete dar a Annie, seu amor de infância, agora morrendo de câncer, o melhor último ano de sua vida – infelizmente não é tão simples. ",https://filmestorrents.site/wp-content/uploads/2022/04/South-of-Heaven-filmestorrents-net.jpg,https://filmestorrents.site/south-of-heaven-torrent-2022-dual-audio-dublado-bluray-download/#more-32799,magnet:?xt=urn:btih:027fae3627babd250cde0b8a79f6a048cf938262&dn=South%20Of%20Heaven%202021%201080p%20BluRay%20DUAL%205.1&tr=udp%3a%2f%2ftracker.openbittorrent.com%3a80%2fannounce&tr=udp%3a%2f%2ftracker.publicbt.com%3a80%2fannounce&tr=udp%3a%2f%2ftracker.internetwarriors.net%3a1337%2fannounce&tr=udp%3a%2f%2ftracker.opentrackr.org%3a1337%2fannounce&tr=udp%3a%2f%2fexodus.desync.com%3a6969%2fannounce&tr=udp%3a%2f%2fopen.stealth.si%3a80%2fannounce&tr=udp%3a%2f%2fwww.torrent.eu.org%3a451%2fannounce
De Volta ao Espaço Torrent (2022) Dual Áudio / Dublado WEB-DL 1080p – Download,De Volta ao Espaço,MKV,"Português, Inglês",Documentário,2022,2h 08 Min.,N/A/10,:Elon Musk e os engenheiros da SpaceX embarcam em uma missão histórica para levar astronautas da NASA de volta à Estação Espacial Internacional. ,https://filmestorrents.site/wp-content/uploads/2022/04/De-Volta-ao-Espaco-filmestorrents-net.jpg,https://filmestorrents.site/de-volta-ao-espaco-torrent-2022-dual-audio-dublado-web-dl-1080p-download/#more-32796,magnet:?xt=urn:btih:c9d93e702ebb88e4cba26082d9416ca69f8d668b&dn=De%20Volta%20ao%20Espa%c3%a7o%202022%201080p%20WEB-DL%20DUAL%205.1&tr=udp%3a%2f%2ftracker.openbittorrent.com%3a80%2fannounce&tr=udp%3a%2f%2ftracker.publicbt.com%3a80%2fannounce&tr=udp%3a%2f%2ftracker.internetwarriors.net%3a1337%2fannounce&tr=udp%3a%2f%2ftracker.opentrackr.org%3a1337%2fannounce&tr=udp%3a%2f%2fexodus.desync.com%3a6969%2fannounce&tr=udp%3a%2f%2fopen.stealth.si%3a80%2fannounce&tr=udp%3a%2f%2fwww.torrent.eu.org%3a451%2fannounce
O ‘W’ da Questão Torrent (2022) Dublado WEB-DL 1080p – Download,O E#8216;W da Questao,MKV,Português | Polonês,"Crime,Comédia,Ficçãocientífica",2022,1h 45 Min.,5.3/10,":Ao investigar um assassinato, uma ávida leitora de histórias policiais descobre grandes segredos sobre os moradores de uma pequena cidade. ",https://filmestorrents.site/wp-content/uploads/2022/04/O-W-da-Questao-filmestorrents-net.jpg,https://filmestorrents.site/o-w-da-questao-torrent-2022-dublado-web-dl-1080p-download/#more-32793,magnet:?xt=urn:btih:7d4083773585e17269acdbc6f208cc75d0234f0f&dn=O%20W%20da%20Quest%c3%a3o%202021%201080p%20WEB-DL%20DUAL%205.1&tr=udp%3a%2f%2ftracker.openbittorrent.com%3a80%2fannounce&tr=udp%3a%2f%2ftracker.publicbt.com%3a80%2fannounce&tr=udp%3a%2f%2ftracker.internetwarriors.net%3a1337%2fannounce&tr=udp%3a%2f%2ftracker.opentrackr.org%3a1337%2fannounce&tr=udp%3a%2f%2fexodus.desync.com%3a6969%2fannounce&tr=udp%3a%2f%2fopen.stealth.si%3a80%2fannounce&tr=udp%3a%2f%2fwww.torrent.eu.org%3a451%2fannounce
Bull 6ª Temporada Torrent (2021) Dual Áudio / Legendado WEB-DL 720p | 1080p – Download,Bull 6ª Temporada Torrent,MKV,"Português, Inglês","Comédia,Crime,Drama",2022,44 Min.,7.1/10,":Dr. Jason Bull é o fundador de uma empresa de consultoria de sucesso que usa psicologia, intuição e dados de alta tecnologia para descobrir como pensam e agem jurados, advogados, testemunhas e acusados no tribunal. ",https://filmestorrents.site/wp-content/uploads/2021/10/Bull-6a-Temporada-Torrent-1-200x300.jpg,https://filmestorrents.site/bull-6a-temporada-torrent-2021-dual-audio-legendado-web-dl-720p-1080p-download-2/#more-29459,magnet:?xt=urn:btih:b23afbe392dbb78cae0956ffc7642a9f949d9f0e&dn=Bull.2016.S06E01.720p.WEB.H264-CAKES%5Brartv%5D&tr=http%3A%2F%2Ftracker.trackerfix.com%3A80%2Fannounce&tr=udp%3A%2F%2F9.rarbg.me%3A2750&tr=udp%3A%2F%2F9.rarbg.to%3A2910&tr=udp%3A%2F%2Ftracker.thinelephant.org%3A12720&tr=udp%3A%2F%2Ftracker.tallpenguin.org%3A15750
Furioza Torrent (2022) Dublado WEB-DL 1080p – Download,Furioza,MKV,"Português, Polonês","Ação,Drama,Crime",2022,2h 19 Min.,6.9/10,: ,https://filmestorrents.site/wp-content/uploads/2022/04/Furioza-filmestorrents-net.jpg,https://filmestorrents.site/furioza-torrent-2022-dublado-web-dl-1080p-download/#more-32779,magnet:?xt=urn:btih:f7595add8ec4e098f9eab99444568ee3b9d2c26a&dn=Furioza%202022%201080p%20WEB-DL%20DUAL%205.1&tr=udp%3a%2f%2ftracker.openbittorrent.com%3a80%2fannounce&tr=udp%3a%2f%2ftracker.publicbt.com%3a80%2fannounce&tr=udp%3a%2f%2ftracker.internetwarriors.net%3a1337%2fannounce&tr=udp%3a%2f%2ftracker.opentrackr.org%3a1337%2fannounce&tr=udp%3a%2f%2fexodus.desync.com%3a6969%2fannounce&tr=udp%3a%2f%2fopen.stealth.si%3a80%2fannounce&tr=udp%3a%2f%2fwww.torrent.eu.org%3a451%2fannounce
Fuga da Meia-Noite Torrent (2022) Dublado WEB-DL 1080p – Download,Fuga da Meia-Noite Torrent,MKV,"Português, Coreano",Suspense,2022,1h 40 Min.,6.7/10,":Kyung-mi, uma jovem surda, testemunha um dos ataques do serial killer Do-sik. Agora caçada pelo criminoso, ela se envolve em um perigoso jogo de gato e rato que também ameaça sua mãe. ",https://filmestorrents.site/wp-content/uploads/2022/04/Fuga-da-Meia-Noite-filmestorrents-net.jpg,https://filmestorrents.site/fuga-da-meia-noite-torrent-2022-dublado-web-dl-1080p-download/#more-32773,magnet:?xt=urn:btih:f4d3e18aa305c77783d2bd73a3891e6cb67cf242&dn=Fuga%20da%20Meia-Noite%202021%201080p%20WEB-DL%20DUAL&tr=udp%3a%2f%2ftracker.openbittorrent.com%3a80%2fannounce&tr=udp%3a%2f%2ftracker.publicbt.com%3a80%2fannounce&tr=udp%3a%2f%2ftracker.internetwarriors.net%3a1337%2fannounce&tr=udp%3a%2f%2ftracker.opentrackr.org%3a1337%2fannounce&tr=udp%3a%2f%2fexodus.desync.com%3a6969%2fannounce&tr=udp%3a%2f%2fopen.stealth.si%3a80%2fannounce&tr=udp%3a%2f%2fwww.torrent.eu.org%3a451%2fannounce
Lembranças Sombrias Torrent (2022) Dublado WEB-DL 1080p – Download,Lembranças Sombrias,MKV,"Português, Coreano","Drama,Mistério,Suspense",2022,1h 39 Min.,6.8/10,":Depois de um grave acidente, Soo-jin perde a memória e começa a ter visões que parecem ser sobre seu futuro. Sem conseguir diferenciar entre delírios e a realidade, as memórias confusas de Soo-jin desenterram um terrível segredo de seu marido. ",https://filmestorrents.site/wp-content/uploads/2022/04/Lembrancas-Sombrias-filmestorrents-net.jpg,https://filmestorrents.site/lembrancas-sombrias-torrent-2022-dublado-web-dl-1080p-download/#more-32770,magnet:?xt=urn:btih:ee304bf2798a28235547aae05aaaba4b02caf027&dn=Lembran%c3%a7as%20Sombrias%202021%201080p%20WEB-DL%20DUAL&tr=udp%3a%2f%2ftracker.openbittorrent.com%3a80%2fannounce&tr=udp%3a%2f%2ftracker.publicbt.com%3a80%2fannounce&tr=udp%3a%2f%2ftracker.internetwarriors.net%3a1337%2fannounce&tr=udp%3a%2f%2ftracker.opentrackr.org%3a1337%2fannounce&tr=udp%3a%2f%2fexodus.desync.com%3a6969%2fannounce&tr=udp%3a%2f%2fopen.stealth.si%3a80%2fannounce&tr=udp%3a%2f%2fwww.torrent.eu.org%3a451%2fannounce
O Jovem Viking Torrent (2022) Dublado WEB-DL 720p – Download,O Jovem Viking Torrent,MKV,"Português, Suéco",Família,2022,1h 29 Min.,4.9/10,":Halvdan não é o tipo perfeito de Viking. Ele manca e é considerado pelas outras crianças um estranho solitário sem amigos – exceto pelo ferreiro da aldeia, Björn, que cuidou dele desde que o pai de Halvdan partiu em uma viagem para saquear. Do outro lado do poderoso rio, há uma vila inimiga que está em uma rixa com a tribo de Halvdan desde tempos remotos. Um dia, durante as excursões solitárias de Halvdan ao rio, ele encontra Meia, a filha do governante da vila inimiga. Começa então uma comovente e divertida aventura sobre como superar diferenças e amizades proibidas. ",https://filmestorrents.site/wp-content/uploads/2022/04/O-Jovem-Viking-filmestorrents-net.jpg,https://filmestorrents.site/o-jovem-viking-torrent-2022-dublado-web-dl-720p-download/#more-32764,magnet:?xt=urn:btih:c53059c8128559a9707909a8677bbd89ca3c0bd2&dn=O%20Jovem%20Viking%202018%20720p%20WEB-DL%20DUAL&tr=udp%3a%2f%2ftracker.openbittorrent.com%3a80%2fannounce&tr=udp%3a%2f%2ftracker.publicbt.com%3a80%2fannounce&tr=udp%3a%2f%2ftracker.internetwarriors.net%3a1337%2fannounce&tr=udp%3a%2f%2ftracker.opentrackr.org%3a1337%2fannounce&tr=udp%3a%2f%2fexodus.desync.com%3a6969%2fannounce&tr=udp%3a%2f%2fopen.stealth.si%3a80%2fannounce&tr=udp%3a%2f%2fwww.torrent.eu.org%3a451%2fannounce
Escola de Magia Torrent (2022) Dual Áudio / Dublado WEB-DL 1080p – Download,Escola de Magia Torrent,MKV,"Português, Inglês","Animação,Aventura,Fantasia",2022,1h 29 Min.,3.3/10,":Aura tem habilidades mágicas. Ela e seus amigos vivem aventuras emocionantes na escola, mas não demora até ela aprender que o lugar guarda muitos segredos sombrios que precisam ser revelados. ",https://filmestorrents.site/wp-content/uploads/2022/04/Escola-de-Magia-filmestorrents-net.jpg,https://filmestorrents.site/escola-de-magia-torrent-2022-dual-audio-dublado-web-dl-1080p-download/#more-32761,magnet:?xt=urn:btih:1d40bbb066e3bfb68b5a249f9e25e8b03e752b71&dn=Escola%20de%20Magia%202020%201080p%20WEB-DL%20DUAL&tr=udp%3a%2f%2ftracker.openbittorrent.com%3a80%2fannounce&tr=udp%3a%2f%2ftracker.publicbt.com%3a80%2fannounce&tr=udp%3a%2f%2ftracker.internetwarriors.net%3a1337%2fannounce&tr=udp%3a%2f%2ftracker.opentrackr.org%3a1337%2fannounce&tr=udp%3a%2f%2fexodus.desync.com%3a6969%2fannounce&tr=udp%3a%2f%2fopen.stealth.si%3a80%2fannounce&tr=udp%3a%2f%2fwww.torrent.eu.org%3a451%2fannounce
Felix e o Tesouro de Morgan Torrent (2022) Dublado WEB-DL 1080p – Download,Felix e o Tesouro de Morgan Torrent,MKV,"Português, Francês","Animação,Aventura,Família",2022,1h 26 Min.,5.5/10,":Aproveitando a ausência da mãe para partir em um cruzeiro para descansar e relaxar, Félix, de 12 anos, sai em busca de seu pai, um pescador que desapareceu no mar dois anos antes. ",https://filmestorrents.site/wp-content/uploads/2022/04/Felix-e-o-Tesouro-de-Morgan-filmestorrents-net.jpg,https://filmestorrents.site/felix-e-o-tesouro-de-morgan-torrent-2022-dublado-web-dl-1080p-download/#more-32747,magnet:?xt=urn:btih:22732384f6e1de9788df0e9aef06711b3255f143&dn=Felix%20e%20o%20Tesouro%20de%20Morga%202021%201080p%20WEB-DL%20DUAL&tr=udp%3a%2f%2ftracker.openbittorrent.com%3a80%2fannounce&tr=udp%3a%2f%2ftracker.publicbt.com%3a80%2fannounce&tr=udp%3a%2f%2ftracker.internetwarriors.net%3a1337%2fannounce&tr=udp%3a%2f%2ftracker.opentrackr.org%3a1337%2fannounce&tr=udp%3a%2f%2fexodus.desync.com%3a6969%2fannounce&tr=udp%3a%2f%2fopen.stealth.si%3a80%2fannounce&tr=udp%3a%2f%2fwww.torrent.eu.org%3a451%2fannounce
Um Mundo Encantado Torrent (2022) Dublado WEB-DL 1080p – Download,Um Mundo Encantado Torrent,MKV,Português,"Aventura,Família",2022,1h 28 Min.,6.9/10,":Durante o fim de semana anual da família em um parque temático, Teun, de onze anos, descobre que seu avô recentemente falecido deixou para ele uma última caça ao tesouro dentro do parque. Teun embarca em uma expedição emocionante pelo parque com sua peculiar tia Ada para descobrir exatamente o que seu avô escondeu para ele. ",https://filmestorrents.site/wp-content/uploads/2022/04/Um-Mundo-Encantado-filmestorrents-net.jpg,https://filmestorrents.site/um-mundo-encantado-torrent-2022-dublado-web-dl-1080p-download/#more-32744,magnet:?xt=urn:btih:4f44de1786fdde20f0c0110a321b215425e0fd29&dn=Um%20Mundo%20Encantado%202020%201080p%20WEB-DL%20Dublado&tr=udp%3a%2f%2ftracker.openbittorrent.com%3a80%2fannounce&tr=udp%3a%2f%2ftracker.publicbt.com%3a80%2fannounce&tr=udp%3a%2f%2ftracker.internetwarriors.net%3a1337%2fannounce&tr=udp%3a%2f%2ftracker.opentrackr.org%3a1337%2fannounce&tr=udp%3a%2f%2fexodus.desync.com%3a6969%2fannounce&tr=udp%3a%2f%2fopen.stealth.si%3a80%2fannounce&tr=udp%3a%2f%2fwww.torrent.eu.org%3a451%2fannounce
Uma Missão de Fé Torrent (2022) Dual Áudio / Dublado WEB-DL 720p – Download,Uma Missao de Fe,MKV,"Português, Inglês","Drama,Suspense",2022,1h 31 Min.,4.1/10,":Um ex-policial começa a ter visões assustadoras e a ouvir vozes que acredita serem orações. Ele faz o possível para abafá-los, até que um grupo inesperado de novos amigos o ajuda a ouvir seu próprio chamado. ",https://filmestorrents.site/wp-content/uploads/2022/04/Uma-Missao-de-Fe-filmestorrents-net.jpg,https://filmestorrents.site/uma-missao-de-fe-torrent-2022-dual-audio-dublado-web-dl-720p-download/#more-32741,magnet:?xt=urn:btih:d5bd6adbf1799a806ddabd3637697e9e63c17261&dn=Uma%20Miss%c3%a3o%20de%20F%c3%a9%202020%20720p%20FULL%20DUAL&tr=udp%3a%2f%2ftracker.openbittorrent.com%3a80%2fannounce&tr=udp%3a%2f%2ftracker.publicbt.com%3a80%2fannounce&tr=udp%3a%2f%2ftracker.internetwarriors.net%3a1337%2fannounce&tr=udp%3a%2f%2ftracker.opentrackr.org%3a1337%2fannounce&tr=udp%3a%2f%2fexodus.desync.com%3a6969%2fannounce&tr=udp%3a%2f%2fopen.stealth.si%3a80%2fannounce&tr=udp%3a%2f%2fwww.torrent.eu.org%3a451%2fannounce
Procurando Fígaro Torrent (2022) Dual Áudio / Dublado WEB-DL 720p – Download,Procurando Figaro,MKV,"Português, Inglês","Comédia,Romance,Musical",2022,1h 44 Min.,6.4/10,":Descontente com seu emprego e seu namorado de longa-data, uma jovem (Danielle Macdonald) decide largar tudo e correr atrás de seu antigo sonho de virar cantora de ópera. ",https://filmestorrents.site/wp-content/uploads/2022/04/Procurando-Figaro-filmestorrents-net.jpg,https://filmestorrents.site/procurando-figaro-torrent-2022-dual-audio-dublado-web-dl-720p-download/#more-32722,magnet:?xt=urn:btih:587e8b699dd76bc9764c50837758320f95bf7acd&dn=Procurando%20F%c3%adgaro%202021%20720p%20WEB-DL%20DUAL&tr=udp%3a%2f%2ftracker.openbittorrent.com%3a80%2fannounce&tr=udp%3a%2f%2ftracker.publicbt.com%3a80%2fannounce&tr=udp%3a%2f%2ftracker.internetwarriors.net%3a1337%2fannounce&tr=udp%3a%2f%2ftracker.opentrackr.org%3a1337%2fannounce&tr=udp%3a%2f%2fexodus.desync.com%3a6969%2fannounce&tr=udp%3a%2f%2fopen.stealth.si%3a80%2fannounce&tr=udp%3a%2f%2fwww.torrent.eu.org%3a451%2fannounce
Pequena Mãe Torrent (2022) Dublado BluRay 1080p – Download,Pequena Mamae,MKV,"Português, Francês","Fantasia,Drama",2022,1h 12 Min.,7.4/10,":Nelly, de oito anos, acaba de perder sua amada avó e está ajudando seus pais a limpar a casa de sua mãe. Ela explora a casa e a floresta circundante onde sua mãe, Marion, costumava brincar e onde ela construiu a casa da árvore sobre a qual Nelly tanto ouviu falar. Um dia sua mãe vai embora de repente. É quando Nelly conhece uma garota da sua idade na floresta, construindo uma casa na árvore. O nome dela é Marion. ",https://filmestorrents.site/wp-content/uploads/2022/04/Pequena-Mae-filmestorrents-net.jpg,https://filmestorrents.site/pequena-mae-torrent-2022-dublado-bluray-1080p-download/#more-32719,magnet:?xt=urn:btih:94e5f305e1938524f8c6597e1fd3469525ab27d7&dn=Pequena%20Mam%c3%a3e%202021%201080p%20WEB-DL%20DUAL&tr=udp%3a%2f%2ftracker.openbittorrent.com%3a80%2fannounce&tr=udp%3a%2f%2ftracker.publicbt.com%3a80%2fannounce&tr=udp%3a%2f%2ftracker.internetwarriors.net%3a1337%2fannounce&tr=udp%3a%2f%2ftracker.opentrackr.org%3a1337%2fannounce&tr=udp%3a%2f%2fexodus.desync.com%3a6969%2fannounce&tr=udp%3a%2f%2fopen.stealth.si%3a80%2fannounce&tr=udp%3a%2f%2fwww.torrent.eu.org%3a451%2fannounce
O Cavalo dos Meus Sonhos Torrent (2022) Dual Áudio / Dublado BluRay 720p – Download,O Cavalo dos Meus Sonhos,MKV,"Português, Inglês","Comédia,Drama",2022,1h 26 Min.,6.9/10,":O filme conta a história real de Jan Vokes, (Toni Collette) uma faxineira e barman galesa, que decide criar e criar um cavalo de corrida. Ela convence seus vizinhos e amigos a contribuir financeiramente para a meta. O plano de investimento improvável do grupo dá frutos à medida que o cavalo sobe na hierarquia e os coloca em uma corrida pelo campeonato nacional. ",https://filmestorrents.site/wp-content/uploads/2022/04/O-Cavalo-dos-Meus-Sonhos-filmestorrents-net.jpg,https://filmestorrents.site/o-cavalo-dos-meus-sonhos-torrent-2022-dual-audio-dublado-bluray-720p-download/#more-32716,magnet:?xt=urn:btih:6914850e32ac3423053d032321545c1e7db40e36&dn=O%20Cavalo%20dos%20Meus%20Sonhos%202020%20720p%20WEB-DL%20DUAL&tr=udp%3a%2f%2ftracker.openbittorrent.com%3a80%2fannounce&tr=udp%3a%2f%2ftracker.publicbt.com%3a80%2fannounce&tr=udp%3a%2f%2ftracker.internetwarriors.net%3a1337%2fannounce&tr=udp%3a%2f%2ftracker.opentrackr.org%3a1337%2fannounce&tr=udp%3a%2f%2fexodus.desync.com%3a6969%2fannounce&tr=udp%3a%2f%2fopen.stealth.si%3a80%2fannounce&tr=udp%3a%2f%2fwww.torrent.eu.org%3a451%2fannounce
