标题名,影片名,格式,音频,属性,年份,时长,IMDB值,简介,影片海报,影片下载web_url,影片下载url之一
Agente Oculto Torrent (2022) Dual Áudio / Dublado WEB-DL 1080p – Download,Agente Oculto,MKV,"Português, Inglês","Ação,Suspense",2022,1h 36 Min.,5.9/10,":Na Europa, um agente da CIA que se tornou assassino tenta escapar de forças misteriosas enquanto tenta salvar a vida das filhas que não sabem que ele existe.",https://filmestorrents.site/wp-content/uploads/2022/07/Agente-Oculto-filmestorrents-net.jpg,https://filmestorrents.site/agente-oculto-torrent-2022-dual-audio-dublado-web-dl-1080p-download/#more-34613,magnet:?xt=urn:btih:ddeff26db6e7013221f5f6704aac704930b08f2f&dn=Agente%20Oculto%202022%201080p%20WEB-DL%20DUAL%205.1&tr=udp%3a%2f%2ftracker.openbittorrent.com%3a80%2fannounce&tr=udp%3a%2f%2ftracker.publicbt.com%3a80%2fannounce&tr=udp%3a%2f%2ftracker.internetwarriors.net%3a1337%2fannounce&tr=udp%3a%2f%2ftracker.opentrackr.org%3a1337%2fannounce&tr=udp%3a%2f%2fexodus.desync.com%3a6969%2fannounce&tr=udp%3a%2f%2fopen.stealth.si%3a80%2fannounce&tr=udp%3a%2f%2fwww.torrent.eu.org%3a451%2fannounce
O Último Dragão Torrent (2022) Dual Áudio / Dublado WEB-DL 1080p – Download,O Ultimo Dragao,MKV,"Português, Inglês","Ação,Fantasia",2022,1h 38 Min.,N/A/10,":Quando uma força malévola toma conta dos reinos de Agonos, um cavaleiro solitário deve embarcar numa perigosa busca para encontrar o último dragão e salvar o mundo deste grande e crescente mal. ",https://filmestorrents.site/wp-content/uploads/2022/07/O-Ultimo-Dragao-filmestorrents-net.jpg,https://filmestorrents.site/o-ultimo-dragao-torrent-2022-dual-audio-dublado-web-dl-1080p-download/#more-34574,magnet:?xt=urn:btih:754ff1107cc131cdd3f8776a5f8f97b1343f5972&dn=O%20%c3%9altimo%20Drag%c3%a3o%202022%201080p%20WEB-DL%20DUAL%205.1&tr=udp%3a%2f%2ftracker.openbittorrent.com%3a80%2fannounce&tr=udp%3a%2f%2ftracker.publicbt.com%3a80%2fannounce&tr=udp%3a%2f%2ftracker.internetwarriors.net%3a1337%2fannounce&tr=udp%3a%2f%2ftracker.opentrackr.org%3a1337%2fannounce&tr=udp%3a%2f%2fexodus.desync.com%3a6969%2fannounce&tr=udp%3a%2f%2fopen.stealth.si%3a80%2fannounce&tr=udp%3a%2f%2fwww.torrent.eu.org%3a451%2fannounce
Thor: Amor e Trovão Torrent (2022) Dual Áudio / Dublado HDCAM 1080p – Download,Thor Amor e Trovao,MKV,Português / Inglês,"Ação,Aventura,Comédia",2022,1h 59 Min.,N/A/10,"Thor parte em uma jornada diferente de tudo que já enfrentou – uma busca pela paz interior. Mas sua aposentadoria é interrompida por um assassino galáctico conhecido como Gorr, o Carniceiro de Deus, que busca a extinção dos deuses. Para combater a ameaça, Thor pede a ajuda do Rei Valquíria, Korg e da ex-namorada Jane Foster, que – para surpresa de Thor – inexplicavelmente empunha seu martelo mágico, Mjolnir, como o Poderoso Thor. Juntos, eles embarcam em uma angustiante aventura cósmica para descobrir o mistério da vingança do God Butcher e detê-lo antes que seja tarde demais.",https://filmestorrents.site/wp-content/uploads/2022/07/Thor-Amor-e-Trovao-filmestorrents-net-1.jpg,https://filmestorrents.site/thor-amor-e-trovao-torrent-2022-dual-audio-dublado-hdcam-1080p-download/#more-34550,magnet:?xt=urn:btih:6A3859E6D4A925E4C0499489484A44BD1C317AE7&dn=Thor.Love.and.Thunder.2022.720p.HDCAM.Dublado.mkv&tr=udp%3a%2f%2ftracker.openbittorrent.com%3a80%2fannounce&tr=udp%3a%2f%2ftracker.opentrackr.org%3a1337%2fannounce
Jurassic World: Domínio Torrent (2022) Dual Áudio / Dublado WEB-DL 1080p – Download,Jurassic World Dominio,MKV,Português | Inglês,"Ação,Aventura,Ficção",2022,2h 26 Min.,6.0/10,":Quatro anos após a destruição da Ilha Nublar, os dinossauros agora vivem – e caçam – ao lado de humanos em todo o mundo. Esse frágil equilíbrio remodelará o futuro e determinará, de uma vez por todas, se os seres humanos continuarão sendo os principais predadores em um planeta que agora compartilham com as criaturas mais temíveis da história.",https://filmestorrents.site/wp-content/uploads/2022/07/Jurassic-World-Dominio-filmestorrents-net-1.jpg,https://filmestorrents.site/jurassic-world-dominio-torrent-2022-dual-audio-dublado-web-dl-1080p-download/#more-34455,magnet:?xt=urn:btih:3fb51471312e4fa98c0ddeb8311da2aa9fb5c08f&dn=Jurassic%20World%20-%20Dom%c3%adnio%202022%201080p%20WEB-DL%20DUAL%205.1&tr=udp%3a%2f%2ftracker.openbittorrent.com%3a80%2fannounce&tr=udp%3a%2f%2ftracker.publicbt.com%3a80%2fannounce&tr=udp%3a%2f%2ftracker.internetwarriors.net%3a1337%2fannounce&tr=udp%3a%2f%2ftracker.opentrackr.org%3a1337%2fannounce&tr=udp%3a%2f%2fexodus.desync.com%3a6969%2fannounce&tr=udp%3a%2f%2fopen.stealth.si%3a80%2fannounce&tr=udp%3a%2f%2fwww.torrent.eu.org%3a451%2fannounce
Lightyear Torrent (2022) Dual Áudio / Dublado WEB-DL 720p & 1080p & 4K – Download,Lightyear,MKV,"Português, Inglês","Animação,Ação,Aventura,Ficção",2022,1h 47 Min.,5.2/10,A aventura de ação e ficção científica apresenta a história de origem definitiva de Buzz Lightyear – o herói que inspirou o brinquedo – apresentando o lendário Space Ranger que conquistaria gerações de fãs.,https://filmestorrents.site/wp-content/uploads/2022/07/Lightyear-filmestorrents-net.jpg,https://filmestorrents.site/lightyear-torrent-2022-dual-audio-dublado-web-dl-720p-1080p-4k-download/#more-34447,magnet:?xt=urn:btih:CD26EC171192F25069FC3C685E73B59DCDEE033E&dn=Lightyear.2022.720p.CAMRip.Dublado.mkv&tr=udp%3a%2f%2ftracker.openbittorrent.com%3a80%2fannounce&tr=udp%3a%2f%2ftracker.opentrackr.org%3a1337%2fannounce&tr=http%3a%2f%2ftrax.corbina.net%3a6969%2fannounce
Ms. Marvel 1ª Temporada Torrent Dual Áudio / Dublado WEB-DL 720p & 1080p & 4K – Download,Ms. Marvel,MKV,"Português, Inglês","Ação,Comédia,Aventura",2022,50 Min./Ep.,6.1/10,":Kamala Khan é uma adolescente muçulmana de Jersey City. Ela adora jogar videogames e escrever fanfictions, além de ser fã de super-heróis e ter uma imaginação sem limites – especialmente quando se trata da Capitã Marvel. Kamala sente que não se encaixa na escola e, às vezes, nem mesmo em casa. Mas um dia ela descobre que tem superpoderes como os heróis que sempre admirou… e a vida fica bem melhor com superpoderes, não é? ",https://filmestorrents.site/wp-content/uploads/2022/06/Ms.-Marvel-filmestorrents-net.jpg,https://filmestorrents.site/ms-marvel-1a-temporada-torrent-dual-audio-dublado-web-dl-720p-1080p-4k-download/#more-33874,magnet:?xt=urn:btih:c6a331ba3407a88f6b7c36f0b42fe0c3c070d4e2&dn=Ms.Marvel.S01E01.1080p.WEB.DUAL&tr=udp%3a%2f%2ftracker.openbittorrent.com%3a80%2fannounce&tr=udp%3a%2f%2ftracker.publicbt.com%3a80%2fannounce&tr=udp%3a%2f%2ftracker.internetwarriors.net%3a1337%2fannounce&tr=udp%3a%2f%2ftracker.opentrackr.org%3a1337%2fannounce&tr=udp%3a%2f%2fexodus.desync.com%3a6969%2fannounce&tr=udp%3a%2f%2fopen.stealth.si%3a80%2fannounce&tr=udp%3a%2f%2fwww.torrent.eu.org%3a451%2fannounce
Bob’s Burger: O Filme Torrent (2022) Dual Áudio / Dublado BluRay 1080p – Download,Bobs Burger O Filme,MKV,"Português, Inglês","Animação,Aventura,Comédia",2022,1h 42 Min.,7.4/10,":Um cano rompido cria um buraco em frente ao Bob’s Burgers, bloqueando a entrada e arruinando os planos de um verão bem-sucedido. Enquanto Bob e Linda lutam para manter o negócio, as crianças tentam resolver um mistério que pode salvar o restaurante da família. Os perigos aumentam, e eles se ajudam, lutando para voltar para trás do balcão.",https://filmestorrents.site/wp-content/uploads/2022/07/Bobs-Burger-O-Filme-filmestorrents-net.jpg,https://filmestorrents.site/bobs-burger-o-filme-torrent-2022-dual-audio-dublado-bluray-1080p-download/#more-34382,magnet:?xt=urn:btih:ff9d63ed406b6dab8df0d6171b7d6556cad8c6c4&dn=Bob%27s%20Burger%20-%20O%20Filme%202022%201080p%20BluRay%20DUAL%205.1&tr=udp%3a%2f%2ftracker.openbittorrent.com%3a80%2fannounce&tr=udp%3a%2f%2ftracker.publicbt.com%3a80%2fannounce&tr=udp%3a%2f%2ftracker.internetwarriors.net%3a1337%2fannounce&tr=udp%3a%2f%2ftracker.opentrackr.org%3a1337%2fannounce&tr=udp%3a%2f%2fexodus.desync.com%3a6969%2fannounce&tr=udp%3a%2f%2fopen.stealth.si%3a80%2fannounce&tr=udp%3a%2f%2fwww.torrent.eu.org%3a451%2fannounce
The Boys 3ª Temporada Torrent Dual Áudio / Dublado WEB-DL 720p & 1080p – Download,The Boys,MKV,"Português, Inglês","Ação,Comédia,Crime",2022,55 Min.,8.7/10,":Na trama, conhecemos um mundo em que super-heróis são as maiores celebridades do planeta, e rotineiramente abusam dos seus poderes ao invés de os usarem para o bem.",https://filmestorrents.site/wp-content/uploads/2022/06/The-Boys-filmestorrents-net.jpg,https://filmestorrents.site/the-boys-3a-temporada-torrent-dual-audio-dublado-web-dl-720p-1080p-download/#more-33782,magnet:?xt=urn:btih:fd434b69dfdd923f9b4a2296f3d2b20e589c84e0&dn=The.Boys.S03E01-02-03.1080p.WEB-DL.DUAL&tr=udp%3a%2f%2ftracker.openbittorrent.com%3a80%2fannounce&tr=udp%3a%2f%2ftracker.publicbt.com%3a80%2fannounce&tr=udp%3a%2f%2ftracker.internetwarriors.net%3a1337%2fannounce&tr=udp%3a%2f%2ftracker.opentrackr.org%3a1337%2fannounce&tr=udp%3a%2f%2fexodus.desync.com%3a6969%2fannounce&tr=udp%3a%2f%2fopen.stealth.si%3a80%2fannounce&tr=udp%3a%2f%2fwww.torrent.eu.org%3a451%2fannounce
A Fera do Mar Torrent (2022) Dual Áudio / Dublado WEB-DL 1080p – Download,A Fera do Mar,MKV,"Português, Inglês","Animação,Aventura,Comédia",2022,1h 55 Min.,6.3/10,:A vida de um caçador de monstros marinhos vira de cabeça para baixo depois que uma menina se esconde em seu navio.,https://filmestorrents.site/wp-content/uploads/2022/07/A-Fera-do-Mar-filmestorrents-net.jpg,https://filmestorrents.site/a-fera-do-mar-torrent-2022-dual-audio-dublado-web-dl-1080p-download/#more-34320,magnet:?xt=urn:btih:d10bce312fa90d64dd5e7c8e1c93b22079968361&dn=A%20Fera%20do%20Mar%202022%201080p%20WEB-DL%20DUAL%205.1&tr=udp%3a%2f%2ftracker.openbittorrent.com%3a80%2fannounce&tr=udp%3a%2f%2ftracker.publicbt.com%3a80%2fannounce&tr=udp%3a%2f%2ftracker.internetwarriors.net%3a1337%2fannounce&tr=udp%3a%2f%2ftracker.opentrackr.org%3a1337%2fannounce&tr=udp%3a%2f%2fexodus.desync.com%3a6969%2fannounce&tr=udp%3a%2f%2fopen.stealth.si%3a80%2fannounce&tr=udp%3a%2f%2fwww.torrent.eu.org%3a451%2fannounce
A Princesa Torrent (2022) Dual Áudio / Dublado WEB-DL 1080p & 4K – Download,A Princesa,MKV,"Português, Inglês","Ação,Drama,Fantasia",2022,1h 34 Min.,N/A/10,":Quando uma princesa bela e determinada se recusa a se casar com o cruel sociopata para quem está prometida, ela é sequestrada e trancada em uma torre remota no castelo de seu pai. Com seu pretendente desprezado e vingativo querendo tomar o trono, a princesa deve proteger sua família e salvar o reino, custe o que custar.",https://filmestorrents.site/wp-content/uploads/2022/07/A-Princesa-filmestorrents-net.jpg,https://filmestorrents.site/a-princesa-torrent-2022-dual-audio-dublado-web-dl-1080p-4k-download/#more-34237,magnet:?xt=urn:btih:8c87850f08fa631e45fd55efc8290788f7007f93&dn=A%20Princesa%202022%201080p%20WEB-DL%20DUAL%205.1&tr=udp%3a%2f%2ftracker.openbittorrent.com%3a80%2fannounce&tr=udp%3a%2f%2ftracker.publicbt.com%3a80%2fannounce&tr=udp%3a%2f%2ftracker.internetwarriors.net%3a1337%2fannounce&tr=udp%3a%2f%2ftracker.opentrackr.org%3a1337%2fannounce&tr=udp%3a%2f%2fexodus.desync.com%3a6969%2fannounce&tr=udp%3a%2f%2fopen.stealth.si%3a80%2fannounce&tr=udp%3a%2f%2fwww.torrent.eu.org%3a451%2fannounce
Ted K Torrent (2022) Dual Áudio / Dublado BluRay – Download,Unabomber Terrorista,MKV,"Português, Inglês","Drama,Crime,Suspense",2022,2h 00 Min.,6.0/10,":Uma exploração da vida de Ted Kaczynski em Lincoln, Montana, nos anos que antecederam sua prisão como O Unabomber (codinome). ",https://filmestorrents.site/wp-content/uploads/2022/06/Ted-K-filmestorrents-net.jpg,https://filmestorrents.site/ted-k-torrent-2022-dual-audio-dublado-bluray-download/#more-34213,magnet:?xt=urn:btih:e1321eeef862e1e37f56c20043ae1202779e1c43&dn=Unabomber%20Terrorista%202022%201080p%20BluRay%20DUAL&tr=udp%3a%2f%2ftracker.openbittorrent.com%3a80%2fannounce&tr=udp%3a%2f%2ftracker.publicbt.com%3a80%2fannounce&tr=udp%3a%2f%2ftracker.internetwarriors.net%3a1337%2fannounce&tr=udp%3a%2f%2ftracker.opentrackr.org%3a1337%2fannounce&tr=udp%3a%2f%2fexodus.desync.com%3a6969%2fannounce&tr=udp%3a%2f%2fopen.stealth.si%3a80%2fannounce&tr=udp%3a%2f%2fwww.torrent.eu.org%3a451%2fannounce
Doutor Estranho no Multiverso da Loucura Torrent IMAX (2022) Dual Áudio / Dublado WEB-DL 720p & 1080p & 4K – Download,Doutor Estranho no Multiverso da Loucura,MKV,"Português, Inglês","Ação,Aventura,Fantasia",2022,2h 06 Min.,7.3/10,":Doutor Estranho, com a ajuda de aliados místicos antigos e novos, atravessa as perigosas realidades alternativas e alucinantes do Multiverso para enfrentar um novo adversário misterioso.",https://filmestorrents.site/wp-content/uploads/2022/06/Doutor-Estranho-no-Multiverso-da-Loucura-filmestorrents-net.jpg,https://filmestorrents.site/doutor-estranho-no-multiverso-da-loucura-torrent-2022-dual-audio-dublado-web-dl-720p-1080p-4k-download/#more-34099,magnet:?xt=urn:btih:a778472b4edda562a29d602fb763904d24c74c45&dn=Doutor%20Estranho%20no%20Multiverso%20da%20Loucura%202022%201080p%20WEB-DL%20DUAL%205.1&tr=udp%3a%2f%2ftracker.openbittorrent.com%3a80%2fannounce&tr=udp%3a%2f%2ftracker.publicbt.com%3a80%2fannounce&tr=udp%3a%2f%2ftracker.internetwarriors.net%3a1337%2fannounce&tr=udp%3a%2f%2ftracker.opentrackr.org%3a1337%2fannounce&tr=udp%3a%2f%2fexodus.desync.com%3a6969%2fannounce&tr=udp%3a%2f%2fopen.stealth.si%3a80%2fannounce&tr=udp%3a%2f%2fwww.torrent.eu.org%3a451%2fannounce
O Homem do Norte Torrent (2022) Dual Áudio / Dublado BluRay – Download,O Homem do Norte,MKV,"Português, Inglês","Ação,Aventura,Drama",2022,2h 17 Min.,7.5/10,":Baseado na obra de Shakespeare, Hamlet, e na lenda viking de Amelth. No ano de 914, o príncipe Amleth (Alexander Skarsgård) testemunha o brutal assassinato de seu pai, Horvendill (Ethan Hawke) por seu tio, Fjölnir (Claes Bang). O menino foge mas jura que voltará para vingar seu pai, salvar sua mãe e matar seu tio. Vinte anos depois conhece uma vidente que o lembra que é chegada a hora de cumprir sua promessa.",https://filmestorrents.site/wp-content/uploads/2022/06/O-Homem-do-Norte-filmestorrents-net.jpg,https://filmestorrents.site/o-homem-do-norte-torrent-2022-dual-audio-dublado-bluray-download/#more-33779,magnet:?xt=urn:btih:f57e39710c20c02f21f1ac0ce1ddad26d11161c8&dn=O%20Homem%20do%20Norte%202022%201080p%20BluRay%20DUAL%205.1&tr=udp%3a%2f%2ftracker.openbittorrent.com%3a80%2fannounce&tr=udp%3a%2f%2ftracker.publicbt.com%3a80%2fannounce&tr=udp%3a%2f%2ftracker.internetwarriors.net%3a1337%2fannounce&tr=udp%3a%2f%2ftracker.opentrackr.org%3a1337%2fannounce&tr=udp%3a%2f%2fexodus.desync.com%3a6969%2fannounce&tr=udp%3a%2f%2fopen.stealth.si%3a80%2fannounce&tr=udp%3a%2f%2fwww.torrent.eu.org%3a451%2fannounce
100 Dias para o Natal Torrent (2022) Dual Áudio / Dublado WEB-DL 720p – Download,100 Dias para o Natal,MKV,"Português, Inglês","Comédia,Romance,Musical",2022,2h 10 Min.,5.5/10,":Uma boy band do momento procura por um hit natalino e se depara com uma música escrita pelo baixista de uma banda de metal. Tudo dá errado quando a banda de metal também quer a música, já que ela foi escrita originalmente para a sobrinha do baixista que está hospitalizada. ",https://filmestorrents.site/wp-content/uploads/2022/07/100-Dias-para-o-Natal-filmestorrents-net.jpg,https://filmestorrents.site/100-dias-para-o-natal-torrent-2022-dual-audio-dublado-web-dl-720p-download/#more-34610,magnet:?xt=urn:btih:219a827dd0d88560bab0717f5362e450c18f9084&dn=100%20Dias%20para%20o%20Natal%202021%20720p%20WEB-DL%20DUAL&tr=udp%3a%2f%2ftracker.openbittorrent.com%3a80%2fannounce&tr=udp%3a%2f%2ftracker.publicbt.com%3a80%2fannounce&tr=udp%3a%2f%2ftracker.internetwarriors.net%3a1337%2fannounce&tr=udp%3a%2f%2ftracker.opentrackr.org%3a1337%2fannounce&tr=udp%3a%2f%2fexodus.desync.com%3a6969%2fannounce&tr=udp%3a%2f%2fopen.stealth.si%3a80%2fannounce&tr=udp%3a%2f%2fwww.torrent.eu.org%3a451%2fannounce
Passagem Secreta Torrent (2022) Dublado WEB-DL 720p – Download,Passagem Secreta,MP4,Português,"Aventura,Família,Fantasia,Ficçãocientífica",2022,1h 35 Min.,5.2/10,":Alice é obrigada a se mudar sozinha para uma pequena cidade, onde encontra um novo grupo de amigos. Ao invadir um parque de diversões para resgatar um dos seus colegas, Alice descobre segredos sobre a sua identidade e precisa fazer escolhas. ",https://filmestorrents.site/wp-content/uploads/2022/07/Passagem-Secreta-filmestorrents-net.jpg,https://filmestorrents.site/passagem-secreta-torrent-2022-dublado-web-dl-720p-download/#more-34607,magnet:?xt=urn:btih:c4b2a2aa90d8b41bd5261679763065add604d8a2&dn=Passagem%20Secreta%202021%20720p%20WEB-DL%20NACIONAL&tr=udp%3a%2f%2ftracker.openbittorrent.com%3a80%2fannounce&tr=udp%3a%2f%2ftracker.publicbt.com%3a80%2fannounce&tr=udp%3a%2f%2ftracker.internetwarriors.net%3a1337%2fannounce&tr=udp%3a%2f%2ftracker.opentrackr.org%3a1337%2fannounce&tr=udp%3a%2f%2fexodus.desync.com%3a6969%2fannounce&tr=udp%3a%2f%2fopen.stealth.si%3a80%2fannounce&tr=udp%3a%2f%2fwww.torrent.eu.org%3a451%2fannounce
The Rookie 4ª Temporada Torrent (2021) Dual Áudio / Legendado WEB-DL 720p | 1080p – Download,The Rookie,MKV,"Português, Inglês","Crime,Drama",2022,42Min.,8.0/10,":John Nolan, de 40 anos, muda sua vida para ser um agente policial no Departamento de Polícia de Los Angeles. ",https://filmestorrents.site/wp-content/uploads/2021/09/The-Rookie-4a-Temporada-Torrent-200x300.jpg,https://filmestorrents.site/the-rookie-4a-temporada-torrent-2021-dual-audio-legendado-web-dl-720p-1080p-download/#more-28868,magnet:?xt=urn:btih:17c7bab25aeae2d261fbd4f61fbeaf0d22a6cca5&dn=The.Rookie.S04e01-02.720p.WEB-DL.DUBLADO&tr=udp%3a%2f%2ftracker.openbittorrent.com%3a80%2fannounce&tr=udp%3a%2f%2ftracker.publicbt.com%3a80%2fannounce&tr=udp%3a%2f%2ftracker.internetwarriors.net%3a1337%2fannounce&tr=udp%3a%2f%2ftracker.opentrackr.org%3a1337%2fannounce&tr=udp%3a%2f%2fexodus.desync.com%3a6969%2fannounce&tr=udp%3a%2f%2fopen.stealth.si%3a80%2fannounce&tr=udp%3a%2f%2fwww.torrent.eu.org%3a451%2fannounce
My Unfamiliar Family 1ª Temporada Torrent Legendado WEB-DL 1080p – Download,My Unfamiliar Family,MKV,Coreano,Drama,2022,70 Min./ Ep.,7.8/10,:Uma família que se afastou ao longo dos anos tenta reatar os laços enquanto enfrenta obstáculos da vida. ,https://filmestorrents.site/wp-content/uploads/2022/07/My-Unfamiliar-Family-filmestorrents-net.jpg,https://filmestorrents.site/my-unfamiliar-family-1a-temporada-torrent-legendado-web-dl-1080p-download/#more-34603,magnet:?xt=urn:btih:0bc22205ebe6017d7e8c9a61ee00c88729159e84&dn=My.Unfamiliar.Family.S01.KOREAN.1080p.NF.WEBRip.AAC2.0.x264-KHN%5Brartv%5D&tr=http%3A%2F%2Ftracker.trackerfix.com%3A80%2Fannounce&tr=udp%3A%2F%2F9.rarbg.me%3A2800&tr=udp%3A%2F%2F9.rarbg.to%3A2930&tr=udp%3A%2F%2Ftracker.slowcheetah.org%3A14730&tr=udp%3A%2F%2Ftracker.fatkhoala.org%3A13780
The Old Man 1ª Temporada Torrent Legendado WEB-DL 720p & 1080p – Download,The Old Man,MKV,Inglês,"Ação,Drama,Suspense",2022,60 min.,8.5/10,":Um ex-agente da CIA, que vive fora da rede, se vê fugindo de pessoas que querem matá-lo. ",https://filmestorrents.site/wp-content/uploads/2022/06/The-Old-Man-filmestorrents-net.jpg,https://filmestorrents.site/the-old-man-1a-temporada-torrent-legendado-web-dl-720p-1080p-download/#more-34045,magnet:?xt=urn:btih:ccf29176c633ac5ce9a753936b9dbeac7eae89df&dn=The.Old.Man.S01E01.I.720p.AMZN.WEBRip.DDP5.1.x264-NTb%5Brartv%5D&tr=http%3A%2F%2Ftracker.trackerfix.com%3A80%2Fannounce&tr=udp%3A%2F%2F9.rarbg.me%3A2990&tr=udp%3A%2F%2F9.rarbg.to%3A2980&tr=udp%3A%2F%2Ftracker.fatkhoala.org%3A13710&tr=udp%3A%2F%2Ftracker.tallpenguin.org%3A15750
Mayans M.C. 4ª Temporada Torrent Dual Áudio / Dublado WEB-DL 720p & 1080p – Download,Mayans M.C.,MKV,"Português, Inglês","Crime,Drama,Suspense",2022,42 Min.,7.5/10,":Ezekiel “EZ” Reyes deixa a prisão e logo se envolve com o negócio dos Mayans M.C., na fronteira do México com a Califórnia. Agora, ele deve criar uma identidade do zero. ",https://filmestorrents.site/wp-content/uploads/2022/04/Mayans-M.C.-filmestorrents-net.jpg,https://filmestorrents.site/mayans-m-c-4a-temporada-torrent-dual-audio-dublado-web-dl-720p-1080p-download/#more-32995,magnet:?xt=urn:btih:063b5d642253f011cf35df540d8beb6b68359b1f&dn=Mayans.M.C.S04.720p.AMZN.WEBRip.DDP5.1.x264-NTb%5Brartv%5D&tr=http%3A%2F%2Ftracker.trackerfix.com%3A80%2Fannounce&tr=udp%3A%2F%2F9.rarbg.me%3A2730&tr=udp%3A%2F%2F9.rarbg.to%3A2950&tr=udp%3A%2F%2Ftracker.slowcheetah.org%3A14800&tr=udp%3A%2F%2Ftracker.fatkhoala.org%3A13720
Irma Vep 1ª Temporada Torrent Dual Áudio / Dublado WEB-DL 720p | 1080p – Download,Irma Vep,MKV,"Português, Inglês","Comédia,Drama",2022,50 Min.,6.4/10,":Mira, uma estrela de cinema que está desiludida com sua carreira e acaba de passar por um término, vai para a França estrelar “Irma Vep”, um remake de “Les Vampires”, um clássico do cinema mudo francês. ",https://filmestorrents.site/wp-content/uploads/2022/06/Irma-Vep-filmestorrents-net.jpg,https://filmestorrents.site/irma-vep-1a-temporada-torrent-dual-audio-dublado-web-dl-720p-1080p-download/#more-33827,magnet:?xt=urn:btih:4702328bc0e9fe5ce69eecb3b6c363cb7ffd8095&dn=Irma.Vep.S01E01.720p.WEB-DL.DUAL&tr=udp%3a%2f%2ftracker.openbittorrent.com%3a80%2fannounce&tr=udp%3a%2f%2ftracker.publicbt.com%3a80%2fannounce&tr=udp%3a%2f%2ftracker.internetwarriors.net%3a1337%2fannounce&tr=udp%3a%2f%2ftracker.opentrackr.org%3a1337%2fannounce&tr=udp%3a%2f%2fexodus.desync.com%3a6969%2fannounce&tr=udp%3a%2f%2fopen.stealth.si%3a80%2fannounce&tr=udp%3a%2f%2fwww.torrent.eu.org%3a451%2fannounce
The Orville 3ª Temporada Torrent Dual Áudio / Dublado WEB-DL 720p & 1080p – Download,The Orville,MKV,"Português, Inglês","Aventura,Comédia,Drama",2022,42 min./ EP.,8.0/10,":Ed Grayson (Seth MacFarlane), que acaba de enfrentar um divórcio, assume a missão de comandar a nave exploratório Orville, e vê neste trabalho a chance de recomeçar sua vida. O capitão começa a montar uma equipe tão bem preparada quanto excêntrica, e é aí que descobre que uma das tripulantes será sua ex-esposa Kelly Grayson (Adrianne Palicki). Agora, não importa suas desavenças, juntos eles precisam aprender a conviver no espaço. ",https://filmestorrents.site/wp-content/uploads/2022/06/The-Orville-filmestorrents-net.jpg,https://filmestorrents.site/the-orville-3a-temporada-torrent-dual-audio-dublado-web-dl-720p-1080p-download/#more-33744,magnet:?xt=urn:btih:db9e76e421434c6e8c6aee3e5360efe530e774de&dn=The.Orville.S03E01.WEB-DL.1080p.DUAL&tr=udp%3a%2f%2ftracker.openbittorrent.com%3a80%2fannounce&tr=udp%3a%2f%2ftracker.publicbt.com%3a80%2fannounce&tr=udp%3a%2f%2ftracker.internetwarriors.net%3a1337%2fannounce&tr=udp%3a%2f%2ftracker.opentrackr.org%3a1337%2fannounce&tr=udp%3a%2f%2fexodus.desync.com%3a6969%2fannounce&tr=udp%3a%2f%2fopen.stealth.si%3a80%2fannounce&tr=udp%3a%2f%2fwww.torrent.eu.org%3a451%2fannounce
American Horror Stories 2ª Temporada Torrent Legendado WEB-DL 720p & 1080p – Download,American Horror Stories,MKV,Inglês,"Drama,Suspense,Terror",2022,45 Min.,6.1/10,":Uma série de antologias de episódios autônomos que investigam mitos, lendas e tradições de terror. ",https://filmestorrents.site/wp-content/uploads/2022/07/American-Horror-Stories-filmestorrents-net.jpg,https://filmestorrents.site/american-horror-stories-2a-temporada-torrent-legendado-web-dl-720p-1080p-download/#more-34596,magnet:?xt=urn:btih:0387045f784393a2018d2b7b87171f12614db591&dn=American.Horror.Stories.S02E01.720p.WEB.H264-CAKES%5Brartv%5D&tr=http%3A%2F%2Ftracker.trackerfix.com%3A80%2Fannounce&tr=udp%3A%2F%2F9.rarbg.me%3A2980&tr=udp%3A%2F%2F9.rarbg.to%3A2810&tr=udp%3A%2F%2Ftracker.slowcheetah.org%3A14770&tr=udp%3A%2F%2Ftracker.fatkhoala.org%3A13780
Turma da Mônica – A Série 1ª Temporada Torrent Dublado WEB-DL 1080p – Download,Turma da Monica – A Serie,MKV,Português,"Aventura,Família,Comédia",2022,35 Min./Ep.,7.6/10,":Quando a festa da popular Carminha Frufru é misteriosamente sabotada, Mônica e seus amigos se tornam os principais suspeitos, e vão precisar superar suas inseguranças e revelar seus segredos para decifrar o mistério. ",https://filmestorrents.site/wp-content/uploads/2022/07/Turma-da-Monica-A-Serie-filmestorrents-net.jpg,https://filmestorrents.site/turma-da-monica-a-serie-1a-temporada-torrent-dublado-web-dl-1080p-download/#more-34593,magnet:?xt=urn:btih:abb3bb731af326884c1042d00b1a00ff976c5094&dn=Turma%20da%20M%c3%b4nica%20%e2%80%93%20A%20S%c3%a9rie%201%c2%aa%20Temporada%202022%201080p%20WEB-DL%20NACIONAL&tr=udp%3a%2f%2ftracker.openbittorrent.com%3a80%2fannounce&tr=udp%3a%2f%2ftracker.publicbt.com%3a80%2fannounce&tr=udp%3a%2f%2ftracker.internetwarriors.net%3a1337%2fannounce&tr=udp%3a%2f%2ftracker.opentrackr.org%3a1337%2fannounce&tr=udp%3a%2f%2fexodus.desync.com%3a6969%2fannounce&tr=udp%3a%2f%2fopen.stealth.si%3a80%2fannounce&tr=udp%3a%2f%2fwww.torrent.eu.org%3a451%2fannounce
