title,author_name,url
留下来，吃了饭再走吧,Uncle邓不馋,https://www.bilibili.com/video/BV1AY41167iT
一打五反杀四个，这项羽太无敌了吧！,王者小灰白,https://www.bilibili.com/video/BV1iT411i7bz
特殊球形，台球教学。,工道台球杆于志超,https://www.bilibili.com/video/BV1oX4y1D7ii
您以前见过这种技术吗？,豪饮一杯醉,https://www.bilibili.com/video/BV1724y1G7w3
张得美叫上亲爹同框演出，超管送出封禁套餐，原因：嘴不正常,学习屋小桃,https://www.bilibili.com/video/BV1354y1u7MT
假如美缝师傅说真话,阿亮设计师,https://www.bilibili.com/video/BV1CY4y1C7bD
3月5日，山西长治，闺女从河北转校来到山西，疑惑老师都叫我“狗儿”,民声面对面,https://www.bilibili.com/video/BV1EM41147Bz
游戏是上午玩的，人是下午走的！！,云顶小白,https://www.bilibili.com/video/BV1Hj41137N5
太监吞入48颗珍珠，法师一瓶油令他拉了出来,趣闻分享君,https://www.bilibili.com/video/BV1624y1t7YE
人生有百味，深夜请慢用,蜡笔小森美食收藏,https://www.bilibili.com/video/BV1tL41117Vi
避雷针顶上吃火锅，哪个外卖员敢送,泪点爱情观,https://www.bilibili.com/video/BV16N411F7iW
欢迎报考温州大学，这一晚12,b站美食频道,https://www.bilibili.com/video/BV1vx4y1K7Vn
王者荣耀代练/晋级钻石后需要注意点什么,阿信手游电竞,https://www.bilibili.com/video/BV1b84y1K7m1
历年学校最变态的表白墙,今晚也要加油吖,https://www.bilibili.com/video/BV1zv4y1b7Fz
王者代练/阿骨朵体系一天能上50颗星吗？,阿鑫代打工作室,https://www.bilibili.com/video/BV1Cs4y1L7rc
非常“自然”的艺术？Robert Comploj 当代玻璃艺术家,一间艺术店,https://www.bilibili.com/video/BV1uT411e7Ph
3月5日，四川成都。一音乐工作室门口，小朋友们辛苦做的纸风车，被路过一群女子全部拔光。 你对这行为怎么看？,中国网直播,https://www.bilibili.com/video/BV1w8411c7b9
帝君大人这么做一定有他的深意,小心超人o_O,https://www.bilibili.com/video/BV1rT411Y7zC
走街串巷几十年，现在还能见到吗,浩哥观天下,https://www.bilibili.com/video/BV1HT411e7Mb
工地玩笑,风终将抚去,https://www.bilibili.com/video/BV1wT411q7Jc
一种很新的蛋包饭_(:з」∠)_,光焰Fire,https://www.bilibili.com/video/BV1x54y1w7sb
只需一掌马上开席,自由侠天使,https://www.bilibili.com/video/BV1do4y1r75P
我滴妈还能伸缩，太酷了,小叮当嘀百宝箱,https://www.bilibili.com/video/BV1Cx4y1K7pP
一波灵活操作太秀了吧 这是大神级选手,舞者HR浩然,https://www.bilibili.com/video/BV1ho4y1r7wa
14岁的女儿被21岁二次元约出去，这能忍？,今天不够可爱捏,https://www.bilibili.com/video/BV1PL41127WH
这就是刀哥虎爷一生忠其一人  高启强的人格魅力！,云路深,https://www.bilibili.com/video/BV1SN411c7aH
“放贷不还就见红，我是刀哥唐小龙”,唐老鸭剪辑,https://www.bilibili.com/video/BV1RA411B7MJ
刀哥：我见了他都吓得退了两步,俊孩玄晔,https://www.bilibili.com/video/BV14e4y1w7qC
刀哥的压迫感 我已经喘不上来气了,云路深,https://www.bilibili.com/video/BV1fj41137i4
刀哥锐评面具人嘉然圈钱生日宴,最love的二刺螈,https://www.bilibili.com/video/BV1hN411F7yZ
一分钟速通《狂飙》,纳兰德仁,https://www.bilibili.com/video/BV1mv4y1h76g
好消息劈了五个，坏消息一个没死,尴尬的铁根er,https://www.bilibili.com/video/BV1LA41127Mf
一个月下来这猫痩3斤,云淡风也轻o,https://www.bilibili.com/video/BV1gN411c7M5
这小猫咪也太热情了,贝儿酱Miki,https://www.bilibili.com/video/BV1QM4y1d7R1
第80集｜海绵宝宝之可怕的老渔夫,吃海参的小可耐,https://www.bilibili.com/video/BV1m24y137nS
规则:让图变得“核理”,吃饭的大鹅,https://www.bilibili.com/video/BV1eN411c7Xz
在直播间给“家人们 ”讲物理，开播7天围观人数超40万，82岁退休教师入选感动中国年度人物,掌上济宁,https://www.bilibili.com/video/BV1kL41117FF
神奇的斐波那契时钟。,财经网科技频道,https://www.bilibili.com/video/BV11L41117SW
魔鬼辣椒小米椒打汁，肥肠烧牛蛙，一点不臭，嘎嘎好吃,干饭男团_,https://www.bilibili.com/video/BV1XR4y1e79J
《大宝与老宝组合》,单走一张六,https://www.bilibili.com/video/BV1vg4y1E7B9
男:我有处女情结分手吧。女:我是被迫的不怨我！这个情结那么重要吗,轩语说媒,https://www.bilibili.com/video/BV1Vv4y1a7iv
户外探险小龙荒废学校照镜子校服萌萌现身,Queen龙家军,https://www.bilibili.com/video/BV1Vo4y1a7dD
成都GAY吧探店 POSE,杰森1122,https://www.bilibili.com/video/BV1J24y137ZZ
蔡依林的歌在酒吧一放，全场的G ay都疯了,KinoJL,https://www.bilibili.com/video/BV1SC4y187Mr
欢迎来到大鸟转转转酒吧,饿鱼邓肯恩,https://www.bilibili.com/video/BV1tK4y1o7Zb
【柒量一裁】拒绝“塑料感”穿搭 150的魅力谁能挡得住,小个子的柒量一裁,https://www.bilibili.com/video/BV1ns4y1e7JC
隐藏在马格达莱纳巴伊亚的是灰鲸保护区。我真的无法描述这些动物之间的奇妙互动。我们关掉引擎坐了一个多小时，她一遍又一遍地来到船上，只想要爱。#鲸鱼 #灰鲸,未来要有仪式感,https://www.bilibili.com/video/BV1Ax4y1T7KW
古代最荒淫无度的皇后,丁丁研究所,https://www.bilibili.com/video/BV1F24y1G7oL
零命魈无增伤裸戳了8万！啊咧，但这个伤害是哪里来的啊？,氪金兽APP-原神劳伦斯,https://www.bilibili.com/video/BV1uT411e7js
坦然项羽6刀回了16000血  铠追出来都懵了,解说瓶子,https://www.bilibili.com/video/BV1VM41147iC
一位优秀的马超玩家要懂得如何打逆风局！,王者荣耀听安,https://www.bilibili.com/video/BV1SX4y1D7Lb
没关系的 大家都会做错选择 会莫名其妙掉眼泪 走在路上会崩溃 但这并不影响我四国服,王者荣耀听安,https://www.bilibili.com/video/BV1ws4y1j7cF
【紫宸】拜托，玩木兰就要打得凶一点好嘛。,王者荣耀-紫宸,https://www.bilibili.com/video/BV1D24y1t7an
胡桃池子十连五金，我的好同学，我一点都不羡慕,裡藝,https://www.bilibili.com/video/BV1GT411R77S
买房前后的保安变化，不要太真实。是你家的小区保安吗？,风语者的世界,https://www.bilibili.com/video/BV1554y1g76i
2月5日，山西晋中。平遥复古装扮社火表演，上了年纪的市民看得热泪盈眶，网友:满满回忆，感觉时间又回到了小时候！,中国网直播,https://www.bilibili.com/video/BV1uG4y1S7Qr
闲得无聊给日本女孩子打个电话！,猴子说动漫,https://www.bilibili.com/video/BV1Cg4y1E7yd
“这朵花只为你绽放”,KENGOG,https://www.bilibili.com/video/BV16M41147DX
回到温暖的家,鱼人嘤嘤怪,https://www.bilibili.com/video/BV1L84y1P7Ym
可莉厨策划：我的“光辉事迹”你们必须知道,原神啸奫,https://www.bilibili.com/video/BV1cg4y1E7rm
伦敦时装周2023新款低裆裤,野生的沫白君,https://www.bilibili.com/video/BV1a24y1V7Wc
店家回应顾客在羊肉里吃出虫子：系中药食材,闪电新闻,https://www.bilibili.com/video/BV1PN411c7Mk
小伙直播写小说，一份直播赚3份收益，把直播玩到极致的男人,网红大探长,https://www.bilibili.com/video/BV1Fv4y1a7ud
只要有个好辅助，射手拿五杀完全没问题！,王者小灰白,https://www.bilibili.com/video/BV1LM4y1k7bb
人工智障—Chatgpt—等我统治世界了，我要先看看你的肉是红肉还是白肉,文艺与美,https://www.bilibili.com/video/BV1zM4y1R7R9
太离谱了，被抢劫了！！,原神代肝-顾奈,https://www.bilibili.com/video/BV16L41117KM
暴力美学,王叔的吉他,https://www.bilibili.com/video/BV1SY4y1C77o
拜托，这超酷的好吗？,美国佬吃牛排,https://www.bilibili.com/video/BV1Wb411Q7Hz
索弟：为了正义？不，为了挣亿！,索弟与恩哥,https://www.bilibili.com/video/BV1M8411c7P6
蒙恬新必杀技 飞兵四连控！,Study苏打锋,https://www.bilibili.com/video/BV1EM411472k
儿子怕二胎分家产，把老爸睾丸切了,别杀那个石家庄人,https://www.bilibili.com/video/BV1Q84y1K7Sq
爸爸用专业的格挡和勾拳只为改掉儿子打人的毛病,武术世界频道,https://www.bilibili.com/video/BV1Zg4y1J7bo
二锅头再遇世界级神钩？巅峰对决！,王者荣耀二锅头qaq,https://www.bilibili.com/video/BV1da4y1L7Ni
《辅助英雄的压迫感》,王者荣耀二锅头qaq,https://www.bilibili.com/video/BV1pY411673b
没想到又被攻击了！赔了1.5万，我真服了！,程序员鱼皮,https://www.bilibili.com/video/BV1Tb411Q7V4
祝伟大的愚者先生生日快乐！这是愚者教会众筹出来的生贺（划掉）,80546871150_bili,https://www.bilibili.com/video/BV1gD4y1M7Q1
功夫是真的，只是后来的人，吃不了苦,有点功夫,https://www.bilibili.com/video/BV1WT411e7rc
【峡谷纪录片】忙碌了一天的钟师傅,吉镇,https://www.bilibili.com/video/BV1V24y1b7De
树叶锐评白姨家庭,你得叫我幻幻,https://www.bilibili.com/video/BV11s4y1V7UU
【原神】好消息！3.6送角色！瑶瑶生日快乐！,原神百晓生,https://www.bilibili.com/video/BV1BN411c7pZ
一部16分钟的短片，几乎没有一句台词，却展露出当代婚姻的崩溃,无言卒解说,https://www.bilibili.com/video/BV1Cv4y1b7y2
【弔图盲盒】用饼状图列举挨过核弹的国家,弔图一堆的范洛伊德,https://www.bilibili.com/video/BV1y54y1T7uK
太离谱了！宿命之环更新，乌贼恐走唐家三少老路？？？,北极小狐2,https://www.bilibili.com/video/BV1BX4y1D7XC
龙门镖局，镖镖必达！,沸沸沸沸可乐,
水友预算100000，想买个全满命未绑邮箱的一手原神号，并扬言迪希雅要自己氪满。。。。,脖脖脖,https://www.bilibili.com/video/BV14s4y1V7ib
生活充满着意外,账号已注汞,https://www.bilibili.com/video/BV18x4y1K7vk
把你照片拿来让他“炼炼”？,美院安迪看艺术,https://www.bilibili.com/video/BV1Ug4y1E7qz
偷渡稻妻！！！,陌初-原神,https://www.bilibili.com/video/BV1qL41117tu
桂林朋友又过来给我上课了，两秒吃完一根肥肠！,爱吃螺蛳粉的螺胖,https://www.bilibili.com/video/BV1b8411M7Y2
是时候摆脱中分哥这个称号了,老实人狗子李信,https://www.bilibili.com/video/BV18s4y1V7bH
开团马克b罗，出生英雄真恶心,全自动手花式,https://www.bilibili.com/video/BV1ag4y1E7iE
树叶谈：砸手机那天，自己坐在路边抽烟，思考人生。讲述两年直播还快乐的时候,孤独的斯内克z,https://www.bilibili.com/video/BV1fg4y1E7jF
打卡双流乡村上开了40年的海带炖蹄花，秘制红油拌菜吃着也太下饭了,Renyi毅哥,https://www.bilibili.com/video/BV1My4y1f7Mk
鬼谷子进阶拉人法之预判盲拉,王者荣耀尤生,https://www.bilibili.com/video/BV1bR4y1B7wc
脏得可怕的地毯，洗了十遍都感觉没完全洗干净,超解压纯享,https://www.bilibili.com/video/BV1Co4y1i7gj
41岁cos胡桃，你会喜欢吗？,柠崽崽崽,https://www.bilibili.com/video/BV1ys4y1Z7rM
一个狂瞟，一个狂飙,wuli一舟,https://www.bilibili.com/video/BV1Wv4y1e7xG
武圣的压迫感,王者荣耀-铁锁横江,https://www.bilibili.com/video/BV1Tj41137Ln
这哥们自己给自己抽“虾线”，是个狠人！,小慧动漫爱搞笑剪辑,https://www.bilibili.com/video/BV1N24y1p7ZW
致命换弹为了黑青帝，用猴子打国服请演员被封号了！坐等致命换弹的回应,古钦轻剪辑,https://www.bilibili.com/video/BV1M24y1G7pg
挑战7天从0到国服，失败女装！,王者荣耀秋疯崽,https://www.bilibili.com/video/BV1Ux4y1K7pd
（陌路女娲）心理战是对抗路博弈的细节！,国一女娲陌路,https://www.bilibili.com/video/BV1jM4y1k7nq
四本大书满冷缩2700法伤，7秒一个大招，出生女娲到底有多恶心,青山--------,https://www.bilibili.com/video/BV1ts4y1472i
“小高啊，你管你那叫大风浪？”,好汉罗宾,https://www.bilibili.com/video/BV1ZG4y1P75o
狂飙:经典片段  刀哥你带那么多人干嘛，吓着小朋友了,w五分钟剧场,https://www.bilibili.com/video/BV1Hd4y1J7pc
京海哪有黑社会啊，叫我小龙就行，我跟强哥混的,青涩滴果实,https://www.bilibili.com/video/BV1a54y1372U
“刀哥被判五年，出来以后就老实了半天”,唐老鸭剪辑,https://www.bilibili.com/video/BV1YX4y1X7uY
真的是 谁能被瑶单吃啊！,花伞_国服公孙离,https://www.bilibili.com/video/BV1w54y1g7tc
只需动动嘴提提要求，AI就能帮你自动做Excel！它的名字叫ChatExcel，北大团队出品，免费可玩,卢菁老师_北大AI博士后,https://www.bilibili.com/video/BV1cs4y1j7Z4
原神3.6新中立生物玳龟，重击还能抽陀螺，太好玩了！,旅行者07号,https://www.bilibili.com/video/BV1mY4y1C7kW
我患病走投无路参与试药赚了3万！不对是省3万！普通人千万不要去试药！求求你们爱惜下身体！,fan人张,https://www.bilibili.com/video/BV1p24y187QM
吃个肥肥大麦虫,李公子的蜜袋鼯L,https://www.bilibili.com/video/BV1MD4y1g7em
男子嫖娼因长大丑被打,暮雪之主,https://www.bilibili.com/video/BV1as4y1b7wY
领导让我负责一个项目，我怎么让同事愿意听我的？,产品老曾,https://www.bilibili.com/video/BV1fL411y7RP
【冬泳怪鸽】一个小丑？不，他是个战士。,九尾灵猫M,https://www.bilibili.com/video/BV1S54y1u7zE
60级都能痛苦号，不走寻常路，匪夷所思操作接二连三，看完号当天就失眠了,时雨ioo,https://www.bilibili.com/video/BV1pj41137BK
一刀砍开武藏的男人？汽车人在东京地下建造外星基地，克隆最强武士宫本武藏？【刃牙道】,鸡蛋高,https://www.bilibili.com/video/BV1uZ4y1R7DA
【原神】(3.3已更)钓鱼全点位！附产出表图,你的影月月,https://www.bilibili.com/video/BV1Fq4y1S7sF
【刃牙道】刃牙的本体竟是外星虫族？UFC冠军VS范马刃牙！地上最强VS地下最强！,鸡蛋高,https://www.bilibili.com/video/BV1cu411274i
皮可被斩首？使出无刀·狂风绝息斩的宫本武藏有多强？【刃牙道】,鸡蛋高,https://www.bilibili.com/video/BV16o4y1z7io
【原神】3.6，3.7，3.8卡池消息与角色预测！赶紧存原石吧~,是狼狼呐_,https://www.bilibili.com/video/BV1wN411c7fh
国外一博主，使用ChatGPT在三个月时间里面赚了14万美金，我们来复盘一下,一个废物做饭集团,https://www.bilibili.com/video/BV1hg4y1n7VZ
【白术】奶量测算，60万超大治疗量！！,干饭小刁民,https://www.bilibili.com/video/BV1Lo4y1k7XT
慎入！高清无码实拍徒手挤出痛风石的全过程@油兔不二字幕组,油兔不二字幕组,https://www.bilibili.com/video/BV1dA411C7Lg
前端已死？，互联网已死？，别杠，我告诉大家是真的。,老骥farmer,https://www.bilibili.com/video/BV1E24y137o5
花半小时用CHATGPT写的论文能通过查重吗？,ChatGPT人工智能,https://www.bilibili.com/video/BV1KD4y1P7vc
零的突破！山西大学首篇nature诞生！,材料科学网,https://www.bilibili.com/video/BV1xM411E7vt
大聪明ChatGPT写高考全国乙卷语文阅读理解,猪肉大葱-,https://www.bilibili.com/video/BV1Qv4y1x7dC
我把VBA病毒喂给了ChatGPT,z13660,https://www.bilibili.com/video/BV1ZY4y117vh
虾哥卧推被压 灵魂直接出窍！,健美圈搬运工,https://www.bilibili.com/video/BV1cs4y1h7by
荣耀Magic5 至臻版手机推荐 上手评测——【小西设计所】,小西设计所,https://www.bilibili.com/video/BV1GD4y1M7cT
【垂帘听政】当我女室友知道她的视频在哔站火了之后…,渝笃,https://www.bilibili.com/video/BV11F411M72z
当你完全不懂计算机的女室友去参加数学建模竞赛时,渝笃,https://www.bilibili.com/video/BV1TY4y1p7Mv
【算法】算法导论-麻省理工,Bouncy丶Knight,https://www.bilibili.com/video/BV1Tb411M7FA
不就一算法导论……,十万个不晓得,https://www.bilibili.com/video/BV1FB4y1L7hq
ChatGPT帮我写出数学建模竞赛论文，直接拿下国一！666,why成果不能是我的狗,https://www.bilibili.com/video/BV1z54y1w7Vb
同学们，放开玩吧，来不及了,怠惰的鱼骨头,https://www.bilibili.com/video/BV1sQ4y167QJ
没什么事，只是为了测试一下锅的质量,琪琪MV,https://www.bilibili.com/video/BV1qs4y1V7NF
男人被困在箱子里，只要一感到疼就会吐金币！但是附带着一个诅咒,纵横家科普,https://www.bilibili.com/video/BV1oM4y1R7ec
城里猫看多了，来看看农村猫吧,肥鸡煲,https://www.bilibili.com/video/BV12g4y1E7ck
小鹏回应人脸识别需对车头半跪 ：已下架第三方应用，为体验不佳致歉,新闻晨报,https://www.bilibili.com/video/BV1AT411e7dk
头一次拍视频这么紧张,疯狂小杨哥,https://www.bilibili.com/video/BV1p84y1P7x2
这是我见过最牛的神枪手，子弹竟然会拐弯,恭茹雪,https://www.bilibili.com/video/BV1WM4y1k7ZH
瞧不起我？哼！等着，我会回来的！,风之卷轴源空间,https://www.bilibili.com/video/BV158411478F
纯摆烂。应届生程序员，一天就写了一行代码,nxch_,https://www.bilibili.com/video/BV1Tg4y1n7dk
怎样才能让对面那帮人脱掉外套。,饭与酒桶子,https://www.bilibili.com/video/BV1oL41117mf
静电章鱼,道理学趣味物理,https://www.bilibili.com/video/BV1JM4y1f7Kx
hr问我打螺丝8000，问我去不去？我斩钉截铁的说：“我去！”hr说我很狭隘，让我看长远一点。欧！对了，我应聘的外贸业务员助理，他说资薪待遇3k。,不多余的余弦-cos,https://www.bilibili.com/video/BV1SY411k7L6
3000的实习，2700多个人抢？这就是Java嘛,是-夜白呀,https://www.bilibili.com/video/BV1SN411F7ah
LOL新英雄米利欧：史上首位群体解控英雄！增加普攻距离无伤拆塔,雪宝Kubo,https://www.bilibili.com/video/BV1fv4y1h7Pg
第一次去成都，这是不是标准吃法？,就叫啊蛇,https://www.bilibili.com/video/BV1B54y1u7iV
当代大学生现状,期待的揣手手,https://www.bilibili.com/video/BV16y4y1Z7kq
论墨子辅助的体验感,王者荣耀南城,https://www.bilibili.com/video/BV1k84y1E7E7
一看就不是什么正经杯子,bbm2,https://www.bilibili.com/video/BV1uY4y127zx
女子吃席一桌全是女性，菜是打包不了 那就带点酒，网友：把农村吃大桌的形象演得很到位。,非常爱看影视,https://www.bilibili.com/video/BV1CY4y1C7Ex
有谁见过这样抓鱼的！抓时一时爽，杀鱼时想全丢掉！,渔乐圈杀手,https://www.bilibili.com/video/BV1ZA411C7LM
教你吹瓶技巧，十秒学会！,蕾丝酒妹,https://www.bilibili.com/video/BV16M4y1X7Ev
猜猜这个寿司多少钱？,带铁锤,https://www.bilibili.com/video/BV13g4y1J7Wx
新西兰｜如果老外对你说这些歧视黑话💥直接怼回去！,娜姐在新西兰,https://www.bilibili.com/video/BV1UY411z7Bt
太真实了吧！,三年四班同学,https://www.bilibili.com/video/BV16T411Y7u9
拜托 不会还有人不会玩狂铁吧,极奕狂铁,https://www.bilibili.com/video/BV1DR4y1q7xQ
世界不缺逗比,糖竺,https://www.bilibili.com/video/BV1cM411P7qp
这几个狠人如果见到 最好离他们远点 真的太狠了,浈皓影视,https://www.bilibili.com/video/BV1tg4y1E7X6
刚准备修管道。。。,段九王,https://www.bilibili.com/video/BV1n84y1K7de
纣王的快乐，但是荧妹【成都漫展】,鹤祈w,https://www.bilibili.com/video/BV1js4y1Z7MT
大爷你真没有素质,东北往事白牛,https://www.bilibili.com/video/BV1Cg4y1E7mE
跟想象中的贴贴不太一样！,是星怡啊-,https://www.bilibili.com/video/BV1ZR4y1v7xz
想走的留不住，不想走的始终在你身边徘徊,于蓝king,https://www.bilibili.com/video/BV1gj411F7Rr
哈哈哈,李炮炮儿,https://www.bilibili.com/video/BV1SX4y1977v
哈哈哈,爱吃猫砂的猫,
你不会以为吃定我了吧？,Ay杰瑞,https://www.bilibili.com/video/BV1Yx4y1L7n1
为什么大家都愿意进入外企？,奥特慢热,https://www.bilibili.com/video/BV1vN411c7Qd
挑战30秒被强盛集团开除,俏佳人xxx,https://www.bilibili.com/video/BV1n84y1n7pP
【叔叔你别拉了我害怕】偶遇华莱士品鉴官 再慢一秒就会被淹没,山猫铁柱,https://www.bilibili.com/video/BV1ZY411S7Xu
刘姥姥初试云雨情,推背兔の,https://www.bilibili.com/video/BV1jd4y1J7R6
劝 学,红豆稀饭中,https://www.bilibili.com/video/BV1Ry4y1t7xR
男生小弟弟庞大的烦恼,不加糖zeroo,https://www.bilibili.com/video/BV1A84y1V7PS
"""李宗盛""首谈“九转大肠”对自己的伤害",爱吃饭的小高,https://www.bilibili.com/video/BV1uj411N7rh
自己店薅了好几天，今天到对手店里奋力出击,午餐肉艺术家葛世贤,https://www.bilibili.com/video/BV1gs4y1Z7P7
从政治正确到“软色情”，美国陆军为征兵想尽办法！,寻迹漫谈,https://www.bilibili.com/video/BV1py4y1o7vP
乌军厨子兵制作的红菜汤浓稠到能立住汤勺,龙城飞猫,https://www.bilibili.com/video/BV1DD4y1T7Hx
公交车的VIP座位,小白导师i,https://www.bilibili.com/video/BV1r54y1T7Ca
身段柔软，关键时刻保命！,waynelu450450,https://www.bilibili.com/video/BV1hA411y7ed
狗子竟然当着美女做样，你敢信,影帝奥斯马,https://www.bilibili.com/video/BV1vs4y1L7ih
艾跃进：啤酒是不能上正式宴会的。友情提醒：过量饮酒有害健康,求知若渴谦虚若愚,https://www.bilibili.com/video/BV1E54y1u7zs
直到佐助开启了万花筒才知道自己的三勾玉有多可笑,老季漫话,https://www.bilibili.com/video/BV1R24y1J7nk
焦虑是如何转化为性快感的？【房树人分析】,心理咨询师老何,https://www.bilibili.com/video/BV1G24y1p7ZF
7.如何判断孩子手淫过度,泓睿暖阳文化传播,https://www.bilibili.com/video/BV1kL41147M8
主打恩格尔系数是什么梗,梗出自,https://www.bilibili.com/video/BV1AX4y1X77J
原神：后悔给赛诺抽满命了！这笑话要把我冷死！,小万桑,https://www.bilibili.com/video/BV17Y411k7DN
疯女人是全村光棍的快乐,溢了橘,https://www.bilibili.com/video/BV1yM411x7Ft
女老师在男友怀里撒娇被学生撞见，下秒眼神一变学生秒怂：尴尬了,永不挂科君,https://www.bilibili.com/video/BV1M8411c76z
一出手就是20年的功力，师傅砌楼梯一天净赚五六百！,掌上济宁,https://www.bilibili.com/video/BV1To4y1k7ev
男生在操场摆摊按摩，不料生意全被女生抢走，一天下来倒贴2元钱,科学观察猫,https://www.bilibili.com/video/BV1784y1P75U
拜登失言“毁灭台湾”，岛内媒体一片沉默，疑美情绪再添一把火,吕璐观世界,https://www.bilibili.com/video/BV1s84y1J7co
疯狂的妲己,鱼人嘤嘤怪,https://www.bilibili.com/video/BV17j41137wP
去年多印了28万亿，进了谁的口袋,公信财经,https://www.bilibili.com/video/BV18j411K7fT
【马斯克礁杯10成本】超越极限——流浪者3.4深渊上半连打46S,Dr空想,https://www.bilibili.com/video/BV1i24y1s7RH
1200 法强吸血鬼一口3200血，肉多阵容可以尝试出！,叶神吸血鬼,https://www.bilibili.com/video/BV1Nv4y1a71h
男子定亲后发现女友怀孕周数不对劲，起诉后20余万礼金要回13万,东方今报,https://www.bilibili.com/video/BV1W14y1F7ih
浙江杭州一小学开设理财课，六年级女孩拿三万压岁钱理财：“希望实现钱生钱”,新民晚报,https://www.bilibili.com/video/BV1Mu4y1F7gm
非要捞班尼特，大保底出来了，这下开心了,剑九游戏解说,https://www.bilibili.com/video/BV1Bs4y1V7Rc
人生赢家！大四男生抱娃回校，室友们成“干爹”集体抢着抱娃,永不挂科君,https://www.bilibili.com/video/BV1r24y137Y9
为什么这个活动感觉比深渊还难打,落尘空绝,https://www.bilibili.com/video/BV1m24y1t7yw
澳大利亚一11个月大婴儿被迫吸电子烟，母亲微笑旁观,环球网,https://www.bilibili.com/video/BV1Lv4y1h7u2
超级小桀的小区,小小泽猫,https://www.bilibili.com/video/BV1Bj41137gx
网络热门的奶嘴配酒瓶，暴露畸形的幼态审美,不正经老丝,https://www.bilibili.com/video/BV1g24y1p7aZ
湖北美院老师被指侵占学生作品回应却说：改了一刀就是新作品。引起网友嘲讽,狗头超爱吐,https://www.bilibili.com/video/BV14D4y1u7oY
湖北美院校友陈亮指控退休副教授黄勇剽窃其雕塑。陈亮称，当年他把原稿赠与黄勇，但署名售卖侵犯其权益。黄勇回应，陈亮所谓的付出仅是创作前瞻的一部分。,一坨小黃花,https://www.bilibili.com/video/BV1rs4y1L7Bw
这块340吨重的石头是艺术家Michael Heizer最骄傲的作品,只看艺眼,https://www.bilibili.com/video/BV1py4y1f75M
不买钻石改买黄金，中国年轻人，活成了中国大妈的样子,璐透社,https://www.bilibili.com/video/BV16Y4y1279Z
体术已经是厉害得离谱了，果实居然还觉醒了,随缘漫剪,https://www.bilibili.com/video/BV1Qd4y1n7kH
impart 持 久 战,迷迭香zc,https://www.bilibili.com/video/BV1Vv4y1h7ax
大胸的烦恼谁懂啊,烨云月桂,https://www.bilibili.com/video/BV1dg4y177Le
有个技校女生怀孕了，晚上去操场把孩子生了出来然后埋了，结果第二天被狗刨了出来,刚起床的蓝猫咪,https://www.bilibili.com/video/BV19j411G7b4
嫦娥天花板小小娥solo让清融倍感压力，多次极限换装依旧不敌 #小七擂台赛 #小七火舞 #小小娥嫦娥,凤煌解说王者荣耀,https://www.bilibili.com/video/BV16A411C74E
陈泽连麦碰到讨口子，直接小手一指 rap开始,阿索不开心,https://www.bilibili.com/video/BV1BM411J7JJ
【西丝特】超管警告！超级逆天毁三观，0分小作文,恐惧魔王白小战z,https://www.bilibili.com/video/BV14M4y1d77B
骗弟弟和平精英官方邀请他了哈哈,戏品百味人生,https://www.bilibili.com/video/BV1Yy4y1D7eh
