title,author_name,url
氧气充足的情况下，昆虫能长到你不敢想象的地步,森林无鹿,https://www.bilibili.com/video/BV1q54y137QD
一些不玩李华的天天负面宣传，严厉谴责跟风黑行为,王玉环是淑女,https://www.bilibili.com/video/BV1kk4y18727
董明珠接受采访称：除了睡觉，脑子里想的都是格力。,五环视频,https://www.bilibili.com/video/BV1HN411c7W2
自己动手拔智齿，无麻药，花了半小时,冯易北VonElbe,https://www.bilibili.com/video/BV1RM4y1o7VZ
国一夏洛特 儒雅的一天！,莫奈kkk,
里维学长近期兽化！,贺拔蚌-抽象频道,https://www.bilibili.com/video/BV1Us4y1L7i7
奸商自曝这种酒水赚太多了！我头皮发麻,尖商胖丁,https://www.bilibili.com/video/BV1wX4y1S7WH
“风痕流”边路肉李白，能抗能打还能跑！,肖洋哥,https://www.bilibili.com/video/BV1BY41167we
千万不要拿公司当学校，学校是教你知识，公司是要你创造利润,红兵环境技术知识,https://www.bilibili.com/video/BV1284y1K7bq
【一阵雨】本届打桩比赛花魁，获得最佳烧鸡奖，打错了最佳时装奖，让雨不自觉地舔了下舌头！,老锦酱,https://www.bilibili.com/video/BV1gs4y157dy
Made in Heaven之《这怎么歪？》,大耳侠,https://www.bilibili.com/video/BV1os4y1L7mv
沸羊羊们如何拖累全体男性,泡椒咸蛤,https://www.bilibili.com/video/BV1i8411c73V
36岁宝妈住市区上千平别墅，八年生六个孩子，奢侈生活让人羡慕,网红多事,https://www.bilibili.com/video/BV1UY411e7vK
当圣遗物本连续十天没有出过双爆之后来了一件双爆——,华火绒草,https://www.bilibili.com/video/BV1dg4y1n71c
理科高考590分想报新闻学，张雪峰:你TM脑抽了吧，别瞎报好吧。,商界大巨鳄,https://www.bilibili.com/video/BV1xM411s7VX
【张雪峰】天堂有路你不走，地狱无门偏要闯。985医学没考上研的多了去了,张雪峰考研知识精讲,https://www.bilibili.com/video/BV16o4y1z7kL
【浪漫世界】新屠夫白骨商人最强玩法 完爆瘟疫守三连，人神来了也得死！,青铜树海,https://www.bilibili.com/video/BV1j24y1g7MM
【明日之后】单刷136精英迷境诡林，毫无难度,格格格鲁,https://www.bilibili.com/video/BV1zL411C7iY
老公两年给了我几千万，但我怀疑他出轨了，我该怎么办？,龙飞律师,https://www.bilibili.com/video/BV1pY4y1y7sM
印度苦行僧在自己的头上种水稻，头上一片绿油油，最后成熟了吗？,時光有影,https://www.bilibili.com/video/BV12T411U72e
每天花4个半小时改作业？！老师真的轻松吗...,进击中的莉莉安,https://www.bilibili.com/video/BV17D4y1M7HB
冠海豹的“告白气球”，雄性海豹为求对象，都好会玩欲擒故纵！,Hi科普君本君,https://www.bilibili.com/video/BV1p24y1G7Dc
盘点七号短短一个晚上，刘伟的小丑时刻,沧天蓝巅峰赛精彩集锦,https://www.bilibili.com/video/BV1pX4y1S7c3
京东晚八点音乐会 | 周深 《卧龙吟》,京东,https://www.bilibili.com/video/BV1624y1b7eV
当初的许家印采访，他是怎么憋住不笑的,院长小狸,https://www.bilibili.com/video/BV1s84y1P7e3
每日一遍，防止抑郁。,钟爱猫和老鼠,https://www.bilibili.com/video/BV1io4y1r7Zi
“公司老总登台演唱，一看就是当年扛着录音机，背着喇叭裤”,华星欧巴,https://www.bilibili.com/video/BV1TY4y1y7Za
放个木鱼在这，笑了也没事,账号已注汞,https://www.bilibili.com/video/BV1w54y1g7NM
看到我纹身怕啦！,田花花,https://www.bilibili.com/video/BV13X4y1Q7q4
民间股神林园:低头看人，身边保姆司机身价过亿,茹果小牛,https://www.bilibili.com/video/BV1KY4y127cP
马保国老师的这一jio踹走了我长久以来的抑郁症！！,深蓝同学吖,https://www.bilibili.com/video/BV1bM4y1R75B
干点无聊的事,小兔裙摆是萝卜,https://www.bilibili.com/video/BV1rY411B7Ls
鼻子长就是有好处,不会咕咕咕,https://www.bilibili.com/video/BV1tx4y1c7oY
【陈子豪】迅雷下载意外暴露 好在豪哥眼疾手快~,陈子豪的剪子,https://www.bilibili.com/video/BV1zD4y1M7Kx
R星出品，必属精品.,欢乐配送员,https://www.bilibili.com/video/BV1SL41117wU
因为神里提前而被迫充满命胡桃的可怜人,夜瞳ちゃん,https://www.bilibili.com/video/BV1w54y1M7Hb
树叶回应最近王者圈的风评,是豆逗菌呀,https://www.bilibili.com/video/BV1jY41167jq
外国的一些搞笑恶作剧,账号已注汞,https://www.bilibili.com/video/BV1q24y1G7JZ
看，连小猫都知道长教训，你却不会,喵喵舵主,https://www.bilibili.com/video/BV1Wo4y1r7Ev
猴：大师，你闭嘴吧！,天气温云,https://www.bilibili.com/video/BV1NY4y117Ky
男子骑摩托大喊侠盗飞车，场面搞笑,不会咕咕咕,https://www.bilibili.com/video/BV1Lj411u7cr
你 是 懂 吃 啵 的 ！,鸵鸟在线吃啵,https://www.bilibili.com/video/BV1fo4y1e7ud
“新鲜的”石油长啥样？怎么把水和油分开呢？来看！,中国石化,https://www.bilibili.com/video/BV1g54y1A7tG
欢迎我的国服第一诺手！原盟含量极高……,氪金兽APP-若麟原神,https://www.bilibili.com/video/BV1LM41147LR
“以前不就是天将降大任于斯人也”,锅锅漫剪Y,https://www.bilibili.com/video/BV1VX4y1Q7LH
玄策打团漂不漂亮主要看拉扯的好不好，我个人喜欢一打九,bili_62100775453,https://www.bilibili.com/video/BV1XM411j77J
飞哥与小佛版降魔大圣？胡桃变成花生脸！,赢霄灏,https://www.bilibili.com/video/BV1ND4y1g7Mu
很有意思的智力解扣24件套，欢迎大家来挑战！,优优趣玩,https://www.bilibili.com/video/BV16x4y1K7FF
还记得当时打团翻到自己的武器嘛,DNF怀旧王有胜,https://www.bilibili.com/video/BV1nN411c7gC
"""百日誓师大会的体育生现状""",小火苗喽,https://www.bilibili.com/video/BV1DT411v78S
女子养的甲鱼被蚊子叮肿，只能先用水给它降温，网友：甲鱼和蚊子是天敌,晴尚旅行,https://www.bilibili.com/video/BV15M411H7Rm
没有特效的元素爆发，看着都还不错,原神代肝-顾奈,https://www.bilibili.com/video/BV1cg4y1J7zW
关于不喜欢体育生，找了两个男朋友都是体育生这件事情！,李记1999,https://www.bilibili.com/video/BV1Rj411M7p5
幻神配元璋，c的你发慌！,-天暗星-,https://www.bilibili.com/video/BV1cM4y1d7H5
小渔赶海遇上“生蚝树”，大海馈赠治愈又解压,小渔赶海v,https://www.bilibili.com/video/BV1Ys4y1b7vf
AMD双核显卡：新跑分领先4080！,司尺音,https://www.bilibili.com/video/BV1HX4y1D7Mv
论原神云玩家,肆夜酱,https://www.bilibili.com/video/BV1bY4y1C74F
cf越南神仙服:只有你想不到，没有游戏里做不到的！,89岁带病晃陀,https://www.bilibili.com/video/BV1Xv4y1h7UW
看到跑步的人随意扔垃圾，是不是很低素质？,跑步教练,https://www.bilibili.com/video/BV1JY411e7zw
动物界感人的亲情，小犀牛看着妈妈的角被割，拼死上前保护！,小右爱萌宠,https://www.bilibili.com/video/BV1aM411A7p9
什么是顶级厨师：杀猪不见一滴血,船长电影解说,https://www.bilibili.com/video/BV1Xo4y1z7m7
你们向往的缅北有多可怕，看完你就知道了！,哈尼影视解说,https://www.bilibili.com/video/BV1L54y1u7wQ
多么轻蔑的笑,why成果不能是我的狗,https://www.bilibili.com/video/BV1s54y1M736
武汉男士理发店武昌男士理发店光谷男士理发店武汉男生剪发哪里好武汉男生染发漂发哪里好武昌男生漂发染发光谷男生漂发染发武汉男生烫发武昌男生烫发光谷男生烫发男生剪发,武汉男士发型脏辫设计,https://www.bilibili.com/video/BV1TT411e7DM
极致手法木兰,是情不是情,https://www.bilibili.com/video/BV1CN411c74u
25米池出发&一腿，体现出短池的优势了。游泳和潜泳自由潜无蹼都是，短池成绩更优。,Benbenben自由潜,https://www.bilibili.com/video/BV1BM411771w
阿诺本人说出了大奥的计划，惊呆麦蔻，这不谋财害命吗,德云一号蔻神,https://www.bilibili.com/video/BV1BA41127zR
二手玫瑰热狗CapperTT联手《耍猴儿》,二手玫瑰乐队,https://www.bilibili.com/video/BV1WT411M7U4
"无差别讽刺！派克特 宝石老舅《你也是个Rapper》""门票差不多七百就以为能挣几个亿""",街头社区,https://www.bilibili.com/video/BV1ht4y147uF
唢呐一响，《命运》炸场！,二手玫瑰乐队,https://www.bilibili.com/video/BV1CT4y1S7YW
二手玫瑰《允许部分艺术家先富起来》（限量版）,二手玫瑰乐队,https://www.bilibili.com/video/BV1j54y1h7nU
二手玫瑰填补了摇滚在殡葬业的空白,志围嶷,https://www.bilibili.com/video/BV1RL411173A
超有动感的切割方块,忧愁收容所,https://www.bilibili.com/video/BV15b411X7dC
可怜的大非酋,hello-明天,https://www.bilibili.com/video/BV1GX4y1S7ys
一个简单实用的东西,带娃的肥猫,https://www.bilibili.com/video/BV1Vs4y157Z1
小奶猫吨个蛋黄 开心到飞机耳了,苏雪猫舍,https://www.bilibili.com/video/BV1oY4y1C7Ni
渣女是如何把我这个老实人逼成几十万粉的视频博主的,豁达同学y,https://www.bilibili.com/video/BV1EN411c7GQ
大学生的遮羞布该扒下来了，学历终将被拉下神坛，一个时代结束了,戗词夺理,https://www.bilibili.com/video/BV1VT411a72y
韭菜到我这就断苗了,追星文盲段黄派,https://www.bilibili.com/video/BV1o14y1n7Nx
超爱蒙恬的,王者荣耀微凉老祖,https://www.bilibili.com/video/BV13g411d7Jt
这才叫操作！知道吗？,王者荣耀微凉老祖,https://www.bilibili.com/video/BV1oY4y1x7y2
手法决定强度指的便是这一刻,风轩夜在世间,https://www.bilibili.com/video/BV1dP4y1f7iJ
纯法露娜，唯一打破绝望阵容的杀招,风轩夜在世间,https://www.bilibili.com/video/BV17D4y1A7B7
刘伟果然没有骗我，露娜大招只有一段,_Echoo-,https://www.bilibili.com/video/BV1tM411J7hn
（陌路女娲）有一就不会有二！切勿挑战娲之尽头的预判,国一女娲陌路,https://www.bilibili.com/video/BV1RD4y1M78y
“每一场死里逃生，都是一种行为艺术。”,王者荣耀听安,https://www.bilibili.com/video/BV1vM4y1k7Pj
“无创”溶脂成了她们一辈子的噩梦,SMG案件聚焦,https://www.bilibili.com/video/BV1sT411a7YR
熊出没中的那些文明语言，这才是精华！,青柠动画城,https://www.bilibili.com/video/BV1Et4y1g7dP
这是一台可以把优点强化到极致的机器，你最希望加强哪个部位？,青柠动画城,https://www.bilibili.com/video/BV1jx4y1T72s
云南“健身猪”全身肌肉走红，一头最高卖8万！健身的网友看完沉默了,新闻晨报,https://www.bilibili.com/video/BV1ix4y1T7AL
沪爷网络选妃想包养农村贫困中专女被拒绝,玛丽莲萌露lulu,https://www.bilibili.com/video/BV1P84y1N7CF
原神底层小代肝第一次接到50W逆天大单！！！,原神代肝咩羊酱,https://www.bilibili.com/video/BV1E24y1b7b8
人生第一次因为不给领导拿快递被开除,过期便当ovo,https://www.bilibili.com/video/BV12v4y1b7rx
离谱！PDD：日本找花魁要60W+RMB 因为财阀有受虐癖！,猪酱的日常,https://www.bilibili.com/video/BV1Jg4y1t7jb
《猫和老鼠》诚不欺我！！,叶子吖OHYEZI,https://www.bilibili.com/video/BV1wN411c7Ge
全程不扣一滴血通关,单走一张六,https://www.bilibili.com/video/BV1Ns4y157eV
天上的星星和沙子一样多，不信你们就数数,蜀犭看漫,https://www.bilibili.com/video/BV1nM411x7Q7
【有棵里里】今天去健身房 衣服又湿透了！又被看光了！,德艺双馨的AGoo,https://www.bilibili.com/video/BV1jM4y1d7Y9
经费原地爆炸！开荒直接遇大哥？从零霸服日记#2,一叮当猫一,https://www.bilibili.com/video/BV12X4y1U75L
【原神】好消息！3.6送角色了！联动角色新衣装展示！巴西惊现原神大楼！瑶瑶生日了！,自由大野猪,https://www.bilibili.com/video/BV1rY4y1C71c
【原神】最全面！3.5原石兑换码大全分享！上万原石先到先得！原神大出血！,自由大野猪,https://www.bilibili.com/video/BV14D4y1u7pm
【原神】必得近1.2万原石获取途径汇总！绫华申鹤卡池上线前一定要拿完！,自由大野猪,https://www.bilibili.com/video/BV1hY4y1176e
【梦音茶糯】提督连麦花式挂电话,ラオあお,https://www.bilibili.com/video/BV1ev4y187AA
这样的配合你羡慕了吗？,第二游走晨sir,https://www.bilibili.com/video/BV1934y1a7RY
鬼备组合 瞬秒文化 视觉盛宴,王者荣耀尤生,https://www.bilibili.com/video/BV1oA4y1f7QP
鬼谷子技能条结束的0.1秒内闪现即可形成延迟拉 使技能范围大一倍,王者荣耀尤生,https://www.bilibili.com/video/BV1wY411Y7qA
《原子之心》6分46秒速通（当前世界纪录）,A9VG,https://www.bilibili.com/video/BV1x24y187dz
季灾，不是垃圾！！！,泽泽熙熙熙,https://www.bilibili.com/video/BV1fd4y177HD
季灾身处更高纬度，易东来是观察者投影负责观察李火旺！,嵞山贤,https://www.bilibili.com/video/BV15M411s7CM
PDD锐评阿尔比恩：充了1000就毕业了，这是我玩过最差的MMO？充钱过程=游戏体验？凭啥MMO游戏就都要装备毕业？这是啥评价标准？,慕凌屿,https://www.bilibili.com/video/BV1aY411i7UU
顶级佛系玩家！要求打深渊还必须满星！主播：建议你融了凌华圣遗物再来！？好嚣张！,黄の岛主,https://www.bilibili.com/video/BV12k4y187qP
【浪漫世界】钢筋按不出来？试试双疲劳吧,青铜树海,https://www.bilibili.com/video/BV1mx4y1T7cc
换作是你 你可以坚持8秒吗,哇咔哇咔wokawoka,https://www.bilibili.com/video/BV1Cs4y1j727
不听老人言把千年僵尸放出来玩，还好有英叔,美佳看电影,https://www.bilibili.com/video/BV1yb4y1f76o
盘点僵尸片中的最强僵尸头,老衲狠疯狂一剪,https://www.bilibili.com/video/BV1Pr4y1g7dM
影史上最强僵尸，不怕阳光不怕符咒，连林正英都做他的小弟,飞上天空的咸鱼,https://www.bilibili.com/video/BV16s4y1L7xp
嘤嘤嘤，凭什么啊,阿嗷嗷嗷呜呜呜呜,https://www.bilibili.com/video/BV1pP411f7wF
我就说《狂飙》拍的保守了，你们还不信，高启强现实原型太猖狂,蜡笔小新啦辣啦_,https://www.bilibili.com/video/BV1to4y1i74c
直女挑战：打卡钕铜酒吧,那就叫茗月吧,https://www.bilibili.com/video/BV14g4y1t713
一个男生必学的三威胁,韩波格_,https://www.bilibili.com/video/BV1m84y1E7FD
活久见！男子下水摸鱼 上岸后裤子秋裤抖出一堆鱼：活人版鱼鹰,襄阳新视界,https://www.bilibili.com/video/BV1d8411F7eN
熊孩子自己作死，阻挡电梯关门，结果当场被夹了,警示君,https://www.bilibili.com/video/BV1Qo4y1z7F9
pdd超高性价比线控刺客信条袖剑,ONLY-ZYulin,https://www.bilibili.com/video/BV1LM4y1d7NQ
男生胸部发育，穿衣难看，又到了尴尬难堪的夏天，该怎么办,刘宾医生,https://www.bilibili.com/video/BV1yD4y1u7Q4
太坏了一堆欺负一个铁丝,智能研发,https://www.bilibili.com/video/BV1454y1P722
专精项羽是真的好杀,王者荣耀-铁锁横江,https://www.bilibili.com/video/BV18Y411r7Eh
当纪录片碰上原神代肝会是怎么样的,原神代肝柚代,https://www.bilibili.com/video/BV1xg4y1n7ef
射洪市人民医院王海全哄骗老人家做开颅手术致人死亡,南家小惟,https://www.bilibili.com/video/BV14s4y187Pq
进校手续只需在网上操作即可！入校时千万别忘带身份证哦！校友在小程序申请入校前，请先在校友社群进行登记哦！,金华职业技术学院,https://www.bilibili.com/video/BV1b24y1G7EY
思路清晰一心想学哲学，张雪峰一句话问懵学生,Fe乐一,https://www.bilibili.com/video/BV11s4y1Z7ju
【韩国搞笑综艺】木偶美女,猪撞树上啦,https://www.bilibili.com/video/BV1n24y1G7zM
肛肠科医生的锦旗，请赐横批,谁是王不逸,https://www.bilibili.com/video/BV1hY41167MS
告诉你原神代肝月入过万的朋友，专业团队接原神代肝代练。,原神盐巴,https://www.bilibili.com/video/BV1wY4y117zs
这是父母帮我选的老公，结婚的时候我哭了三天三夜，嫌他长的丑！结婚三年了，如今他收入全交，家务全包！姐妹们，嫁人一定要听父母的！,小二的猪哥,https://www.bilibili.com/video/BV1BM41147Hn
鹿晨辉的老婆孙思卓没整容前长相很丑，整容后竟然变成女强人,整活男,https://www.bilibili.com/video/BV1284y177ZR
教你4个手指画画~,沙雕公主之一,https://www.bilibili.com/video/BV1Do4y1h7RJ
三观一致的婚姻到底有多爽,高十二哈,https://www.bilibili.com/video/BV1sM4y1R7fb
这才是国服关羽的战歌，千钧一发势如破竹！,没毛录,https://www.bilibili.com/video/BV1cT411e7ss
新款焚烧智能马桶,稻草人南山,https://www.bilibili.com/video/BV1g8411c7wc
《新配队》,梓宸爱公子-原神,https://www.bilibili.com/video/BV1t24y1G7A4
别人放风筝，你放整片天空啊,川剧男孩华华,https://www.bilibili.com/video/BV19x4y1K75j
当老夫子的CD被设置为80……,吉镇,https://www.bilibili.com/video/BV1yT411U7p4
街头偶遇手搓芋泥冰，12一份小料随便选太爽了。,寻味叶达达,https://www.bilibili.com/video/BV1gN411c7D7
刘亦菲用后置镜头自拍，笑死！！！,归了君的日常,https://www.bilibili.com/video/BV1PD4y1M7dD
加强的猴子能打几个！,王者荣耀狗城,https://www.bilibili.com/video/BV1SM4y1S7qB
提纳里突破材料正确刷法,LOL上单剑姬,https://www.bilibili.com/video/BV18M4y1k7Gj
你们见过，新鲜的夏威夷果吗？,b站美食频道,https://www.bilibili.com/video/BV15v4y1e7da
诋毁？？？？,云影2w1老夫子,https://www.bilibili.com/video/BV1oM411j7yo
【社会百态】家政每天做菜偷喝汤后兑水，雇主：每天都在吃口水！,我的女儿名叫瑶瑶,https://www.bilibili.com/video/BV1t24y1b7mZ
加强的孙悟空真的超标了！,王者荣耀狗城,https://www.bilibili.com/video/BV11s4y157Af
模拟海浪的交互式长椅,趣闻分享君,https://www.bilibili.com/video/BV1sN411c7Mc
【原神】这是啥？？反弹球？？,区寸睿,https://www.bilibili.com/video/BV1eM4y1d7Sn
爱护公路人人有责,硕硕一起跳,https://www.bilibili.com/video/BV1vL411Z7Wk
任何技巧在绝对实力面前都是徒劳,花生瓜子6,https://www.bilibili.com/video/BV1gX4y1Q7vV
正常玩家：我又知道曜一个卡墙落脚 下次不走这。单细胞：这曜还不超标？,昊咕睡不着,https://www.bilibili.com/video/BV1t24y1t7hk
老千的手法千变万化唯独这个最罕见,百万影视001,https://www.bilibili.com/video/BV1Ry4y1o7Hx
捷克狼犬 生气了，骂骂咧咧的,捷克狼犬最强护卫犬,https://www.bilibili.com/video/BV18D4y1u7RF
王者代练/骚白谈买跑车,阿鑫代打工作室,https://www.bilibili.com/video/BV1ZX4y1D7aS
让你们见识下狗中博尔特，轻松拿捏国家二级运动员,柯基教练,https://www.bilibili.com/video/BV1Qx4y1K7mN
吃低保遇俩犟种.本来就吃一个低保变成吃仨低保.笑的肚子疼,WithoutYou--,https://www.bilibili.com/video/BV1q84y1P7zH
204分沙阁一命散第一次玩散珐云班，被伤害惊到了,孑星恒宸,https://www.bilibili.com/video/BV1ts4y1b7bJ
小伙为买房，工作劳累猝死,明明杂谈,https://www.bilibili.com/video/BV1E24y1G7YS
[王者代练]这种情况应该好多up都遇到过,阿鑫代打工作室,https://www.bilibili.com/video/BV1HM4y1k7z8
玖缘极致手法李信,玖缘Lx,https://www.bilibili.com/video/BV1qo4y1z7k2
国服韩信登顶出生榜了，你们觉得怎么样,零儿导师电竞工作室,https://www.bilibili.com/video/BV1d24y1G7Ff
国服韩信痛失小韩信,无骚电竞工作室,https://www.bilibili.com/video/BV1w8411A73N
虎爪,霹雳手老顽童,https://www.bilibili.com/video/BV11M4y1k7oD
越南蛤蟆汉堡，你敢挑战吗？,小熊美食说-,https://www.bilibili.com/video/BV1Dv4y1h7rV
"心中无_____,上分自然神。",三桥qzg,https://www.bilibili.com/video/BV1D24y1t7V5
我华一个大招怎么可能秒不掉丝血？,左左丞相,https://www.bilibili.com/video/BV1CT411Q7S3
真.坐地起价！原价八千多的原神号，卖家非要一万多买。。。。,脖脖脖,https://www.bilibili.com/video/BV1jM411s79m
人真的可以刀枪不入？1965年真实影像，告诉你答案！,远清君,https://www.bilibili.com/video/BV1U24y137Ff
有位狂人来扬言56秒吃完五两螺蛳粉破肌肉哥记录，他实力到底如何？,爱吃螺蛳粉的螺胖,https://www.bilibili.com/video/BV1Ss4y1h7Ag
为什么人不能像牛牛一样  昂首挺胸,屑阿猫,https://www.bilibili.com/video/BV1D84y1J7VZ
对不起了牛牛，我真的很需要这个蓝,------暖阳------,https://www.bilibili.com/video/BV1je4y1V7DV
勇敢牛牛，到底我是牛牛还是牛牛是我呢？,鱼人嘤嘤怪,https://www.bilibili.com/video/BV1vM4y1d7TD
切鱼时切下手指头，被装进罐头出售，为找手指买光超市罐头,小光搞笑室,https://www.bilibili.com/video/BV1BD4y1M7vB
喂王总吃香蕉,小明超爱玩,https://www.bilibili.com/video/BV1Ej411F7UH
40度高温，导致粮仓900吨粮食全部发霉腐烂,船长电影解说,https://www.bilibili.com/video/BV1Bv4y1h7Pa
【王者荣耀】没有👋法，全是强度,墨小仟ovo,https://www.bilibili.com/video/BV1ZA411y78v
妇女之友偶遇粉丝了,DD小水本人,https://www.bilibili.com/video/BV1ex4y1T74q
开团英雄出生榜榜二马超！没马英雄真恶心！,全自动手花式,https://www.bilibili.com/video/BV1NL41127XQ
听说我的徒弟小故也用法太乙登上了国服第三？看来我得抓紧努力了,王者荣耀二锅头qaq,https://www.bilibili.com/video/BV1ns4y157JS
致命换弹成功五天冲国服猴，然而第一反应是给粉丝和一些被骂的人道歉！,017游戏解说,https://www.bilibili.com/video/BV1Rg4y1t7R5
这些专精装的设计理念就是离离原上谱,呆阿拿,https://www.bilibili.com/video/BV1iM4y1k7bw
狂 膘,老实人张精贵,https://www.bilibili.com/video/BV1yT411i772
李莲英偷喝羊头汤，喝得满头大汗，却给慈禧吃剩菜,大狗子娱乐,https://www.bilibili.com/video/BV1w24y1h7qj
好牛的双重生剧本！就算要忍受百年孤寂，就算结局早已注定，她依然愿意一次又一次地舍生冒险，踏上拯救朋友之路,秀秀爱妹妹,https://www.bilibili.com/video/BV1Px4y1T73Q
这装机和在药房里抓药一样😂,凉枫-,https://www.bilibili.com/video/BV1wL41127tg
“怕，你就输一辈子”,听云up,https://www.bilibili.com/video/BV12g4y1E7gz
余响能解决宵宫身上百分之八十的毒点,不抽到满命宵宫不改名,https://www.bilibili.com/video/BV1y8411T74c
夜兰：这不就极品水伤杯吗！,梦里迷说,https://www.bilibili.com/video/BV1UY4y1m71a
今天我就替小妹满命优菈出这个头….,原神小磊哥,https://www.bilibili.com/video/BV1Go4y167ne
化粪池它是我用来形容圣遗物的！你们….可恶啊..什么时候…,原神小磊哥,https://www.bilibili.com/video/BV16x4y1K7BB
当你和你的非酋朋友一起刷圣遗物,雷雨Lyy,https://www.bilibili.com/video/BV1U84y1P74b
黑崎真音因病医治无效去世,小城大事小事了,https://www.bilibili.com/video/BV1bj411G7by
《命运2》最新版本入坑游戏测评！steam免费联机射击游戏《命运2》最新版本《光陨之秋》体验如何呢？,吴鸽有理解,https://www.bilibili.com/video/BV1T24y1b71r
1个人做7年！《拼贴冒险传》steam好评如潮双人游戏测评！,吴鸽有理解,https://www.bilibili.com/video/BV1Ug4y1t7ck
中央一锤定音，强刺激结束，房地产大局已定,铁锤观察室,https://www.bilibili.com/video/BV1c54y1g7Sc
中央一锤定音，强刺激结束，房地产大局已定,笔记课代表,
云顶S8.5！1穿12三星烬，一炮毁天灭地,不见美测服爆料,https://www.bilibili.com/video/BV1s24y1b7VT
天选3泰坦剑魔，这也太帅了！,云顶小莫,https://www.bilibili.com/video/BV1cX4y1S7te
1级硬刚诺手？1条命打2条命！上单折磨王！,王氏上单,https://www.bilibili.com/video/BV1ok4y187y7
【七圣召唤】3回合灭队？九条裟罗t0最强卡组！优菈心海强不强？3.5版本答案！,梦轩dada,https://www.bilibili.com/video/BV1fT411v7KD
【七圣召唤】神级快攻卡组，3回合解决战斗，极速拿满上千原石,下饭的曜丸,https://www.bilibili.com/video/BV1ce4y1F7xW
七圣召唤角色使用率排行,鹭宫米亚,https://www.bilibili.com/video/BV1jG4y1g7zZ
还在玩永冻？七圣召唤宵宫超载力克主流！【七圣罐装知识】第4期,提瓦特整活频道,https://www.bilibili.com/video/BV1We411w7Es
在圆笼里，调皮是要挨打的！,格斗-视野,https://www.bilibili.com/video/BV1354y1c7v4
这么新奇的减肥方法，你肯定没听说过！,中医减肥郑笑,https://www.bilibili.com/video/BV13o4y1k7qB
钞票复刻出来后还要做旧，说到做旧就不得不用我家祖传的酱油啦！,钟月鸟,https://www.bilibili.com/video/BV1e54y1w7Kt
原神离谱彩蛋？还有个通道！新的开放世界？！还是bug,DX169,https://www.bilibili.com/video/BV1fj411M7tu
手机：真后悔没烂厂里 ……,B站のJOJO,https://www.bilibili.com/video/BV1bT411e7Mn
机器人帮人脱衣这段，会不会有点诡异和恐怖…,bbm2,https://www.bilibili.com/video/BV1dL411y7KV
提纳里巡林官为什么总穿高领啊,江州司马青衫湿-qvq,https://www.bilibili.com/video/BV15y4y1o7YX
前一局被抢先服马可坑，下一局再次撞车，杰瑞连越双塔将其瞬秒 #杰瑞花木兰 #抢先服马可 #抢先服,凤煌解说王者荣耀,https://www.bilibili.com/video/BV1QM411Y7iA
一点细微的小变化，动作感觉大改变,爵士舞_柳柳老师,https://www.bilibili.com/video/BV1r84y1J7PV
圣遗物极品,原神杨巅峰,https://www.bilibili.com/video/BV1yj41137Jo
讲个笑话曜超标,王者荣耀黎落ovo,https://www.bilibili.com/video/BV1y84y177PD
