title,author_name,url
《 战 狼 3 》预告首播,EX浪客,https://www.bilibili.com/video/BV1Gj41137Vf
全网500万赞的《快乐小孩》阿卡贝拉完整版来啦！！！,Rc过山车人声乐团,https://www.bilibili.com/video/BV1R84y1775e
没想到有一天我会被拉踩，表演一个深渊极速版吧。,飞旋游戏解说,https://www.bilibili.com/video/BV1ZA411B7H2
极限逃生反鲨，玩的就是刺激！,王者荣耀蜜小涛,https://www.bilibili.com/video/BV1L24y1H7Cj
猴哥真棒，猴哥,鱼人嘤嘤怪,https://www.bilibili.com/video/BV1JY41167MC
俄罗斯女人——重型杀伤力武器！（冬泳危险，请勿模仿！）,冰女安娜,https://www.bilibili.com/video/BV1gs4y1o7Zc
I DO 钻石破产，4位数跌至“白菜价”，河南技术占据90%,时光科技研究所,https://www.bilibili.com/video/BV13j411u77v
Bouto-Eve,Iris-Biidan,https://www.bilibili.com/video/BV1fA41127oo
你们觉得魈的双爆极限是多少,乐游-原神鉴定,https://www.bilibili.com/video/BV1u54y1u744
项羽：对抗路的目标是什么切射手,王者荣耀余太白,https://www.bilibili.com/video/BV1j24y1g78d
不得不说单杀之后点夏洛特专属动作真的很帅气诶,奈砂-国一夏洛特,https://www.bilibili.com/video/BV1b24y1G7pq
啊啊啊啊啊啊啊啊啊what's up,这位用户会暴富,https://www.bilibili.com/video/BV1BY41167mx
男人就应该潇洒一点,名扬MYang,https://www.bilibili.com/video/BV15Y41167gB
今麦郎推3元水 ，取名“今矿”，能大卖吗？,食业头条,https://www.bilibili.com/video/BV1yA411y7y9
你来真的啊？,我差不多是块豆腐了,https://www.bilibili.com/video/BV1uG4y1N7Qm
给你10万一个月 没有网络 你愿意住在这里吗,旅游指南员,https://www.bilibili.com/video/BV1Lj411u7VE
极限1wei4视频被曝光！秃崽不是坏女人塌方泪撒直播间！沸羊羊都惊呆了,雾里聆风,https://www.bilibili.com/video/BV11g4y1t7C9
新手：鬼谷子怎么玩？,王者荣耀尤生,https://www.bilibili.com/video/BV1qu4y1F7ie
新手：鬼谷子怎么玩？ 老手：月落乌啼霜满天,山鬼鬼谷子,https://www.bilibili.com/video/BV1614y1a7K9
母亲深夜暴力撞开孩子房间，堵门的书瞬间被推倒：扑面而来窒息感,童年到底是啥,https://www.bilibili.com/video/BV1QM411P79g
AD现状,抱着核弹的刘某人,https://www.bilibili.com/video/BV1NY4y1y7Qo
张颂文老师示范在零下的冷库里演出炎热感来，光看着都一起出汗！,朔涵君,https://www.bilibili.com/video/BV1aD4y1A76T
强哥这个摇头真是摇进了我心里头了,殇璃hg,https://www.bilibili.com/video/BV1814y1c7B8
【狂飙×医院高启强警戒线这段太帅了！】,喵呜不秃头,https://www.bilibili.com/video/BV1js4y1x7TV
安欣警戒线逼退高启强倒放,雨幕远行,https://www.bilibili.com/video/BV1Cs4y1s74E
米利欧R解控测试：可解厄加特大招！可解除点燃/虚弱！,布锅锅,https://www.bilibili.com/video/BV1yY41167bJ
这个大冰块，我都不舍得雕刻了，师妹说那就别雕了，打个孔直接佩戴吧！但直接戴我又怕脖子受不住，太纠结了！大家给点建议呗？,圆润润珠宝,https://www.bilibili.com/video/BV1Zg4y1n7A3
秒回三四千的血量，这就是永动机项羽,尴尬的铁根er,https://www.bilibili.com/video/BV1rA4116791
种门新圣女？1000精通丽莎姐姐横扫深渊！,奈九Nine9,https://www.bilibili.com/video/BV1zX4y1X7Ua
3.7新增五星岩系角色猫女爆料！单手剑护盾角色，或将进入常驻,麻瓜夜鸮,https://www.bilibili.com/video/BV1Mg4y1J7Bg
原神3.6新增许愿池位置,原宝家的小可爱,https://www.bilibili.com/video/BV1vx4y1K7mr
我去除了大部分司马懿的出装，但我保留了一部分,两只沈梦溪,https://www.bilibili.com/video/BV1oM411w7PS
免费深渊，等号，速来,夢里爱吃小笼包丶,
《狂飙》里的肠粉没有加酱油 咋就这么重要？,央视农业,https://www.bilibili.com/video/BV1iY411q7QJ
人均200枚！吃不完的记得做成茶叶蛋哦！,央视农业,https://www.bilibili.com/video/BV1rk4y187fX
【免费加速器】推荐几款免费加速steam社区或加速游戏的加速器（最后一款不需要领取时长和邀请好友直接免费）,BCFFS-博成,https://www.bilibili.com/video/BV1w34y1e7s2
点多少给多少零花钱｜有些人注定发不了财😂就他这手气，可以笑一辈子哈哈哈,TJandClaire,https://www.bilibili.com/video/BV1wY4y127CV
大情人节带女友来穿舌钉，我只能说小伙子你好福气呀。,战神刺青刘老板,https://www.bilibili.com/video/BV1re4y1w71r
手都比人大了,没有WiFi的狗哥,https://www.bilibili.com/video/BV1b24y1n71v
棒子也不是很行啊,尤川_ovo,https://www.bilibili.com/video/BV1X84y1N7Sf
超另类的取火方式，野外求生又学会一招！,哇喔科学,https://www.bilibili.com/video/BV1n24y1b7iV
“耍帅好累，还好哥一直帅〞,德芙元歌纸鸢,https://www.bilibili.com/video/BV1qM41147Nt
边路阿珂可行吗？杰瑞撞车国服阿珂队友，效果没想到 #杰瑞花木兰 #阿珂边路,凤煌解说王者荣耀,https://www.bilibili.com/video/BV1Bo4y1z7SG
过生那天我真在家了自己一天,一味靠,https://www.bilibili.com/video/BV1Fv4y1Y7VX
粉丝拿刀砍人被抓，派出所里写纸条要求请我当律师…,律师老韩,https://www.bilibili.com/video/BV1cv4y1a7j9
【时长6小时】世界上最好听的100首纯音乐合集！可后台播放 可分集播放 治愈心灵的旋律 值得你单曲循环的钢琴曲！,无损音乐合集,https://www.bilibili.com/video/BV1QX4y1Q7cB
鼠鼠我啊都饿扁了……,茉茉与茶茶,https://www.bilibili.com/video/BV1wX4y197L1
255万的勇武宝宝真残暴,梦幻西游手游大陈,https://www.bilibili.com/video/BV1BL411C7Ny
霍金，你小子不起来给领导敬两杯酒？,P1ucky,https://www.bilibili.com/video/BV1cM411479h
美国政府腐败程度比想象中更加触目惊心，看完终于知道为什么了,大V经典语录,https://www.bilibili.com/video/BV1KT411Q7dE
“就这节目，直接碾压蠢晚”,十万个冷沙雕,https://www.bilibili.com/video/BV1yA411y76k
貂蝉出全肉居然没人打的动！不可思议！站撸都不怕,嘴碎的貂多鱼,https://www.bilibili.com/video/BV1wM4y1S7x5
女子宰活鱼掏出一把“面条”，吃完鱼才知道是寄生虫，网友炸锅,速看视界官方,https://www.bilibili.com/video/BV1Ng4y1J7iD
给孩子吃狗尿的野菜，把孩子饿到贫血，粒粒妈为吃有多不择手段？,老哥扒娱,https://www.bilibili.com/video/BV1Zs4y1f7rf
逆天网友想凿王大奥 问麦蔻怎么办！,健美圈搬运工,https://www.bilibili.com/video/BV1L14y1c7Mi
手提袋饮料漏出数米，地铁内无一乘客提醒！疑似男子玩手机着谜？,汉闻,https://www.bilibili.com/video/BV1Cy4y1f7kP
我该叫什么？！,老龙女和扎克,https://www.bilibili.com/video/BV1cL411y7ML
王者荣耀2块钱黑奴的代练要笑死我了,是苏摩啊,https://www.bilibili.com/video/BV1QM411P7y9
Python脚本，零秒抢购原价茅台，秒赚一千，这比什么兼职都管用！！！,暴躁的大水牛,https://www.bilibili.com/video/BV1uD4y1M7A6
【AI绘画】革命性技术突破：ControlNet,大江户战士,https://www.bilibili.com/video/BV1XA411m7s2
"我,一个初中牲,受某老师委托,搭了个ChatGPT镜像......",mywwzh,https://www.bilibili.com/video/BV1B24y187uZ
我们8个人曾经加起来身家超过2个亿！,j-mac0,https://www.bilibili.com/video/BV1c24y1b7XH
火舞：请直视我，李华,林蒙三指火舞,https://www.bilibili.com/video/BV1hM411x7kS
这玩意能成为数学压轴题也是相当震撼的,不忘初音的Lana,https://www.bilibili.com/video/BV1xL41117jE
狗头吧老哥：这小丑真没法打！,阳光男孩小丑熊,https://www.bilibili.com/video/BV1as4y1h7te
女子悔婚男子要回40万彩礼，女子不肯给竟招来70刀夺命！彩礼血案,挖沟连彭沟长,https://www.bilibili.com/video/BV1yk4y187Y1
哈哈哈哈才艺展示,DD小水本人,https://www.bilibili.com/video/BV1Z8411F7xU
道诡新世界观被引出？李火旺经历的一切是平行世界？,嵞山贤,https://www.bilibili.com/video/BV1TX4y1S7kL
米哈游就是看到这个统计结果才让派蒙这么问的吧,王厨大胜利,https://www.bilibili.com/video/BV1No4y1k7tW
战鹰发现自己过气了，竟然直播给自己买流量包，难到真的被鹰爸说中了？【欢乐时刻】,欢乐时刻official,https://www.bilibili.com/video/BV1XD4y1M7Yd
当我差几局稳国标，定榜之夜连拿太乙，玩的就是自信！,时间只玩辅,https://www.bilibili.com/video/BV1aP411f7qo
最后我才知道，我努力照顾着的重度抑郁的女朋友，抑郁的原因是她出轨,放空一段时间,https://www.bilibili.com/video/BV1w24y1G7S7
真，我在现场看狂飙,风息左岸平,https://www.bilibili.com/video/BV1sM411E7QH
【原神】帮粉丝打深渊，怎么还有意外收获 ！？,搞笑の燕子,https://www.bilibili.com/video/BV1HP411f7fM
好恶心 都去死,美羊羊の,https://www.bilibili.com/video/BV1bo4y1i7nc
伍六七之暗影宿命,,
说唱新世代,,
一堆毫不起眼的“烂泥巴”，却成了海昏侯墓中最值钱的东西,世界未解之谜M,https://www.bilibili.com/video/BV1ys4y1b79b
“压力面前，保持优雅”!,木兮子爱影视,https://www.bilibili.com/video/BV1kY41167T8
原神热门梗图,清色の风,https://www.bilibili.com/video/BV1V54y1g7dC
还是上单项羽猛，一打三都轻轻松松没压力！,王者小灰白,https://www.bilibili.com/video/BV1yx4y1T7qD
今天带的这位萌新有点重量级…,梓宸爱公子-原神,https://www.bilibili.com/video/BV1JM4y1k7RB
硬核跨国界，印度VS巴基斯坦上天堂系列,快快到碗里来呢,https://www.bilibili.com/video/BV17Y41167wi
牌可以每天都打 但是圣遗物不是每天都能出货的,无笙丷,https://www.bilibili.com/video/BV1T24y1g7EC
看好了，班尼特是这样玩的,原神李太冲,https://www.bilibili.com/video/BV1SX4y1D7Sx
《战狠训练营2》豆瓣不敢评分,抽象人呵杉,https://www.bilibili.com/video/BV1wo4y1k7Yp
猫咪你好烧啊～,♂梦落成空,https://www.bilibili.com/video/BV19j411M7BT
〖 看着挺简单，试了一下，现在还在医院躺着呢！〗,海外视频LV,https://www.bilibili.com/video/BV14s4y1V71u
胡桃：心海还在追我，TMD!,亣忽悠,https://www.bilibili.com/video/BV1Nb411R7z8
这蛇毒不毒,一路云流,https://www.bilibili.com/video/BV1Z24y137hF
变瘦才是一个男人变帅的最低成本,华西室友の日常,https://www.bilibili.com/video/BV1T841137jK
“弗罗里达州一男子睡觉时被妻子打了一枪，但他没有死”沙雕图片【一二三】,-QingHai-,https://www.bilibili.com/video/BV14s4y1V7fT
反野这个词目前是家喻户晓，但不是人尽皆知,王者荣耀李皓辰,https://www.bilibili.com/video/BV1Ps4y1a7NH
后悔7年前没有翘晚自习：“好学生心态”暴露什么问题？,壹心理,https://www.bilibili.com/video/BV1c84y1N7js
17K签约作者：目前大三，写网文月入4000+（网文作者访谈）,爱斯基布拉斯基-竹子,https://www.bilibili.com/video/BV1zN411c7nj
大舅哥你可千万不能种堕了啊，赶紧回归蒸发把，绫班香钟上下六间连打满星。,爱翻车的回忆,https://www.bilibili.com/video/BV1G54y1M75X
原来现实中的商战这么朴素😂,贝尔塔的空间站,https://www.bilibili.com/video/BV1ET411e7xU
你居然是这样的锅巴,鸢一天羽,https://www.bilibili.com/video/BV1a8411u73w
灰太狼把废羊羊社的头皮发麻，子弹瞬间就打空了！,青柠动画城,https://www.bilibili.com/video/BV1ug4y1J7KW
非   宏   勿   扰：灯王诞生,就叫我邱刀鱼吧,https://www.bilibili.com/video/BV1Rs4y1L7qt
信仰的敌人,清寒国一雅典娜,https://www.bilibili.com/video/BV1q24y1t7FQ
小两口玩的挺花阿,我今晚必早睡_,https://www.bilibili.com/video/BV1AT411e7vz
大学生组团到工地吃盒饭，“主打的就是让学校反思一下”,上游新闻,https://www.bilibili.com/video/BV1GX4y1Q7xw
人民网评怒批小黑子！,一筐猪居,https://www.bilibili.com/video/BV1Gb411f7M2
《九块八变5万》,---歌姬---,https://www.bilibili.com/video/BV1Tj41137X3
使用Chat GPT 购买大乐透与双色球 第一期,早春一颗树,https://www.bilibili.com/video/BV1Ng4y1p7nF
上周掉粉凉风Kaze、田野上的繁荣、拜托了小翔哥等【B站UP主2023年03月第1周掉粉报告】,biliUP观测者,https://www.bilibili.com/video/BV1qg4y1E7Fz
妙龄少女几十天没上厕所，灌肠后一怒之下喷堵医院厕所！,16YYi,https://www.bilibili.com/video/BV1rM4y1k7DJ
四位翻车吃播如今怎么样了？卖劣质产品、吃腐烂龙虾、天价探店，哇塞几张，小贝饿了，哎呦阿尤 田野上的繁荣,憨落落yyds,https://www.bilibili.com/video/BV1yv4y1b7ps
时雨ioo千舰瞬间 大夫激动的话都不会说了,松原鸣清QAQ,https://www.bilibili.com/video/BV1Bj411K7ju
玩1年半一抽都没有，全四星最高1命，教练：我想满星！,时雨ioo,https://www.bilibili.com/video/BV1K84y1V7Cd
55痛苦号级练歪凑不出2队，大世界都痛苦，转战另类玩法游戏体验飙升,时雨ioo,https://www.bilibili.com/video/BV1Zv4y1b7RJ
喜欢上一个双性人，最好还是做好不能在一起的准备,南千代,https://www.bilibili.com/video/BV1Qs4y157rT
探店齁鼻多真假学生说，两个字，别来,刀哥要当真ikun,https://www.bilibili.com/video/BV1QM411j7mk
像不像半夜起来玩原神，却忘了调亮度的你,地蛋游戏日报,https://www.bilibili.com/video/BV1gT411e7MD
“震惊，一名无名英雄捐了二百个肾脏给医院。”沙雕图片【一二五】,-QingHai-,https://www.bilibili.com/video/BV1cs4y1j7p1
马桶里的尿姤，竟是传世灵丹妙药,倪师国学舍,https://www.bilibili.com/video/BV1u24y1s7rH
三斤的鸭子，两斤半的嘴啊,秋彤和奕辰,https://www.bilibili.com/video/BV1gD4y1g7vd
韩信：就问你这野区是不是31秒出？,_Echoo-,https://www.bilibili.com/video/BV1ix4y1K7PF
狗是人类最忠诚的朋友,我名字特长啊,https://www.bilibili.com/video/BV1L54y1g7so
“白嫖”高启强8年全身而退，《狂飙》里最鸡贼的就是这老头,一夜书屋,https://www.bilibili.com/video/BV1H84y1P7Te
【原神】0命赛诺别再乱玩了！唯一款顶级激绽队，让你的赛诺提升35%！,暖笙小憨猪,https://www.bilibili.com/video/BV18X4y1D7PN
2023.3.3 广东大铿——2023中国男主播年鉴,文言文练习生李军,https://www.bilibili.com/video/BV13o4y1r73e
我只是一个平平无奇的身法蛋,浩丑丑,https://www.bilibili.com/video/BV1Kv4y1h78q
老师向学生扔马蜂窝,瓜の木鱼,https://www.bilibili.com/video/BV1H8411c7bK
为什么我的胡桃宝贝伤害那么低啊！有没有人来帮我看一看,hello-明天,https://www.bilibili.com/video/BV1pM411s7Ns
终于知道小灰灰为什么姓小了，原来红太狼早就给了小白狼！,青柠动画城,https://www.bilibili.com/video/BV1Kx4y1T7oV
预测一下被说超标的英雄,木河123,https://www.bilibili.com/video/BV1UY4y117nu
千万不要为了四星下池子，为此我撕心裂肺。天啊！80多抽一只班尼特都没有。,hello-明天,https://www.bilibili.com/video/BV1j24y1b7UT
没击中是为了让他伏法吗？,每周六散文,https://www.bilibili.com/video/BV1VX4y1Q7g6
闲鱼资助了一个国家栋梁,龙解放,https://www.bilibili.com/video/BV1Do4y1z73m
我努力那么多年的意义，就是为了赶上别人的起点…,佐神-核弹流佐伊,https://www.bilibili.com/video/BV1q84y1P7u5
29w 原石入坑3个月又肝又氪的萌新抽卡记录……,老爹ODD,https://www.bilibili.com/video/BV1n24y1G7VF
E5-妹法安春黑似似花水黑-2150w/1950w,ojkce,https://www.bilibili.com/video/BV1ob411Q7Zn
这就是为什么幼杀是传奇《倒数的时刻》韵脚检查“无论天堂还是地狱我都不再有退路”,青柠QINGNINGl,https://www.bilibili.com/video/BV1PX4y1S7k3
【赖神】老夫子天花板级教学，想知道赖夫子和老夫子的差距在哪吗？！,赖神无所畏惧,https://www.bilibili.com/video/BV1T24y1g7hK
日本萝莉直播中被老妈突击，忘记静音本音暴露,CHARLY-チャリ,https://www.bilibili.com/video/BV1Ng4y1J78e
杨玉环自奶大加强！钮祜禄环环回宫！妲己加强！一技能冷却缩短！,包包入侵SSR,https://www.bilibili.com/video/BV1CM4y1k7Mw
直播睡觉第一人，弹幕彻底失控,小鱼干游戏菌,https://www.bilibili.com/video/BV1is4y1L7Bu
震惊！【第一次满星】一块钱让主播帮我凹1小时！已播1坤年，白嫖之友，萌新救星消灭所有未满未通深渊,苏唐苏唐苏唐,https://www.bilibili.com/video/BV1Mo4y1i7nT
哥哥在看成人书，妹妹却故意展示身材，直接被哥哥扑倒,虾秋秋,https://www.bilibili.com/video/BV1L84y1P7M5
继母把侏儒当3岁，有机会小伙就出手，晚上继母就异常舒适,联连看,https://www.bilibili.com/video/BV1sv4y1h7xh
小龙探险2023-03-04-荒废居民楼老黑邻居留小龙【高能预警】,铁板小笼包,https://www.bilibili.com/video/BV1o24y1t7gL
二本 校园招聘会,四年生九重凛,https://www.bilibili.com/video/BV1i24y137ZZ
一个过于大胆的故事，《谐铎.兔孕》,璐璐的声音图书馆,https://www.bilibili.com/video/BV1QX4y1D74b
大伙觉得我石头人玩的怎么样,虎牙狮子v,https://www.bilibili.com/video/BV13D4y1M7qX
深夜恋爱瘾发作,建德保安大队长,https://www.bilibili.com/video/BV1kv4y1b7CL
我的散兵怎么会杂技呀哈哈哈,游戏酱小叶,https://www.bilibili.com/video/BV1PX4y1Q7if
预制红油只需3秒,南北调料破解-刘老师,https://www.bilibili.com/video/BV1HR4y1v7cd
带着妹妹去“发泄室”的哥哥，被她的表现惊呆了...看完怀疑当代年轻人的精神状态！,YouTube精彩视频-,https://www.bilibili.com/video/BV17Y41167Vi
球场一个rapper，我没开玩笑,韩波格_,https://www.bilibili.com/video/BV1wx4y1T7qr
互动体感足球游戏,山窝窝居士,https://www.bilibili.com/video/BV1tT411v7NH
“安慰了 但是忍不住”,江南第一暖男1,https://www.bilibili.com/video/BV1nM41147dy
原神真摆烂玩家着实是有点上头，看着都要高血压了！,氪金兽APP-原神劳伦斯,https://www.bilibili.com/video/BV15g4y1J7cd
刚哥光速四破看傻观众，在剑姬最强的版本还不跟刚哥学起来？,许秀不可秀,https://www.bilibili.com/video/BV1hg4y1H7k2
“ 如花：我真的会泻！”,云朵儿影视-,https://www.bilibili.com/video/BV1nX4y1D7va
游戏建模欣赏 3d建模 vam c4d 3dmax untiy Blender 虚幻引擎5 CINEMA 4D,Elvis游戏玩家,https://www.bilibili.com/video/BV1oy4y1Z7LF
充电线：为了手机，对插座使用快充吧,璃月3G鸭,https://www.bilibili.com/video/BV1bg4y1J7rS
他应该是家喻户晓的硬核玩家了吧#硬核玩家,超燃爱剪辑,https://www.bilibili.com/video/BV1d24y1V7pJ
进来的真有眼光（doge）,路鸣极限,https://www.bilibili.com/video/BV1co4y1k765
救命啊这件事情在大学圈真的很炸裂啊，北外，你别太离谱啊,GREADERT,https://www.bilibili.com/video/BV19j411M7L3
【养号能手】看号时长两年半，我看到了梦寐以求的面板！「3.5版本第01期」,荧岁镇太辰,https://www.bilibili.com/video/BV1AY4y127dm
【神罚】搞笑队友日常,神罚Warth,https://www.bilibili.com/video/BV1Ag4y1J7KH
小超梦诺手被瑞文6级一套秒杀，锐雯斩杀线真的太离谱！,许秀不可秀,https://www.bilibili.com/video/BV1fY411k71D
太神奇了 小伙3D打印的杯子要6000肺活量才吸得到水,启庞科技3d打印机,https://www.bilibili.com/video/BV1624y1G7DB
国产汽车质量检验战场,一心想要更好的憨憨,https://www.bilibili.com/video/BV1CD4y1T7EP
不好笑算我输《2》,上点梗,https://www.bilibili.com/video/BV1eD4y1M7cb
2pac 说唱界真正的暴徒,Streetlife街,https://www.bilibili.com/video/BV1cg4y1J7FX
绒毛种植眉毛,深圳专注你的眉,https://www.bilibili.com/video/BV1fY411z7pR
"老年泰森vs15岁泰森的空击 ""拳击 ""泰森",先知-麦克,https://www.bilibili.com/video/BV1uX4y1Q7hY
开眼了！用木棍在尿液里随便划拉一下，就能诊断出这个人的病情！,科学觅探,https://www.bilibili.com/video/BV1ny4y1o749
那些极具讽刺的名言,人民有信仰1949,https://www.bilibili.com/video/BV1XM411x7C9
白术+赛诺超激化反应，实战演示！赛诺要崛起啦～,往生堂丶雨,https://www.bilibili.com/video/BV1gX4y1Q7ci
《舍友的反差》,马走日出,https://www.bilibili.com/video/BV1fs4y1o7o9
崩坏三完结版本新老玩家现状,-总有刁民想害正,https://www.bilibili.com/video/BV1Q8411F7yG
真的开眼了！带着鸡毛直接腌制的鸡，看完后你还敢下嘴吗？,科学觅探,https://www.bilibili.com/video/BV1wg4y1J7PX
国服露娜,小孤寞,https://www.bilibili.com/video/BV1Hj411K7Li
教官让女生光脚练习踏步,跳海自尽的鱼丶,https://www.bilibili.com/video/BV1RM4y1d7hx
是个狠人手断了还不忘录视频，请勿模仿,世界新鲜事-,https://www.bilibili.com/video/BV1ZX4y1S7Jo
全自动化早餐，懒人福利,德比利,https://www.bilibili.com/video/BV1k54y1T7S7
钓鱼技术又上涨了！,小海锤石,https://www.bilibili.com/video/BV1p84y1P7YF
曾经的辉煌一去不返 ，大船哥怒吃两盘牛肉盖面，风卷残云真过瘾,大船食刻,https://www.bilibili.com/video/BV1Bs4y1V74p
你进去社会，受到过哪些委屈？,爱睡觉觉的猫咪呦,https://www.bilibili.com/video/BV12x4y1K7s8
R星出品，逼属精品,欢乐配送员,https://www.bilibili.com/video/BV1X54y1u7CS
奇门功夫，高手在民间，精彩表演，双枪伺候，钢丝缠脖子,祖传传统防身术,https://www.bilibili.com/video/BV1zN411c7VP
7天拿下大国标，喜提有史以来最大鸡腿！！,你的通天代,https://www.bilibili.com/video/BV1Ng4y1J7Kb
85级区合吸血鬼！,梦幻西游万磁王,https://www.bilibili.com/video/BV168411c7Fh
发财的周一！想箱子小能手！,梦幻西游万磁王,https://www.bilibili.com/video/BV1bD4y1M73K
［完整版］让兄弟1000块买路人丝袜,别杀那个石家庄人,https://www.bilibili.com/video/BV1aT411i7xz
”兄弟你上把那么菜？这把通天代？“   LOL史上第一缝合怪，共享账号挑战！,守护茶茶,https://www.bilibili.com/video/BV1Mj4113711
55级拉起来能打的角色都凑不出2队，痛苦号的天花板！,时雨ioo,https://www.bilibili.com/video/BV1C44y197cY
【前方高能】这应该是全网最长的一把刀了吧,含亮老师,https://www.bilibili.com/video/BV1HM4y1k7c2
全网寻找这个倒霉鬼,这里有垫狐星儿,https://www.bilibili.com/video/BV1eN411c7y5
阿力木假背景实锤？特效小哥还原制作全过程！央妈亲自下场撑腰,拾一说好剧,https://www.bilibili.com/video/BV1gs4y1o7uJ
福寿螺卵：是不是玩不起？,佛山大保键师傅,https://www.bilibili.com/video/BV1qt4y1u7BJ
“福寿螺”战士6,知屎粪汁,https://www.bilibili.com/video/BV1MT411q7CB
把工业化产品当成招牌菜，曾经的老饭庄哪去了—鸡毛店川菜,特厨-魏味,https://www.bilibili.com/video/BV1os4y1L7RD
饭店老板娘带大厨学习风味烤鱼，表皮干香，麻辣适中，这么经典的美食，大厨吃完能学会吗,大嘴儿美食挠儿哥,https://www.bilibili.com/video/BV18N411c7gJ
隋卞一探 | 这可能是探店以来最血亏的店了……,特厨隋卞,https://www.bilibili.com/video/BV1hN411c7Wg
未成年+游戏=网瘾少年,财经小辉辉,https://www.bilibili.com/video/BV1TM411s7Tm
狂飙名场面，但是是反话，一次看过瘾！,暴躁老哥艾火影,https://www.bilibili.com/video/BV1oj411M7nx
差点以为自己要交代在这颗痘痘上了,Tamholo,https://www.bilibili.com/video/BV1zM4y1o734
【两次连麦完整版】内蒙古状元？两次考试735，738.5  张雪峰：清北踏烂你家门槛！,张雪峰讲报考,https://www.bilibili.com/video/BV1h8411P7ve
内蒙735分 嘎巴一下 给我整不困了,王大聪明丫,https://www.bilibili.com/video/BV1pg4y1E75T
《高等数学》同济版 全程教学视频（宋浩老师）,宋浩老师官方,https://www.bilibili.com/video/BV1Eb411u7Fw
宋浩高等数学 配套笔记,--初寒--,
神罚想拉树叶去必胜客被弹幕扎心：树叶和白姨去！罚：我自己去别叫！,游戏BBQ,https://www.bilibili.com/video/BV1kA41127RC
《树叶谈，神罚住我隔壁》现在晚上天天一起玩。树叶白姨神罚《三人行》,孤独的斯内克z,https://www.bilibili.com/video/BV1uT411e7BQ
《树叶谈，神罚住我隔壁》现在晚上天天一起玩。树叶白姨神罚《三人行》,划水狂魔金鱼,
不运动轻松瘦20斤❗无痛减肥经验分享，科学减重才能不反弹！,王不土土,https://www.bilibili.com/video/BV1dG411E7Bm
我做陪玩被小富婆撒币的经历，互相救赎的恋爱故事……,汤姆莱纳w,https://www.bilibili.com/video/BV1Qs4y1V7rQ
"果然，强大的补给才是制胜的关键。（专业动作请勿模仿）  """,闰土给猹反杀了,https://www.bilibili.com/video/BV1gb411D71D
[爬虫]scrapy框架入门实战-爬取当当网python类图书信息保存至MySQL数据库-scrapy爬虫框架快速入门-MySQL数据导入,不是PI是PI,https://www.bilibili.com/video/BV1hZ4y1H7xT
python爬虫连接数据库基本使用,耿泽天,https://www.bilibili.com/video/BV1mY41137uR
教你如何将爬虫获取到的数据保存到数据库,Python老辣条,https://www.bilibili.com/video/BV1xA4y1o7Zv
《原神上古神器》余响爆伤头！举世无双？23.3的暴击率？,晨萌新原神,https://www.bilibili.com/video/BV1q24y1t7Em
不会还有人不知道狂铁的强度吧,极奕狂铁,https://www.bilibili.com/video/BV1kM411Y7zN
参考一下就行了，活成什么样是靠自己的。,李记1999,https://www.bilibili.com/video/BV1Gj411u7PL
6D全新体验,台湾糯米维,https://www.bilibili.com/video/BV13L411172L
