title,author_name,url
史诗巨制！提瓦特历史唯一指定教材,混沌恶仙贝,https://www.bilibili.com/video/BV1ET411Y7VT
真就白送啊？！再大的折扣在0折面前也失去了光彩！【本周steam史低游戏推荐】3.3-3.10,初夏ChuXXia,https://www.bilibili.com/video/BV1vo4y1r7no
❤归来去兮女士的心动魔法❤,ユニコーン单推人,https://www.bilibili.com/video/BV1Hb411D78G
坎瑞亚人对话，但是家属陪同,ACR-5,https://www.bilibili.com/video/BV1KY4y117qK
“如何坐高铁”事件背后：厌蠢症暴露什么心理？,壹心理,https://www.bilibili.com/video/BV1DM411x71v
史上最准！守夜人金皮必出秘诀,第五人格块乐,https://www.bilibili.com/video/BV1b54y1u7TW
【原神3.5】丘丘人摘下了面具  深渊王子就此诞生！,eee花凋零,https://www.bilibili.com/video/BV1854y137Ua
隋卞一探 |米其林东北菜？止观小馆特厨测评！,特厨隋卞,https://www.bilibili.com/video/BV1x24y137t8
“废羊羊”既双标还滥用职权，这一集从头讽刺到尾！,青柠动画城,https://www.bilibili.com/video/BV1124y187oF
【原神】原神旅行大电影！顶级8K画质！-「晴天雨露」,万老板,https://www.bilibili.com/video/BV1ro4y1r7e3
"""诸位，可愿为本帅俯首？“",王者荣耀听安,https://www.bilibili.com/video/BV1dj411g7GD
60级究极鼠王，玩2年不刷圣遗物，看完号整个人都不正常了！,时雨ioo,https://www.bilibili.com/video/BV1bG4y1M7p5
全四星，无班尼特香菱行秋久岐忍，1.0泳动队,时雨ioo,https://www.bilibili.com/video/BV1H84y1K78t
散兵睡得像个小猫咪一样哦,八叠砰砰,https://www.bilibili.com/video/BV1LR4y1v7dA
【散兵/流浪者动态LIVE2D】耗时一周的动态来了！！我也秃了（那种语气）,狼本来力,https://www.bilibili.com/video/BV1DD4y1T7aL
一群up主在城市玩共享位置捉迷藏！肾上腺素飙升！！,中国BOY超级大猩猩,https://www.bilibili.com/video/BV1Uv4y1h7Gb
【原神】囤了大半年的原石，找主播抽满命夜兰，结果。。。,Leah莉娅又迟到啦,https://www.bilibili.com/video/BV1a84y1K7MG
【刘伟需要尿检的瞬间】,书雪名场面,https://www.bilibili.com/video/BV1t84y1p7Y1
劲舞团这是高手,放荡不羁昌昌,https://www.bilibili.com/video/BV1SY411z7H7
韩涵痛哭！首次回应下播事件，愿大家一切安好！,云兽解说王者荣耀,https://www.bilibili.com/video/BV1ms4y1o7sS
慰安夫到底有多可怜3,丁丁研究所,https://www.bilibili.com/video/BV1bs4y1j7ie
那就拿出我30个月零提升的影宝浅挥一刀吧！,王小美真的很美丶,https://www.bilibili.com/video/BV1s54y1371L
纳西妲主c赛道3.4上半连打52s (19+16+17),是校长大大,https://www.bilibili.com/video/BV12R4y1i79s
嬴政震撼实战！一局只能用一次的大招！,上班被累死的脚本,https://www.bilibili.com/video/BV1VM4y1d7Lp
雷雨挑战5分钟赶到5578米外的主线任务地点,麋鹿鹿ヽ,https://www.bilibili.com/video/BV1rb411D7Nv
绝活vs绝活？对面很强？不好意思我也很强~!,阿泽u稻草人,https://www.bilibili.com/video/BV1js4y1Z7BE
如果一个正常仙侠世界的修士穿越到道诡异仙的世界会怎样？,大眼比目鱼,https://www.bilibili.com/video/BV1NX4y1D7Dt
为什么留不住高端人才？院士出国吃2年清水挂面，正教授年薪10万。,北方娱乐,https://www.bilibili.com/video/BV1VX4y1X7qw
大妈把钉子当呼吸系统,日常常笑,https://www.bilibili.com/video/BV1BL411Z7xn
【软又湿】不存在这世间的替身力量！夺取一切的泡泡！！,笙声的声,https://www.bilibili.com/video/BV1PT411Q774
超越灾厄的替身！融合才是最高贵的替身觉醒方式！【JOJO替身集JoJoLion#1】,酒客小丑,https://www.bilibili.com/video/BV1jW4y1C7EB
傻眼了，王大奥居然是男的！,健云社,https://www.bilibili.com/video/BV1ZT411i76a
突发！王大奥不是女人，而是男人！常熟阿诺一直在跟男人谈恋爱！,整活男,https://www.bilibili.com/video/BV13A41127KU
当我问ChatGPT有哪些可以观看的色情网站,卿半之L,https://www.bilibili.com/video/BV14T411v7oV
用上手机的耀扬，四杀五杀信手拈来，观众：你藏得可真深啊！,桑榆游戏解说,https://www.bilibili.com/video/BV1zT411U7oM
耀扬忘记是在直播！合着平时是在装菜？,云熙电竞,https://www.bilibili.com/video/BV1YM411E7Vb
科幻片团战！解压,第二游走晨sir,https://www.bilibili.com/video/BV1Ps4y177NG
猴子：王昭君透视，勾引我！,七彩猫-国服王昭君,https://www.bilibili.com/video/BV1U24y1V7WK
【宇晨】这个马可你能打几分？,王者荣耀国服马可宇晨,https://www.bilibili.com/video/BV1B84y1K7BH
卡维这个四星是不是给低了？,孤胆野狼01,https://www.bilibili.com/video/BV1PY411k7NE
工地组建临时夫妻，厂花每天被服务10回，连吃饭还要加班加点,小白莱说,https://www.bilibili.com/video/BV1cX4y1D7LG
【明日之后】不小心把火刀分解了！,格格格鲁,https://www.bilibili.com/video/BV1aM411x7aV
扫地大爷潜入银行金库盗走上吨的钻石,鲁东南梅姐,https://www.bilibili.com/video/BV1Yx4y1F7dp
九条：是将军大人，斯哈！斯哈🥵,5940-DIE,https://www.bilibili.com/video/BV1g54y137tu
短短的十几秒，CPU烧了俩，内存条都烫弯了,社会老胖虎,https://www.bilibili.com/video/BV16g4y1J7YN
飞碟有没有可能是这样起飞的,UFO地外信息直播平台UFO,https://www.bilibili.com/video/BV1LY4y1176F
6ix9ine 可算是活明白了,Streetlife街,https://www.bilibili.com/video/BV1m84y1p7oK
不由你不笑系列之委屈小眼神,爆笑段子风,https://www.bilibili.com/video/BV13b41197gt
小乔:你最好有事,鱼人嘤嘤怪,https://www.bilibili.com/video/BV1jb411D7Af
不由你不笑系列之兄弟之间那点事,爆笑段子风,https://www.bilibili.com/video/BV1kM411A75X
开心消消乐：6381关，彩星通关！,假装岁月靜好,https://www.bilibili.com/video/BV1rM411x7BG
【屑27】千万别抽班尼特，全是实话快点看！,屑27,https://www.bilibili.com/video/BV1kT411Y7RX
看一次笑一次,帅帅的非洲小黑哥,https://www.bilibili.com/video/BV1xb411D7L1
熊孩子自己作死，用脚阻挡旋转门，结果当场被夹,警示君,https://www.bilibili.com/video/BV13Y411k7TZ
情侣日常｜男生单身时vs恋爱后,一个欢喜,https://www.bilibili.com/video/BV1Us4y1Z7Yx
酒吧必学魔术教学,阿杰魔术吖,https://www.bilibili.com/video/BV1DA411y7PM
高科技透视眼镜，女老师戴上之后吓一跳,一帆电影解说,https://www.bilibili.com/video/BV1Mv4y1s7Zv
骨头里隐藏的这些秘密，你知道吗？,哇喔科学,https://www.bilibili.com/video/BV1hY411r7Eu
萌新的疑惑,原神张公义,https://www.bilibili.com/video/BV1T54y1A7mC
纳粹军官让女人举枪射击自己的丈夫,船长电影解说,https://www.bilibili.com/video/BV19v4y1h7nD
水母头你散着的时候它是水母头～ 很多时候你可以让它变成其他发型 哈哈～ 不香吗？ 就真的是可塑性很强😏#刘格格 #骗你生女儿 #水母头,_刘格格_,https://www.bilibili.com/video/BV12v4y1h7Ku
男生边爬泰山边给妈妈录视频，“社交悍匪”属性拉满！,掌上济宁,https://www.bilibili.com/video/BV1dv4y1h7aw
如果你一年不刷牙，会发生什么？,日常常笑,https://www.bilibili.com/video/BV1Tj411g79g
老外和中国人起冲突，女子扬言：我们也是本地的,裕泰茶馆常客常四爷,https://www.bilibili.com/video/BV17L411175r
当前对抗路T0霸主,王者荣耀南城,https://www.bilibili.com/video/BV1Ls4y187kC
魔鬼辣椒小米椒打汁，红烧鸡头，再放点鲍鱼增加鲜味,干饭男团_,https://www.bilibili.com/video/BV1XY41167gx
萌新：什么是愚人众？,梦兮玩原神,https://www.bilibili.com/video/BV12s4y1L7h6
用十几只猫换一只猫，你愿意吗？,42号星球,https://www.bilibili.com/video/BV1WY411k7uj
想输都难！,搞笑迪迦哥,https://www.bilibili.com/video/BV1mj411g7jU
每天都是在不断的崩溃，又不断的自愈中度过，少看一会手机，多做一点事，换来的是一个开心的妻子和温暖的家庭,争气奶爸,https://www.bilibili.com/video/BV1mX4y1Q7GL
伤敌0 自损一千,董赤赤973,https://www.bilibili.com/video/BV1E24y137dT
仅凭10块钱去赌场狂赢2500万,船长电影解说,https://www.bilibili.com/video/BV1bg4y1J72W
清华女博士沉浸式凡尔赛，幼儿园到博士都读清华，祖孙三代清华人。,娱乐导读,https://www.bilibili.com/video/BV18j41137mS
第一第二哪里去了捏 怎么一起消失了。,椛繖里,https://www.bilibili.com/video/BV1aM4y1Z7wV
TGC时尚盛典，渡边直美封神名场面，不愧是天然的减速带,大山无敌小旋风,https://www.bilibili.com/video/BV1gy4y1Z75r
历年宿舍最变态的趣事,今日排行,https://www.bilibili.com/video/BV1eg4y1E7QV
原神专武使用率最高的角色，快来看看有你喜欢的吗,幺幺玩原神,https://www.bilibili.com/video/BV1g84y1K7ox
修理厂4s都在用的剐蹭修复小妙招.免喷漆划痕修复 #车立美补漆笔,大光车品,https://www.bilibili.com/video/BV1824y1t7Fw
看着小，磨完就很大得做根管治疗了！,口腔科邓教授,https://www.bilibili.com/video/BV1Jj411M7mG
后期生存能力最强射手,王者荣耀南城,https://www.bilibili.com/video/BV1WT411v73E
言出法随的最高境界，就连撒旦都被一招秒！,小吾艺剪-,https://www.bilibili.com/video/BV1R54y1g7PX
地狱里有一条奇葩的规定,尚映雪,https://www.bilibili.com/video/BV1sM411E72o
今天的羊腿有点小,小艾哥哥阿,https://www.bilibili.com/video/BV1Y24y137qG
【哥谭/杰罗麦个人向】天生的恶魔Simply and Sanely,菜得像个大师宇,https://www.bilibili.com/video/BV1r4411S7ds
小丑伪装十年植物人，为了等待她回归。,安笑剪辑,https://www.bilibili.com/video/BV12x4y1j7CA
“你不是他”企鹅人已看清谜语人人格已经消失，感觉企鹅人好伤心,老坛串甜驴,https://www.bilibili.com/video/BV15Y411x7Fr
【杰罗麦个人向/高燃/踩点】斯文败类,我的阿季,https://www.bilibili.com/video/BV1Xt411t7ud
蝙蝠侠：不好意思，请出去，我把你家给买了,东哥大气,https://www.bilibili.com/video/BV1NL4y1h7e4
《哥谭》布鲁斯·韦恩炫富名场经典语录：“下面的数字对你来说可能有点多”!!!,土霉素5,https://www.bilibili.com/video/BV1Uz4y1Q775
韦恩:总有人用她的家产挑战我是零花钱！,五七可可,https://www.bilibili.com/video/BV1zQ4y1o7cV
小丑的悲惨一生，人都是被逼出来的。,安笑剪辑,https://www.bilibili.com/video/BV1hv4y1Y7Ar
lck新版龙王赛场首秀！落后一万经济打出一波奇迹团！！,电竞弹幕君,https://www.bilibili.com/video/BV1Js4y1Z7Hq
张雪峰快被所有大学拉黑了！接到哈理工的律师函，真是啥话都敢说,新疆说娱乐,https://www.bilibili.com/video/BV12Y411r7DX
原神  这样的海底捞你会去吗？,原神明天过后,https://www.bilibili.com/video/BV1Kj411374c
小伙儿手把手教你吃龙虾,家常百味,https://www.bilibili.com/video/BV1Cd4y1E7FT
HR这么打压求职者，不太好吧,院长小狸,https://www.bilibili.com/video/BV1r24y137y8
一个舞的是金箍棒一个舞的是定海神针,社会老胖虎,https://www.bilibili.com/video/BV1NM4y1d7r5
我是懂押韵的！,钟离的纳西妲,https://www.bilibili.com/video/BV1xA411m7m8
诸葛亮大招关键时刻要用滑的！,王者荣耀蜜小涛,https://www.bilibili.com/video/BV1oM411x75i
打了好多字，又删了，算了，没意思,趣闻分享君,https://www.bilibili.com/video/BV1Z24y1874b
待太久就太硬了,聚猿创团队,https://www.bilibili.com/video/BV1JT411Y7kT
这里没有锚点，地图也不显示，还放在最偏僻的角落！！！,小柠檬原神,https://www.bilibili.com/video/BV12M411x7SY
满级人类太多，不出动重锤火花是压不住了,-红眼X-,https://www.bilibili.com/video/BV1K24y1h7rh
抗打断能力有多强？,神明往心里,https://www.bilibili.com/video/BV1KL41117yL
正常么,二龙湖杰哥,https://www.bilibili.com/video/BV15j41137uV
【王者荣耀】回不来的永远回不来,墨小仟ovo,https://www.bilibili.com/video/BV1yY411z73o
以后你看我还刷不刷…,梓宸爱公子-原神,https://www.bilibili.com/video/BV1XN411F7MR
为什么没有人敢打假疯狗拳陈鹤皋，看完这个视频你就明白了,泵铁故事汇,https://www.bilibili.com/video/BV1Xg4y1J72Z
温蒂大战深渊法师整活失败,人鱼PDD在线,https://www.bilibili.com/video/BV12R4y1q7yE
潘多拉就要这样玩！,阿助今天有工资吗,https://www.bilibili.com/video/BV1x24y1n7VA
【原神】 氪宗强者，恐怖如斯！真正的“天胡”开局！,搞笑の燕子,https://www.bilibili.com/video/BV1mR4y1e7GN
元歌、项羽纪录片《无想的一刀》,烟火打烊,https://www.bilibili.com/video/BV1bY411e7iq
大型纪录片《专精项羽》震撼播出！,阿秀纪录片传奇,https://www.bilibili.com/video/BV15D4y1G7Nx
盘点各大主播被专精项羽整破防名场面 ！,巴倒过来,https://www.bilibili.com/video/BV16v4y1e7NX
再见了我的50分圣遗物，153229836的旅途该到此为止了,雪下南枝,https://www.bilibili.com/video/BV1fM4y1R7E8
【日常】如果你想骂我就留下你的身份证号，随便骂,Destroy针灸术士,https://www.bilibili.com/video/BV18D4y1u789
我真的我哭死，pdd拼单29块一个月卡，再也不找代充了,北冥UK,https://www.bilibili.com/video/BV1Ee4y1v79a
水友预算6000，想要个全图鉴还带十几个UP满命百黄的原神号。。。。。,脖脖脖,https://www.bilibili.com/video/BV15b411Q7JY
“千万不要凝视深渊! !”,樂逍遥_,https://www.bilibili.com/video/BV1Ab411X7uM
王者代练/今天给大家科普一下呢,阿鑫代打工作室,https://www.bilibili.com/video/BV1z54y1u7uH
为什么越来越多的人喜欢反派？#祁同伟 #,公务员干货,https://www.bilibili.com/video/BV1oo4y1Y7nc
能分手么？心碎。,真の轻薄的假象,https://www.bilibili.com/video/BV1ev4y1Y7jN
硬核练拳你怕了吗摄像机都捕捉不到的手速,武术世界频道,https://www.bilibili.com/video/BV1D84y1J7hG
95后女生 父母陪考研 结果自己落榜 父母双双上岸,红星视频,https://www.bilibili.com/video/BV1ZM411x7g6
马龙：我唱着唱着，怎么这东西飞我手上？,嘻哈帝国hiphop,https://www.bilibili.com/video/BV1524y1V7Vc
【原神】米哈游：加双暴算我输！,YAG丶圣遗物不歪真君,https://www.bilibili.com/video/BV1r24y1W7Sk
工作了将近40年的农民工，一年的真实收入,阿汪正传,https://www.bilibili.com/video/BV1ss4y1h7u4
古法姜竹茹～竹皮底底下第二次刮出来的叫竹茹，加姜汁润过后烤至焦黄,百草园日记,https://www.bilibili.com/video/BV1pY411k7ZV
我确定了，这招就叫小鱼飞踢了怎么样,榆木楠楠,https://www.bilibili.com/video/BV1rs4y1f7rR
上完厕所的卫生纸可一重复使用 你见过吗 洗干净了接着用,晓强学知识,https://www.bilibili.com/video/BV1Hv4y1s7N5
看得出来小哥很迷茫！！！,原神代肝-顾奈,https://www.bilibili.com/video/BV1e24y1V7zK
嘿嘿，这花木兰不行啊,于蓝king,https://www.bilibili.com/video/BV1h54y137Jj
这竟然是真实的考研复试回答现场,考研云,https://www.bilibili.com/video/BV1fY411z76H
每个成功的高渐离，背后都有一个默默付出的钟馗。,王叔的吉他,https://www.bilibili.com/video/BV1hY4y117fu
55-老鱼-曾经的强制交易，你还记得吗？,DNF音乐人,https://www.bilibili.com/video/BV1UD4y1378u
#原神 #圣遗物强化 #圣遗物 #磬弦奏华夜 #萌新泽圣遗物配乐挑战赛 兄弟们，以后看我直播且看且珍惜，说不准什么时候就下播了,陌殇王者露娜,https://www.bilibili.com/video/BV11R4y1B7eX
满级扯犊子。,搞笑迪迦哥,https://www.bilibili.com/video/BV1x8411F7C7
一时不知谁是主角,美国佬吃牛排,https://www.bilibili.com/video/BV1LL411f7es
因为一个技能爱上一个职业-鬼剑士-武器节制,DNF音乐人,https://www.bilibili.com/video/BV1pv4y1Y7x7
“不要怕，我很丑，但是我很温柔！”,一只小鱼吖-,https://www.bilibili.com/video/BV1DY4y127Wc
单人通关八，太极限了，被这狗装到了！,套路狗阿狗,https://www.bilibili.com/video/BV1db411R7cn
学生时期的，你珍惜过，过去吗？还是珍惜现在与未来吧。朋友人生短短几十年，做好自己吧！,不是吧吧吧吧吧吧BB,https://www.bilibili.com/video/BV13T411Q71p
装13男,阿信手游电竞,https://www.bilibili.com/video/BV1Bg4y1J7Dy
“ 霸王是假霸王，虞姬才是真虞姬！”,影视不停格,https://www.bilibili.com/video/BV1y84y177Mb
班尼特卡池首日流水超过艾尔海森和魈,绘希推_书记,https://www.bilibili.com/video/BV1gY4y117LY
整个保安界也是相当炸裂的,冷song,https://www.bilibili.com/video/BV1Sj411g7sr
这个够给力了吧，弹射起步的喇叭,千元hifi,https://www.bilibili.com/video/BV1ws4y187DE
美工与策划再次打架,绘希推_书记,https://www.bilibili.com/video/BV1FL41117wt
我不懂但我大为震惊,彬彬找乐子,https://www.bilibili.com/video/BV1Yv4y1a7sK
山东成武嘣鸡怪才自创大杂烩嘣鸡，爆米花机改装，美味鲜香，飘香四溢！,小本创业项目日化用品,https://www.bilibili.com/video/BV1K24y1h75t
被哥逮到就把你变成英雄碎片,小禾火千,https://www.bilibili.com/video/BV1J54y1u7hG
小七擂台solo赛，遇上拖米KPL唯二不败的安琪拉，结局有些意外 #小七擂台赛 #小七火舞 #拖米安琪拉,凤煌解说王者荣耀,https://www.bilibili.com/video/BV1PY4y1m75C
“洗牌这一幕，梦回1989！”,一盅情怀,https://www.bilibili.com/video/BV1Ko4y1r7aj
大招拐弯，帅的批爆,榆木楠楠,https://www.bilibili.com/video/BV1BX4y1Q71k
牙套矫正过程，牙套多少钱,牙疼的喵喵喵,https://www.bilibili.com/video/BV15j411N7pQ
S1897+红嘴=歪瓜都给你一枪带走！！！！,B0B0-hungry,https://www.bilibili.com/video/BV1Gg4y1p7Eo
王者荣耀代练/王者代练想稳一个大国标有多难,阿信手游电竞,https://www.bilibili.com/video/BV1Yy4y1f7Wh
不当人之《辛辣天塞》,国家二级飞行员,https://www.bilibili.com/video/BV1Ds4y1h7xP
身兼五职月入12万的程序猿办公桌长啥样,程序猿白瑞,https://www.bilibili.com/video/BV1NM4y1d7rN
不会真的有人下一次火本就毕业吧,苏打乌龙,https://www.bilibili.com/video/BV1fv4y1a7Jo
歹徒：本来只想劫个财,丁丁-搞笑,https://www.bilibili.com/video/BV1BM4y1S7mJ
《 出 门 小 心 杯 》,终级渔夫,https://www.bilibili.com/video/BV1p54y1P7bB
凡人也妄想对抗神明,冷song,https://www.bilibili.com/video/BV1LL411f7Ke
王者代练/骚白谈25岁九天狐,阿鑫代打工作室,https://www.bilibili.com/video/BV1Eb411Q7g9
印度人的刺激战场,抽象狠活放映室,https://www.bilibili.com/video/BV1mv4y1W7jD
【原神】迪希雅+夜兰大世界，蒸夜体验,死仔包小丸,https://www.bilibili.com/video/BV1i8411F7Ph
这片球场的水太深，最好别趟,野球场脏老师,https://www.bilibili.com/video/BV1iY411i7aB
知道怎么抽卡了吧,游戏酱小叶,https://www.bilibili.com/video/BV1a84y1N7zN
26秒没有一帧是多余的，全是戏,囤囤鼠__,https://www.bilibili.com/video/BV1r24y1875n
劳动人民总结出来的智慧经念,阿杰要好好生活,https://www.bilibili.com/video/BV1z24y137tq
看把这哥们烫的，嘴都烫歪了,虚张绅士233,https://www.bilibili.com/video/BV1ks4y1j72K
稀有象形拳种鸭形拳，看似好笑其实稳健,武术世界频道,https://www.bilibili.com/video/BV1sy4y1o7Nk
摩纳哥科技之夜，震撼人心，绝对的视觉冲击。,音乐环球库,https://www.bilibili.com/video/BV1354y137QG
胡桃:本来就自己掉血，加点防御怎么了？,韩小周丶,https://www.bilibili.com/video/BV1Ls4y1f73r
"20元随便吃 ,在素食餐厅实现碳水自由,炒泡面吃到爽!",小紧张的虫虫,https://www.bilibili.com/video/BV1B84y1K7U3
《人越多我越兴奋》,三桥qzg,https://www.bilibili.com/video/BV1yT411Y7SP
最初的情怀！,DD小水本人,https://www.bilibili.com/video/BV1VM4y1d7Xk
知道套路但还是防不住，这就是实力！,格斗-视野,https://www.bilibili.com/video/BV1nb411Q7of
夜兰核爆教学。,王小美真的很美丶,https://www.bilibili.com/video/BV1fM4y1R7KA
是谁让我来打这玩意的？你真该死啊！根本打不动！,君临天人城,https://www.bilibili.com/video/BV1oD4y1T7KC
当你试过这个你就不想再用别的了,快乐的福星人,https://www.bilibili.com/video/BV1ey4y197Vs
这个粉丝的号，羡慕,剑九游戏解说,https://www.bilibili.com/video/BV1nT411Y7mZ
经典矮人科技,2015年夏_晴天,https://www.bilibili.com/video/BV1Ls4y1o75i
小龙探险2023-03-03-屋顶大钟也爱听周杰伦【高能预警】,铁板小笼包,https://www.bilibili.com/video/BV1ps4y1Z7V4
“趁天空不注意，偷一点晚霞送给你”,Transqa风景,https://www.bilibili.com/video/BV1ND4y1g7aG
狮子喵总结回应BBGG！,BBGG丶狮子喵,https://www.bilibili.com/video/BV1JX4y1D724
一刀破伤风，两刀见祖宗！！！,佐悠-Leisurely,https://www.bilibili.com/video/BV1eN411F7HY
哦？胚子？略使小技！下个大的！,原神小磊哥,https://www.bilibili.com/video/BV1454y1u7UJ
可恶！居然花了我50个小月亮！还好直冲云端了,原神小磊哥,https://www.bilibili.com/video/BV1zo4y1r7UD
优 菈：一 回 两 大，青 春 爆 炸 ！！！,夜丶坠星,https://www.bilibili.com/video/BV1BY4y117MC
【原神】我骂厕化，你们逮着我骂是吧！那我再骂一次！,杜昊十陵,https://www.bilibili.com/video/BV1fY411z78m
《木乃伊》主角时隔23年大变样，沉沦多年后新作冲击奥斯卡,小侠来了,https://www.bilibili.com/video/BV1vs4y1o7Af
归去来兮女士の心动魔法❤,路过的瑞希同学,https://www.bilibili.com/video/BV1qd4y1Y7u9
低情商：痛苦号……,神奇的巅峰,https://www.bilibili.com/video/BV1Fj41137bf
让朋友来接机 她居然cos了我最爱的瑶瑶！！！！,小小的小兔团儿,https://www.bilibili.com/video/BV1h54y1u7QV
听我一记可爱暴击！洗脑原创《见习恶魔》「MuseDash」Buro角色曲【早稻叽】,早稻叽,https://www.bilibili.com/video/BV19Y411z7pc
主播真会玩：百变猴哥连续换脸，恶魔洞主支配大成！#253,是大腿,https://www.bilibili.com/video/BV1xM4y1k7yi
一口气看完《洛基》当洛基看到一抽屉的无限宝石，他世界观彻底崩了,熊猫电影JF,https://www.bilibili.com/video/BV1P24y187FZ
生在欧洲穷国，19岁挣300万，他是全世界最强的步枪手！【NiKo中文纪录片(中)】,话龙电竞,https://www.bilibili.com/video/BV1Xs4y1o7y5
7岁男孩因肌肉太发达，每天都要承受全身206块粉碎性骨折痛苦！,糖影漫画,https://www.bilibili.com/video/BV1Fv4y147iB
【原神音游】今天的官谱是不是有点太难了？,空之杯具,https://www.bilibili.com/video/BV1sa411s7Ly
高人五等！真的牛批！,老杜解说啊,https://www.bilibili.com/video/BV1sv4y1h7Nc
不可思议！童年游戏《死神VS火影》居然还有职业比赛？,硬核豆浆,https://www.bilibili.com/video/BV1CA411y7eQ
我本科毕业3500，我对象专科毕业4600。,阿汪正传,https://www.bilibili.com/video/BV19s4y1j79x
《等 级 森 严》,阳光男孩小丑熊,https://www.bilibili.com/video/BV1oM411x7oQ
民营企业家有多少是好人,财经小辉辉,https://www.bilibili.com/video/BV1sg4y1E7op
这几款饮品让我想起贝爷的“灌肠”手法,张圣叹Yo,https://www.bilibili.com/video/BV1hv4y1h7ok
血压拉满！挑战从零通关造梦无双#8！,一叮当猫一,https://www.bilibili.com/video/BV17X4y1D7nW
大宝：破军留1是我最后的温柔,一介品神,https://www.bilibili.com/video/BV1h24y137un
“本打算以普通人的身份跟你们相处”,倒悬的橘子,https://www.bilibili.com/video/BV15s4y1Z7rJ
51星撞车国一狂铁神罚！全程保姆级针对，逼得他心态爆炸？！,韩翻翻呀,https://www.bilibili.com/video/BV1vt4y1N75X
87星排位，成功狙击国服守约【六尾】！直接把他打到破防？,韩翻翻呀,https://www.bilibili.com/video/BV1nD4y1g7fU
12-3一个萧炎，没开玩笑！,然岚,https://www.bilibili.com/video/BV1rM411x7ss
胡桃这个面板应该算毕业了吧,磊哥游戏,https://www.bilibili.com/video/BV1JL41117M6
来自6星水神的变强之路！,王小美真的很美丶,https://www.bilibili.com/video/BV1h24y1n77f
不好意思，伤害全是阿晴打的！,王小美真的很美丶,https://www.bilibili.com/video/BV1oY4y117dp
起点高启强VS晋江高启强VS海棠高启强,-GhostGhost-,https://www.bilibili.com/video/BV1bj41137KB
天然美食竟让我领悟到了动漫里的绝招,张圣叹Yo,https://www.bilibili.com/video/BV13G4y1w7Ly
Chrome/Egde上为B站启用HEVC硬解,register_bizhan,
一个男孩把一整管止痛膏涂抹在了自己的私处上，这是他的大脑发生的变化,Chubbyemu,https://www.bilibili.com/video/BV1Fi4y1D7cy
一位农夫不慎把兽用抗生素注射进了他的大腿，这是他的器官发生的变化,Chubbyemu,https://www.bilibili.com/video/BV1UY411r7Vv
第一次被辣到需要介入物理疗法,张圣叹Yo,https://www.bilibili.com/video/BV1F8411E7g9
挑战一分钟吃两个taco免单，被认出来提出挑战升级追加奖金！还能成功吗？,橙飞一下,https://www.bilibili.com/video/BV19v4y1h7Ks
144.4万硬币，一次性全部送出去是一种什么样的体验,一点爱送温暖,https://www.bilibili.com/video/BV1c24y1h7oq
愿都有生命都能被温柔对待！,小车顶,https://www.bilibili.com/video/BV1M24y1n7vK
【卧龙 苍天陨落】第二章boss有种打狮子猿的感觉？,青铜树海,https://www.bilibili.com/video/BV1ST411Y7RR
